date,title,content,company
"  March 19, 2023 / 09:31 AM IST  ",Block deals become a bother with too many shares flooding the Street,"A spate of stake sales by institutional investors and promoters seems to spell more trouble for the market with stock prices running into a rough patch since the beginning of this year.Quite a few private equity firms, and venture capital investors have been selling shares through block deals since the start of this calendar year, and market participants expect the trend to intensify given the uncertain macro-economic outlook both at the global and domestic level.Although these blocks of shares are being absorbed, the presence of many interested buyers is resulting in a change in the shareholding pattern from a few owners of large blocks to multiple owners of small blocks. This has led to a more distributed ownership structure.Moreover, smaller blocks of shares are likely to hit the market more frequently, increasing the floating stock, which refers to shares available for trading on the open market. The availability of more shares on the market is good for liquidity in a bullish market, but not so much when sentiment is bearish.“Private equity and venture capital firms typically focus on achieving a targeted return on their investment, and exit when they have achieved that,” Sharad Chandra Shukla of Mehta Equities told Moneycontrol.El Nino, US banking woes“There are concerns over the impact that El Nino will have on agriculture, and now you have the banking woes in the US as well. Things will be challenging globally in 2023, and India will not be immune to it. As a result, many large investors may choose to book profits and look for safer avenues,” Shukla said.El Nino is a reference to a weather phenomenon that describes the unusual warming of surface waters in the Pacific Ocean, and is associated with rainfall deficit and drought in India and its neighbourhood. The US banking industry has been in turmoil since the collapse at the weekend of Silicon Valley Bank.Share sales by promoters are also being closely watched. Conventional market wisdom is that share purchases by promoters are a better indicator than stake sales. But this too varies depending on market sentiment.Promoters selling shares in a bullish market are taken well by the markets, but share sales at a time when the business environment is tough can be cause for concern.Block dealsOn Monday, March 13, private equity firm Blackstone sold its entire 20 percent stake in Sona BLW Precision Forging Ltd for around Rs 4,917 crore, while in February, Synnex Mauritius sold its entire 24.13 percent stake in Redington Ltd for Rs 3,200 crore and Baring Private Equity Asia-controlled Hulst BV liquidated its 9.8 percent stake worth Rs 2,430 crore in Coforge.Other big block deals include private equity player Apax Partners arm Dynasty Acquisition’s sale of a 2.14 percent stake in Shriram Finance for Rs 1,040 crore and Softbank-backed SVF Doorbell (Cayman) Ltd’s sale of a 3.8 percent stake in Delhivery Ltd for Rs 950 crore.Several promoters have also jumped on the bandwagon to pare their holdings. SB Adani Family Trust, the promoters of Adani Group firms, have sold their stake in four firms to GQG Partners for Rs 15,446 crore.Alibaba Group of China completely divested from Paytm, an Indian digital payments company, which was worth around Rs 2,377 crore.  Biocon Ltd, the promoters of Syngene International Ltd, offloaded a stake worth Rs 2,240 crore while Embassy Property Developments Pvt Ltd sold stake worth Rs 1276 crore in Embassy Office Parks REIT.  Promoters of Kirloskar Oil Engines sold around an 18 percent stake worth Rs 636 crore on 8 March.Trend to persistAmid foreign institutional investors (FIIs) selling approximately $2.57 billion worth of Indian equities in the year to date, there has been a surge in significant block trades. In 2022, FIIs divested Indian equities worth $17.21 billion.Despite this, analysts predict that the trend of block trades by investors will persist as cautious FIIs are expected to be replaced by domestic institutional investors and even high net-worth individuals.""Considering the ongoing high level of global uncertainty in terms of high inflation, a likely Fed rate hike, elongated geopolitical issue of Russia-Ukraine and recent turmoil of large banks in the US, the market is expected to remain volatile over the near term. Moreover liquidity in many stocks fell recently. Therefore, a block deal is a better option to offload a sizable chunk of holdings. Also, a few PE investors and other holders of new-age technology companies seem to be uncomfortable to keep holding their stakes in such companies amid uncertainty on turn-around of such loss-making entities,"" said Mitul Shah, Head of Research at Reliance Securities.",One 97 Communications Ltd.
"  March 19, 2023 / 09:31 AM IST  ",Block deals become a bother with too many shares flooding the Street,"A spate of stake sales by institutional investors and promoters seems to spell more trouble for the market with stock prices running into a rough patch since the beginning of this year.Quite a few private equity firms, and venture capital investors have been selling shares through block deals since the start of this calendar year, and market participants expect the trend to intensify given the uncertain macro-economic outlook both at the global and domestic level.Although these blocks of shares are being absorbed, the presence of many interested buyers is resulting in a change in the shareholding pattern from a few owners of large blocks to multiple owners of small blocks. This has led to a more distributed ownership structure.Moreover, smaller blocks of shares are likely to hit the market more frequently, increasing the floating stock, which refers to shares available for trading on the open market. The availability of more shares on the market is good for liquidity in a bullish market, but not so much when sentiment is bearish.“Private equity and venture capital firms typically focus on achieving a targeted return on their investment, and exit when they have achieved that,” Sharad Chandra Shukla of Mehta Equities told Moneycontrol.El Nino, US banking woes“There are concerns over the impact that El Nino will have on agriculture, and now you have the banking woes in the US as well. Things will be challenging globally in 2023, and India will not be immune to it. As a result, many large investors may choose to book profits and look for safer avenues,” Shukla said.El Nino is a reference to a weather phenomenon that describes the unusual warming of surface waters in the Pacific Ocean, and is associated with rainfall deficit and drought in India and its neighbourhood. The US banking industry has been in turmoil since the collapse at the weekend of Silicon Valley Bank.Share sales by promoters are also being closely watched. Conventional market wisdom is that share purchases by promoters are a better indicator than stake sales. But this too varies depending on market sentiment.Promoters selling shares in a bullish market are taken well by the markets, but share sales at a time when the business environment is tough can be cause for concern.Block dealsOn Monday, March 13, private equity firm Blackstone sold its entire 20 percent stake in Sona BLW Precision Forging Ltd for around Rs 4,917 crore, while in February, Synnex Mauritius sold its entire 24.13 percent stake in Redington Ltd for Rs 3,200 crore and Baring Private Equity Asia-controlled Hulst BV liquidated its 9.8 percent stake worth Rs 2,430 crore in Coforge.Other big block deals include private equity player Apax Partners arm Dynasty Acquisition’s sale of a 2.14 percent stake in Shriram Finance for Rs 1,040 crore and Softbank-backed SVF Doorbell (Cayman) Ltd’s sale of a 3.8 percent stake in Delhivery Ltd for Rs 950 crore.Several promoters have also jumped on the bandwagon to pare their holdings. SB Adani Family Trust, the promoters of Adani Group firms, have sold their stake in four firms to GQG Partners for Rs 15,446 crore.Alibaba Group of China completely divested from Paytm, an Indian digital payments company, which was worth around Rs 2,377 crore.  Biocon Ltd, the promoters of Syngene International Ltd, offloaded a stake worth Rs 2,240 crore while Embassy Property Developments Pvt Ltd sold stake worth Rs 1276 crore in Embassy Office Parks REIT.  Promoters of Kirloskar Oil Engines sold around an 18 percent stake worth Rs 636 crore on 8 March.Trend to persistAmid foreign institutional investors (FIIs) selling approximately $2.57 billion worth of Indian equities in the year to date, there has been a surge in significant block trades. In 2022, FIIs divested Indian equities worth $17.21 billion.Despite this, analysts predict that the trend of block trades by investors will persist as cautious FIIs are expected to be replaced by domestic institutional investors and even high net-worth individuals.""Considering the ongoing high level of global uncertainty in terms of high inflation, a likely Fed rate hike, elongated geopolitical issue of Russia-Ukraine and recent turmoil of large banks in the US, the market is expected to remain volatile over the near term. Moreover liquidity in many stocks fell recently. Therefore, a block deal is a better option to offload a sizable chunk of holdings. Also, a few PE investors and other holders of new-age technology companies seem to be uncomfortable to keep holding their stakes in such companies amid uncertainty on turn-around of such loss-making entities,"" said Mitul Shah, Head of Research at Reliance Securities.",Shriram Finance Ltd.
"  March 17, 2023 / 12:33 PM IST  ",TCS management change: Surprise but not a setback,"                        Highlights

	Surprise resignation of TCS CEO
	Internal candidate to take over
	Seasoned professional with depth and breadth of experience
	We see little disruption owing to the management change
	TCS set to gain market share in a difficult macro environment
	The stock has underperformed, good time to add

In a rather unexpected development, India’s largest software service firm TCS (CMP: Rs 3,174 Market Cap: Rs 11,61,913 crore) has announced the exit of its Chief Executive Officer and Managing Director Rajesh Gopinathan. The resignation will be effective from...
                    ",Tata Consultancy Services Ltd.
"  March 17, 2023 / 11:55 AM IST  ",Neutral TCS; target of Rs 1300: Motilal Oswal,"Motilal Oswal's research report on TCS“Shingrix” launch soon; WPI to mitigate the impact of price cut under NLEM We attended the analyst meet of Glaxosmithkline Pharma (GLXO) to understand the company’s business outlook over the next two to three years. GLXO plans to launch the ‘Shingrix’ vaccine in the domestic formulation market in the near term. The adverse impact of inclusion of certain brands under the national list of essential medicines (NLEM) is expected to be mitigated by higher volume offtake, increased reach, Shingrix launch, and cost optimization measures.OutlookWe cut our EPS estimate by 3% for FY24/FY25 to factor in a) lower prices of certain brands (Ceftum/T-Bact) and b) gradual improvement in inflation-linked overall prices. We value GLXO at 33x 12M forward earnings to arrive at a price target of INR1,300. We reiterate our Neutral stance on the stock.For all recommendations report, click hereDisclaimer: The views and investment tips expressed by investment experts/broking houses/rating agencies on moneycontrol.com are their own, and not that of the website or its management. Moneycontrol.com advises users to check with certified experts before taking any investment decisions.TCS - 17 -03 - 2023 - moti",Tata Consultancy Services Ltd.
"  March 17, 2023 / 11:47 AM IST  ",Buy TCS; target of Rs 3810: Motilal Oswal,"Motilal Oswal's research report on TCSTCS on 16th Mar’23 announced the resignation of its Managing Director and CEO, Mr. Rajesh Gopinathan, effective 15th Sep’23. The board has nominated its President and BFSI business group head, Mr. K. Krithivasan (Krithi), as the CEO Designate from 16th Mar’23, and he will take over as MD and CEO in FY24 after shareholder approval. As per the company, Mr. Gopinathan is stepping down after 10 years as CXO (CFO followed by CEO) to pursue new interests.OutlookWe expect a USD revenue CAGR of ~11% and an INR EPS CAGR of ~16% over FY23-25. Our TP of INR3,810 implies 24x FY25E EPS, with a 20% upside potential. We have a BUY rating on the stock and would recommend adding to the name on any near-term weakness due to this news.For all recommendations report, click hereDisclaimer: The views and investment tips expressed by investment experts/broking houses/rating agencies on moneycontrol.com are their own, and not that of the website or its management. Moneycontrol.com advises users to check with certified experts before taking any investment decisions.TCS - 17 -03 - 2023 - moti",Tata Consultancy Services Ltd.
"  March 17, 2023 / 01:21 PM IST  ","Macro uncertainties cast shadow on IT services, mixed views on preferred stocks","The IT services sector, which has already been suffering in the past year due to the uncertain global environment, is still not out of the woods as the macro environment continues to be turbulent, with analysts remaining cautious about the sector.The benchmark Nifty IT index has declined 19 percent in the last year, compared to the broader Nifty50 index, which fell around 1 percent.What do brokerages sayAccording to foreign brokerage Nomura, the demand uncertainty is rising and margins have bottomed out, with concerns around uncertain macro conditions, falling attrition and disciplined mergers and acquisitions.The brokerage has a ""buy"" rating on Infosys, Tech Mahindra, Persistent Systems and Coforge. However, it recommends ""reduce"" on Tata Consultancy Services (TCS), LTIMindtree (LTIM) and L&T Technologies.Morgan Stanley (MS), on the other hand, is bullish on LTIM and prefers Infosys and HCL Technologies.According to MS, the macro environment remains in a flux, clouding near-term revenue outlook and it believes that growth should normalise on a two-year basis. The brokerage cautions on FY24 outlook, with the expected stock volatility in the near term. “Would use that as an opportunity to accumulate,” it added.Follow our live blog for all the market actionEarly last week, Jefferies said, “Among companies, consensus revenue growth estimates for CY24 have been lowered for top clients of all IT firms, barring Wipro, with the highest cuts of 80-180bps for HCLT & TechM. Additionally, profitability pressures are visible in CY24 as well, with aggregate margin/PAT estimates for top clients being revised downwards by 30bps/3 percent. Downward revisions in CY24 estimates suggests that concerns are now shifting towards CY24.”The brokerage sees Coforge, Wipro and LTIM at high risk and believes Infosys, TCS, and HCL are better placed. “With sector valuations at 23x, we remain selective, with Infosys our only top pick,” it said.Also read: TCS CEO-designate Krithivasan rules out a great organisational or strategic rebootOn Wipro and LTIM, the brokerage said that while consensus expects limited deceleration in their revenue growth, a larger deceleration in the growth of their top clients is expected. For Coforge, the consensus revenue growth in FY24 is lower than the growth expected for its top clients.“Infosys/TCS appear better placed on this front and the outlook of their clients seems to be improving as well. HCLT also looks well positioned as consensus expects HCLT's clients to see growth acceleration in FY24. TechM's expectations of growth moderation seem to be in sync with those of its clients, suggesting limited risk to FY24 growth,” the brokerage added.Also read: A day of mixed feelings: Gopinathan on resigning from TCS“In our view, the sector’s outlook remains “fluid”, specifically with increased macro “noise” during the past two weeks as well as SVB’s failure, likely causing enterprise clients to procrastinate on IT spending decisions, further delaying CY23’s actual budget cycle, and resulting in longer sale cycles, while also impacting sector’s near-term visibility,” Research and Advisory firm Wedbush said in an industry note.The advisory has made revenue growth adjustments for Accenture, Infosys, and Cognizant and believes the EPS impact will be marginal, given the supply-side tailwinds such as moderating wage inflation, subcontractor use decline and widening pyramid structure.“Accordingly, we are not making any rating changes at this point,” it added.",Tech Mahindra Ltd.
"  March 17, 2023 / 10:17 AM IST  ","ZEEL calls report on repayment of $10 million to IndusInd Bank 'speculative', stock falls","Zee Entertainment Enterprises Ltd. (ZEEL) on March 16 slammed the report saying that the company is set to repay $10 million to IndusInd Bank to wrap Sony deal and called it 'speculative'.Issuing a clarification to the stock exchanges, the media company said that it is exploring several strategies, including settlement, in relation to the ongoing dispute mentioned in the news report.Also Read | Zee Entertainment agrees to pay IndusInd Bank dues; lender likely to withdraw insolvency caseHowever, it added, ""there is no clarity at this stage as to which resolution or strategy the Company will finally pursue, much less the timing of any such strategy. Accordingly, we believe that the news report is speculative in nature.""At 10 am, the stock was quoting at Rs 200.65 on the NSE, lower by 2.93 percent from the previous close. The stock soared 9 percent during late trading hours of March 16 when the Bloomberg report was published. The stock is down 18 percent for 2023 so far.IndusInd Bank approached the bankruptcy court in February to initiate insolvency proceedings against ZEEL, a move that could have threatened the merger by stopping all transactions, including asset transfers.The National Company Law Appellate Tribunal (NCLAT) provided interim relief by deciding to stay the proceedings. The next hearing will be held on March 29.Meanwhile, analysts are awaiting details on the merger progress. ""We believe expedition on the settlement will work favourably for the Zee Sony merger as valuations are compelling in the range of 7-10x forward price-to-earnings ratio for the merged entity,"" said Karan Taurani of Elara Capital.Ashwin Patil, senior research analyst at LKP Securities said, ""NCLT approval shall be the final step towards completion of the merger. It will be immensely positive for the stock.""",Zee Entertainment Enterprises Ltd.
