date,title,content,company
"  August 01, 2023 / 09:58 AM IST  ","Adani Green Ene Standalone June 2023 Net Sales at Rs 691.00 crore, down 68.11% Y-o-Y","Net Sales at Rs 691.00 crore in June 2023 down 68.11% from Rs. 2,167.00 crore in June 2022.Quarterly Net Loss at Rs. 205.00 crore in June 2023 down 255.3% from Rs. 132.00 crore in June 2022.EBITDA stands at Rs. 127.00 crore in June 2023 down 47.3% from Rs. 241.00 crore in June 2022.Adani Green Ene shares closed at 1,093.30 on July 31, 2023 (NSE) and has given -10.67% returns over the last 6 months and -51.92% over the last 12 months.",Adani Green Energy Ltd.
"  August 01, 2023 / 09:59 AM IST  ","Adani Trans Standalone June 2023 Net Sales at Rs 14.44 crore, down 82.67% Y-o-Y","Net Sales at Rs 14.44 crore in June 2023 down 82.67% from Rs. 83.30 crore in June 2022.Quarterly Net Profit at Rs. 300.86 crore in June 2023 up 1873.94% from Rs. 16.96 crore in June 2022.EBITDA stands at Rs. 421.24 crore in June 2023 up 139.7% from Rs. 175.74 crore in June 2022.Adani Trans EPS has increased to Rs. 2.70 in June 2023 from Rs. 0.33 in June 2022.Adani Trans shares closed at 820.70 on July 31, 2023 (NSE) and has given -53.74% returns over the last 6 months and -74.84% over the last 12 months.",Adani Transmission Ltd.
"  August 01, 2023 / 11:12 AM IST  ","Bosch Standalone June 2023 Net Sales at Rs 4,158.40 crore, up 17.32% Y-o-Y","Net Sales at Rs 4,158.40 crore in June 2023 up 17.32% from Rs. 3,544.40 crore in June 2022.Quarterly Net Profit at Rs. 409.00 crore in June 2023 up 22.38% from Rs. 334.20 crore in June 2022.EBITDA stands at Rs. 655.40 crore in June 2023 up 29.5% from Rs. 506.10 crore in June 2022.Bosch EPS has increased to Rs. 138.69 in June 2023 from Rs. 113.30 in June 2022.Bosch shares closed at 18,970.30 on July 31, 2023 (NSE) and has given 11.40% returns over the last 6 months and 7.48% over the last 12 months.",Bosch Ltd.
"  August 01, 2023 / 01:21 PM IST  ",Coal India embarks on overseas acquisition of critical mineral assets,"In a bold move to diversify its operations and integrate further into the value chain, Coal India Limited (CIL) is targeting the acquisition of lithium, cobalt, and nickel assets abroad.The company has recently amended its Memorandum of Association (MoA) to include non-ferrous and critical minerals, indicating its commitment to expand its presence in new sectors.In the past, the miner's attempt to acquire coal assets aboard did not fructify.In its pursuit of overseas assets, CIL is currently identifying suitable opportunities for mergers and acquisitions, the management informed its shareholders in its latest annual report.The strategic move reflects the company's vision to secure a steady supply of these critical minerals toward the Atmanirbhar mission of India.In 2022, the Ministry of Mines also created a joint venture company, Khanij Bidesh India Ltd (KABIL), with participating interest from NALCO, Hindustan Copper Ltd and Mineral Exploration Corporation Ltd (MECL).KABIL is mandated to identify and acquire overseas mineral assets of critical and strategic nature such as lithium, cobalt, etc.In the past, NMDC and Coal India were considered for participation in the special purpose vehicle (SPV).Highlighting capex plans, Coal India stated that it has proposed a capital expenditure of Rs 16,600 crore in 2023-24.""As part of our investment plan, we have strategically allocated a substantial amount towards diversification projects including ventures such as solar power, thermal power plants, revival of fertilizer plants, surface coal gasification, coal bed methane and others.""With a focus on acquisitions and JVs, we seek to venture beyond our core competencies, tap into emerging opportunities and manage associated risks effectively,"" Coal India informed its shareholders.In 2022-23, the capital expenditure of CIL registered a phenomenal growth of 20.90 per cent to Rs 18,619 crore.Coal India chairman P M Prasad said CIL has executed three Memorandum of Understanding (MoU) with BHEL, GAIL India Limited, and IOCL for undertaking coal-to-chemical business using surface coal gasification, which is proposed to be implemented jointly through JV companies.Coal India has also signed two MoU for its foray into the thermal power business.The first is for a joint venture between South Eastern Coalfields Limited (SECL) and Madhya Pradesh Power Generating Company Limited (MPPGCL) to implement a 1x660 MW Supercritical thermal power station replacing the retired generating units situated at the existing premises of MPPGCL's Amarkantak Thermal Power Station, Chachai, district Anuppur, Madhya Pradesh.The other initiative is setting up of 2x800 MW Supercritical thermal power plant in Odisha, through Mahanadi Basin Power Limited (MBPL), a wholly-owned subsidiary of Mahanadi Coalfields Limited (MCL).MoU between CIL and Assam Power Distribution Company Limited (APDCL) was executed for the purchase of 1,200 MW from the proposed MBPL Power Plant.CIL has also established joint ventures (JVs) with prominent entities such as the National Thermal Power Corporation (NTPC), Indian Oil Corporation Limited (IOCL), Gas Authority of India Limited (GAIL), and Rashtriya Chemicals and Fertilisers Limited (RCF).These partnerships aim to mitigate technological and financial risks associated with diversification projects, while also leveraging the expertise of its business partners, the dry-fuel miner said.",Coal India Ltd.
"  August 01, 2023 / 04:51 PM IST  ",Buy Coromandel International; target of Rs 1155: Sharekhan,"Sharekhan's research report on Coromandel InternationalQ1FY24 consolidated PAT of Rs. 494 crore (down 1% y-o-y) was 15% above our estimate, led by strong revenues/margins of the nutrient and other allied segments, which offset continued weakness in CPC business amid high channel inventory, pricing pressure and delayed monsoons. Segmental margins were a mixed bag as EBIT of nutrients and other allied segments grew by 12% y-o-y to Rs. 672 crore led by volume growth and sustained per tonne fertiliser margin. However, the CPC business disappointed with a steep 17% y-o-y fall in revenue to Rs. 547 crore and 309 bps y-o-y contraction in EBIT margin to 10%. Input cost pressure subsided and the management expects full-year fertiliser margin to sustain at Rs. 5,500-6,000/tonne. Focus on new business stream i.e. specialty chemical/CDMO and future technology (drone for agrochemical space) and innovative products (Nano-DAP by Oct’23), strong margin for fertilizers makes us constructive on growth prospects.OutlookWe maintain a Buy on Coromandel with an unchanged PT of Rs. 1,155, given healthy earnings growth outlook and reasonable valuation of 11.5x FY25E EPS. Focus on CDMO and specialty chemical is a right step and could drive meaningful growth in the medium to long term apart from ssssstrong contribution core fertilizer/CPC business.For all recommendations report, click hereDisclaimer: The views and investment tips expressed by investment experts/broking houses/rating agencies on moneycontrol.com are their own, and not that of the website or its management. Moneycontrol.com advises users to check with certified experts before taking any investment decisions.Coromandel International - 31 -07 - 2023 - khan",Coromandel International Ltd.
"  August 01, 2023 / 10:05 AM IST  ","Block Deal: DLF falls after shares worth Rs 1,185 crore change hands","Shares of DLF Limited fell over 2 pecent on August 1 after a large trade of 2.3 crore shares, equivalent to 0.93 percent equity, happened early morning. The transaction was worth Rs 1,185 crore. It was not immediately clear who were buyers.Earlier sources told CNBC TV-18 that a block deal was scheduled for August 1 in real estate developer, amounting to Rs 1,086.2 crore. The deal's issue price was set at a 3 percent discount to the current market price (CMP). The seller in this transaction was likely the promoter group.Abhilash Pagaria of Nuvama Research said consequent to the deal, company's weight in FTSE index may rise slightly higher potentially resulting in an inflow of $5.5 million. No immediate impact is foreseen in near term in MSCI index, he added.DLF in July reported a consolidated net profit of Rs 526.11 crore for the quarter ended June 2023, up from Rs 469.21 in the same quarter last year.The real estate developer's net profit exceeded analysts' estimates.​The total income in the April-June quarter stood at Rs 1,521.71 crore, a marginal increase from Rs 1,516.28 crore in the same quarter last year.Meanwhile, DLF recently announced its re-entry into the Mumbai property market and said that it intends to launch close to nine lakh square feet (sq ft) of space in Andheri West by the end of this fiscal year along with its partner Trident Group, as part of the first phase of a project in the metropolis.DLF will pump in close to Rs 400 crore as equity to develop the entire project, which has a potential saleable area of 30 to 35 lakh sq ft, the company had said in an investor call on July 24.",DLF Ltd.
"  August 01, 2023 / 10:42 AM IST  ",GAIL recoups early losses with 3% gain on mixed brokerage views,"Shares of GAIL India opened 1 percent lower but recovered the early losses soon and gained over 3 percent on August 1. Brokerage reaction was mixed after the company reported its quarterly numbers.GAIL reported a 45 percent drop in its consolidated net profit for the June quarter of FY24 at Rs 1,793 crore as against Rs 3,251 crore last year. It spiked over 179 percent from Rs 643 crore in the March quarter this fiscal. Revenue was flat at Rs 32,849 crore in the quarter under review as against Rs 37,942 crore a year ago.At 10:22am, shares of the company were trading 1.9 percent higher at Rs 121.3 on the BSE.Catch up on all LIVE stock market update hereNomura that has a ‘neutral’ recommendation on the stock said the company reported a weak set of numbers and quickly added that though the outlook is optimistic, it has already been priced in. The brokerage firm has a target price of Rs 125.Morgan Stanley has an ‘overweight’ rating on the stock with a target price of Rs 139. It highlighted that the company’s positive guidance pointed to upside risks to the Street’s estimate after a year of challenges. Strong gas transmission volume growth and improving petrochemicals are upside risks, according to the brokerage firm.As gas costs fall ahead by a fifth and pipeline tariffs rise, Morgan Stanley sees more upside in the stock. The stock has run up 16 percent in a month.The recent rally was driven by Brent prices and hopes of commodity business rising, said JP Morgan.Read more | Gail shares hit 52-week high on UBS double upgrades to 'buy'JP Morgan said GAIL’s earnings missed estimates on both fronts - EBITDA and net profit. The global brokerage firm has a ‘neutral’ rating on the stock with a target price of Rs 115.GAIL offers diverse growth prospects driven by transmission, trading, and higher petchem capacity. Yet, underutilisation of pipelines and weak petchem pose challenges, as per Nuvama Institutional Equities that has retained its ‘hold’ rating with a target price of Rs 122 on the stock.Motilal Oswal Financial Services is of the view that the stock trades at about 9 percent discount to its one-year forward long-term price-to-earnings average. The domestic brokerage firm has a ‘buy’ call on the stock with a Rs 145 target price.Read more | Maruti goes downhill on muted Q1 earnings, worries over Gujarat unit dealGuidanceGAIL is currently in the process of executing approximately 70 projects valued at Rs 45,000 crore, spanning across various businesses. Over the next four to five years, these projects are expected to contribute 10-15 million metric standard cubic meters per day (mmscmd) of additional transmission volumes, reaching a total of 135-140 mmscmd by FY26.For the upcoming fiscal year, GAIL has planned a capital expenditure (capex) of Rs 10,000 crore. The allocation includes Rs 4,000 crore for pipelines, Rs 3,200 crore for petrochemicals, and an equity contribution of Rs 3,500 crore.GAIL is responsible for supplying gas to 154 CNG stations and 0.27 million PNG (piped natural gas) connections. The company aims to expand its reach by adding 100 CNG stations and 0.2 million PNG connections within the next two years.",GAIL (India) Ltd.
"  August 01, 2023 / 10:01 AM IST  ",GAIL: Time to accumulate this PSU stock ,"                        Highlights 

	Net sales down 1.9 percent sequentially
	EBITDA margin improves to 7.6 percent
	FY24 capex to be around Rs 9,000-10,000 crore
	Average input gas cost around $12/MMBtu for the rest of FY24
	Reasonable valuation at FY25 PE of 8.9 times

GAIL (CMP: Rs 119.10; Market Capitalisation: Rs 78,309 crore) delivered a decent set of numbers in Q1FY24, after a challenging FY23.

Its earnings before interest, taxes, depreciation and amortisation (EBITDA) margin came in at 7.6 percent, the highest since Q1FY23, as input gas costs came down...
                    ",GAIL (India) Ltd.
"  August 01, 2023 / 09:58 AM IST  ","GAIL Standalone June 2023 Net Sales at Rs 32,227.47 crore, down 14.2% Y-o-Y","Net Sales at Rs 32,227.47 crore in June 2023 down 14.2% from Rs. 37,562.48 crore in June 2022.Quarterly Net Profit at Rs. 1,412.18 crore in June 2023 down 51.56% from Rs. 2,915.19 crore in June 2022.EBITDA stands at Rs. 2,700.31 crore in June 2023 down 40.59% from Rs. 4,545.45 crore in June 2022.GAIL EPS has decreased to Rs. 2.15 in June 2023 from Rs. 6.57 in June 2022.GAIL shares closed at 119.10 on July 31, 2023 (NSE) and has given 25.17% returns over the last 6 months and 21.28% over the last 12 months.",GAIL (India) Ltd.
"  August 01, 2023 / 04:23 PM IST  ",Buy Indian Oil Corporation; target of Rs 120: ICICI Securities,"ICICI Securities research report on Indian Oil CorporationIndian Oil Corporation’s (IOCL) Q1FY24 EBITDA and PAT of INR 221.6bn and INR 137.5bn beat our estimates of INR 175bn and INR 103bn, respectively. The numbers were also well ahead of Q1FY23 EBITDA of INR 13.6bn and net loss of INR 19.9bn. Reported GRM of USD 8.3/bbl in Q1FY24 was down by USD 6.9/bbl QoQ and USD 23.5/bbl YoY (in-line), while refining throughput was at 18.8mt (down 1% YoY, in-line). Marketing strength drove the outperformance, with sharply higher retail margins (blended margins at INR 8.8/ltr for Q1FY24) the key driver, even as marketing volumes of 24.4mt were down 1% YoY. We increase FY24E / FY25E EPS by 4.4% / 7.0% to factor-in the stronger margins. Our EV/EBITDA based target price thus stands increased to INR 120/sh. Maintain BUY.OutlookValuations at 5.0x FY25E P/E, 5.0x EV/EBITDA and 0.8x P/BV remain attractive. We believe dividend yield of ~7-8% (average estimated for FY24E/FY25E) is an added value driver for the stock. Our revised FY25E EV/EBITDA-based valuation of INR 120/sh implies 26% upside. Maintain BUY.For all recommendations report, click hereDisclaimer: The views and investment tips expressed by investment experts/broking houses/rating agencies on moneycontrol.com are their own, and not that of the website or its management. Moneycontrol.com advises users to check with certified experts before taking any investment decisions.Indian Oil Corporation - 31 -07 - 2023 - isc",Indian Oil Corporation Ltd.
"  August 01, 2023 / 04:51 PM IST  ",Buy Marico; target of Rs 645: Sharekhan,"Sharekhan's research report on MaricoMarico’s Q1FY2024 performance was soft, affected by significant trade destocking in Saffola Edible Oils and channel inventory adjustments in core portfolios. Revenue declined by 3% y-o-y, while adjusted PAT grew by 11% y-o-y, led by sharp margin expansion. Volume offtake is expected to improve from Q2 with improved consumer demand. Growth is likely to recover in the positive trajectory in H2FY2024 (we expect growth to be in low double digits). Consolidated OPM is expected to be >20% in FY2024 with strong expansion in gross margins. Premiumisation and scale-up in the food business are expected to drive consistent improvement in the medium term.OutlookThe stock trades at 47x/41x its FY2024E/FY2025E earnings. We retain our Buy rating on the stock with an unchanged PT of Rs. 645For all recommendations report, click hereDisclaimer: The views and investment tips expressed by investment experts/broking houses/rating agencies on moneycontrol.com are their own, and not that of the website or its management. Moneycontrol.com advises users to check with certified experts before taking any investment decisions.Marico - 31 -07 - 2023 - khan",Marico Ltd.
"  August 01, 2023 / 11:12 AM IST  ","Maruti Suzuki Standalone June 2023 Net Sales at Rs 32,326.90 crore, up 21.99% Y-o-Y","Net Sales at Rs 32,326.90 crore in June 2023 up 21.99% from Rs. 26,499.80 crore in June 2022.Quarterly Net Profit at Rs. 2,485.10 crore in June 2023 up 145.37% from Rs. 1,012.80 crore in June 2022.EBITDA stands at Rs. 3,984.20 crore in June 2023 up 99.15% from Rs. 2,000.60 crore in June 2022.Maruti Suzuki EPS has increased to Rs. 82.27 in June 2023 from Rs. 33.53 in June 2022.Maruti Suzuki shares closed at 9,820.75 on July 31, 2023 (NSE) and has given 10.40% returns over the last 6 months and 9.08% over the last 12 months.",Maruti Suzuki India Ltd.
"  August 01, 2023 / 09:28 AM IST  ",Maruti: Premium products make the ride smoother,"                        Highlights

	Good set of numbers on a year-on-year basis
	Operating leverage, softening of raw material cost help company to expand operating margin
	Preference for personal mobility to keep demand buoyant
	Acquisition of Gujarat plant to make it asset-heavy
	Valuations reasonable; accumulate for the long term

Maruti Suzuki India (CMP: Rs 9813 M Cap: Rs 2.96 lakh crore), the leader in the passenger car segment, has improved its financial performance in Q1 FY24 compared with the same quarter last year, thanks to the demand for new...
                    ",Maruti Suzuki India Ltd.
"  August 01, 2023 / 11:37 AM IST  ","Oberoi Realty Consolidated June 2023 Net Sales at Rs 909.97 crore, down 0.34% Y-o-Y","Net Sales at Rs 909.97 crore in June 2023 down 0.34% from Rs. 913.11 crore in June 2022.Quarterly Net Profit at Rs. 321.64 crore in June 2023 down 20.2% from Rs. 403.08 crore in June 2022.EBITDA stands at Rs. 497.32 crore in June 2023 down 3.22% from Rs. 513.87 crore in June 2022.Oberoi Realty EPS has decreased to Rs. 8.85 in June 2023 from Rs. 11.09 in June 2022.Oberoi Realty shares closed at 1,119.55 on July 31, 2023 (NSE) and has given 36.37% returns over the last 6 months and 19.84% over the last 12 months.",Oberoi Realty Ltd.
"  August 01, 2023 / 11:12 AM IST  ","Oberoi Realty Standalone June 2023 Net Sales at Rs 327.02 crore, down 14.97% Y-o-Y","Net Sales at Rs 327.02 crore in June 2023 down 14.97% from Rs. 384.58 crore in June 2022.Quarterly Net Profit at Rs. 120.72 crore in June 2023 down 38.63% from Rs. 196.70 crore in June 2022.EBITDA stands at Rs. 217.94 crore in June 2023 down 22.99% from Rs. 282.99 crore in June 2022.Oberoi Realty EPS has decreased to Rs. 3.32 in June 2023 from Rs. 5.41 in June 2022.Oberoi Realty shares closed at 1,119.55 on July 31, 2023 (NSE) and has given 36.37% returns over the last 6 months and 19.84% over the last 12 months.",Oberoi Realty Ltd.
"  August 01, 2023 / 11:21 AM IST  ","Petronet LNG Standalone June 2023 Net Sales at Rs 11,656.05 crore, down 18.28% Y-o-Y","Net Sales at Rs 11,656.05 crore in June 2023 down 18.28% from Rs. 14,263.82 crore in June 2022.Quarterly Net Profit at Rs. 789.85 crore in June 2023 up 12.69% from Rs. 700.90 crore in June 2022.EBITDA stands at Rs. 1,328.52 crore in June 2023 up 10.15% from Rs. 1,206.15 crore in June 2022.Petronet LNG EPS has increased to Rs. 5.27 in June 2023 from Rs. 4.67 in June 2022.Petronet LNG shares closed at 233.55 on July 31, 2023 (NSE) and has given 7.50% returns over the last 6 months and 3.52% over the last 12 months.",Petronet LNG Ltd.
"  August 01, 2023 / 09:23 AM IST  ","Petronet LNG sees ratings, target prices unchanged after Q1 earnings","Several brokerages maintained their ratings and target prices for Petronet LNG Ltd after posting impressive figures for the June quarter earnings.Nomura Research and Motilal Oswal Securities have maintained their 'neutral' stand, while Jefferies India, Antique Stock Broking kept the 'buy' rating unchanged. Nuvama Research stuck to its 'hold' tag on the stock.All these brokerages have kept their target price for the stock unchanged, except Nomura Research, which sees an 11 percent upside to Rs 260 a share. The stock has 19 buy, 13 hold and four sell ratings, according to Bloomberg.Petronet LNG on July 31 reported consolidated net profit of Rs 819 crore in the first quarter of financial year 2023-24, an increase of 13 percent from the year-ago period. Revenue from operations stood at Rs 11,656.38 crore, lower by 18 percent in the same period last year.The overall LNG volume processed by the company in the current quarter was 230 TBTU, as against the LNG volume processed in the previous and corresponding quarters, which stood at 185 TBTU and 208 TBTU, reporting growth of 24 percent and 11 percent respectively.According to Nomura, Petronet LNG is trading at an attractive valuation, with a price-to-earnings (P/E) ratio of 9.9x for FY25. Additionally, the company offers a compelling dividend yield of 5 percent. It maintains conservative estimates, considering uncertainties in LNG prices in the near term. They project Dahej terminal's utilisation at 85 percent for FY24, but if the spot LNG prices stay stable, Nomura anticipates, Petronet LNG's FY24 operating profit (EBITDA) will potentially exceed its initial estimate by around 5 percent.The company is moving forward with its petrochemical project, and analysts express concerns that this move might have an adverse effect on the stock. There has been no progress in the recovery of use-or-pay revenues. In FY23, the firm recorded Rs 1,270 crore of use-or-pay revenues, but the realisation of these revenues in the future remains uncertain, as per analysts' expectations. The company mentioned that a few customers have recognised these amounts as payables in their accounts, which raises the possibility that Petronet LNG will be able to collect a portion of these revenues, analysts said.According to Motilal Oswal Securities, Petronet LNG faces not only sustainability issues concerning its earnings per share (EPS) growth but also a classic case of Dutch Disease. The company's net cash of Rs 5,700 crore has become a concern for investors due to the diminishing growth prospects in LNG terminalling.As a result, the company is compelled to invest in riskier and more volatile areas, including gas-based petrochemicals, compressed bio-gas, and LNG trucking. This shift in investment strategy may be seen as a worrisome development for investors, given the uncertainty and challenges associated with these newer ventures, it expects.",Petronet LNG Ltd.
"  August 01, 2023 / 11:41 AM IST  ","Power Grid Corp Standalone June 2023 Net Sales at Rs 10,436.11 crore, down 0.1% Y-o-Y",,Power Grid Corporation of India Ltd.
"  August 01, 2023 / 10:04 AM IST  ",Power Grid Corporation down almost 4% after Q1 numbers disappoint,"Power Grid Corporation of India was trading almost 4 percent lower on August 1 morning, a day after the state-owned firm reported a 6 percent year-on-year decline in standalone profit at Rs 3,542.65 crore in the June quarter of FY24.Power Grid Corporation of India had posted a profit of Rs 3,765.93 crore in the year-ago period.Revenue from operations fell marginally to Rs 10,436.1 crore from Rs 10,446.08 crore in the same quarter of the previous year.Earnings before interest, tax, depreciation and amortization (EBITDA) grew 3.4 percent year on year to Rs 9,099.5 crore, with a margin expansion of 290 basis points at 87.2 percent in Q1FY24.One basis point is one-hundredth of a percentage point.Catch all the market action on our live blogThe company’s board also recommended the issue of bonus shares in the ratio of 1:3, which means for every three shares that investors hold, they will get one additional share.The board recommended raising up to Rs 12,000 crore from the domestic market in the financial year 2024-25 in one or more tranches.The decision came after a committee of directors on July 29 approved the raising of upto Rs 5,700 crore in FY 23-24 through bonds in multiple tranches to meet the firm’s  capex requirement and to provide inter-corporate loans to wholly owned subsidiaries and joint ventures.The funds will also be used for general corporate purposes by securitization of cashflows of 4 operational special purpose vehicles including Powergrid Bhuj Transmission Limited, Powergrid Khetri Transmission System Limited, Powergrid Medinipur Jeerat Transmission System Limited & Powergrid Varanasi Transmission System Limited upto March, 2034.At 9.55 am, the share was trading at Rs 257.7 on the National Stock Exchange, down 3.89 percent from the previous close.",Power Grid Corporation of India Ltd.
