date,title,content,company
"  June 09, 2023 / 08:42 AM IST  ","Motilal Oswal upgrades DMart to buy, ups target price to Rs 4,200","Brokerage firm Motilal Oswal Securities has upgraded Avenue Supermarts Ltd, owner of D-Mart chain of stores, with a buy rating from neutral earlier and increased its target price to Rs 4,200 a share, up 18 percent from its current market price.The upgrade comes after continued robust earnings, expected recovery in same-store sales growth (SSSG) amid easing inflation and cheap valuations.In the last five years, DMart has traded at 60x EV/EBITDA and 99x PE. The stock currently trades at 58x price earnings multiple and 36x EV/EBITDA after correction in the stock of nearly 25 percent since September 2022, which represents a 30 percent discount to historical multiples. The correction was due to weak SSSG in the recent past and Motilal expects that it will improve in fiscal 2024 should boost valuation multiples.Motilal expects a likely recovery in SSSG driven easing of general inflation, coupled with a reduction in raw material costs and implementation of new store strategy to address the issue of smaller 30-35k sq ft stores. Since FY19/20, the company has been opening larger stores, which continue to contribute to SSSG even after completing their initial 3-4 year cycles. This is likely to enhance store productivity, with potential for increased footfall growth.The brokerage expects post SSSG recovery, strong cost control could help DMart improve its margin by 30-50 basis points or pass on the gains to drive higher offtake. Despite weak SSSG, DMart has managed to protect its EBITDA margin, unlike other retailers, which have seen a 200-450bp margin hit."" We believe DMart’s SSSG and earnings revision cycle are closer to bottoming out. Tailwinds from robust store additions and consistent cost efficiency could play a key role in SSSG recovery. Subsequently, we estimate a revenue/PAT CAGR of 27%/29% over FY23-25"", Motilal Oswal said.Motilal is of the opinion that worries surrounding the emerging online grocery market are unnecessary. This viewpoint is supported by the fact that both online and modern retail account for a tiny portion of the overall grocery market. Consequently, the market presents a vast potential for growth and opportunities.""DMart has grown its revenues and earnings at a robust CAGR of 23 percent and 24 percent over the last five years. After growing the topline at this scorching pace and achieving a turnover of Rs43,000 crore, it has just about scratched the surface in our view. We believe it has a long runway for growth as the modern retail space is still in its infancy in India"", Motilal report added.",Avenue Supermarts Ltd.
"  June 09, 2023 / 06:51 AM IST  ","Burgers over pizzas, Jodhpuris over casuals: Mixed consumption trends rule Q4","The Q4 earnings reports of Indian FMCG majors reveal divergent trends in consumer spending. In this regard, broking firm Jefferies in its recently released analysis of management comments of 40 major Indian consumer companies and disclosure of their individual demand figures has noticed mixed trends across segments.According to the report authored by Vivek Maheshwari, Jithin John and Kunal Shah, while the premium consumer segment comprising premium apparels, jewellery and paints reported double-digit growth, most of the other mass oriented companies reported weak to moderate demand trends.“Recovery seems to be underway across mass customer segments and low-tier geographies, but a rebound may take time, and would likely be visible during 2HFY24,” the authors further observed. While the individual management commentaries differed in their reasoning for tepid growth, they were unanimous in observing that although decline in inflation levels had considerably brought down input costs, it hadn’t necessarily helped pick up consumer demand to the expected levels.This has been particularly noted in the management commentaries of Quick Service Restaurant (QSR) majors like Jubilant Foodworks, the operator of popular pizza chain Domino’s and Devyani International Foods which operates popular fast food brands like Pizza Hut and KFC. The former two along with popular dining chain Barbeque Nation have reported Q4 demand in red but expect to tide over the situation by the end of the second half of the first quarter in FY24.Interestingly, while Pizza selling majors have seen a slump on various fronts such as declining Same Store Sales Growth (SSSG) due to aggressive store addition policy and reduced margins, other QSR majors popular for burgers such as the Burger King operator Restaurant Brands Asia (RBA) and Westlife Foodworld, operator of McDonald’s for western and southern India have disclosed having received strong demand in Q4FY23 and are confident of being in green in the coming quarters of FY24.Also read: FMCG stocks under pressure on El Nino uncertainties flagged by RBI governorThe Jefferies report also notes that while aggressive store additions may not have worked in favour of QSRs, pursual of the same has turned out to be a major growth driver for multi-category retail majors like DMart and Reliance Retail. The latter in particular has reported a strong 66 percent growth year-on-year (YoY), driven by grocery sales through its outlets like Reliance Smart Point while the outcome for DMart has been a mix owing to weak demand for mass apparels and other Fast Moving Consumer Goods (FMCG) which constitute a major chunk of its inventory.In the context of multi-category retail, it is also worthwhile to note that barring Dabur and Emami which are in red, for most FMCG majors the demand continued to be moderate. Authors point out that most of the staples producers like Nestle, Varun Beverages and Tata Consumer Products Limited's brands like Tata Tea were acquiescent of the fact that the net demand was being driven by increasing consumption in rural areas. However, the report also notes that the response from the rural consumer base hasn’t been the same for mass footwear brands like Relaxo and Campus which have reported demand contraction in this geography.Contrary to the conditions faced by mass oriented brands, demand for premium consumer goods manufacturers and brands remained relatively stable. Among the apparels segment, while overall demand for the commodities of Page Industries (Indian manufacturer of American brand Jockey), Aditya Birla Fashion and V-Mart remained in red, wedding apparel brand Manyavar’s owner Vedant Fashion along with fashion retail major Shoppers Stop and GoColours registered strong growth in FY23Q4.In the jewellery segment, Tata’s premium watch maker and owner of jewellery brand Tanishq along with south Indian major Kalyan Jewellers reported high growth, with the latter having reported 18 percent revenue growth YoY driven by strong demand coming from the non-south. Similarly, riding on the strong 48% surge in housing sales and enhanced government spending on infrastructure, all major paint and adhesive companies reported revenue growth in green with Asian Paints reporting 13% growth YoY along with a strong demand driven 16% volume growth.The management commentaries in ressonance with the observation of several analysts also observed that the demand and subsequent revenue growth forecast continues to be vulnerable to external factors. The Jefferies report in this regard observed that sustained easing out of inflation for keeping the input costs in check along with climatic factors like El Nino could play an important role in deciding the growth trajectory of the FMCG segment in coming quarters.Disclaimer: The views and investment tips expressed by experts on Moneycontrol.com are their own and not those of the website or its management. Moneycontrol.com advises users to check with certified experts before taking any investment decisions.​​​Disclaimer: Moneycontrol is a part of the Network18 group. Network18 is controlled by Independent Media Trust, of which Reliance Industries is the sole beneficiary.",Avenue Supermarts Ltd.
"  June 09, 2023 / 06:31 AM IST  ",Here are 10 hot stocks to bet on as RBI keeps policy rates unchanged,"The Monetary Policy Committee has maintained the repo rate unchanged at 6.5 percent in its bi-monthly review, while continuing to keep a close vigil on the evolving inflation and growth outlook.Five of the six-member committee voted in favour of maintaining withdrawal of accommodation stance to ensure that inflation progressively aligns with the target, while supporting growth.The interest rate decision by MPC is on expected lines, though few experts were expecting a possibility of change in policy stance to neutral.The MPC took note of the moderation in CPI headline inflation in March-April into the tolerance band, in line with projections, reflecting the combined impact of monetary tightening and supply augmenting measures.Headline inflation is projected to decline in 2023-24 from its level in 2022-23 but would still be above the target, warranting continuous vigil, said the RBI, adding the progress of the south west monsoon is critical in this regard.The central bank lowered its FY24 inflation projection to 5.1 percent from 5.2 percent earlier, and also to 4.6 percent from 5.1 percent for Q1FY24 and to 5.2 percent against 5.4 percent for Q2FY24.""As the RBI expects inflation to remain within its target range for the rest of the fiscal year, and with growth faring reasonably well, we think the RBI will stay on hold through the rest of FY24,"" Rahul Bajoria, MD and Head of EM Asia (ex-China) Economics at Barclays, said.RBI governor Shaktikanta Das in his policy address emphasised the need to bring down the CPI inflation to its 4 percent target consistently, saying that inflation being within the tolerance band itself was “not good enough”, Rahul pointed out.The cumulative rate hike of 250 basis points undertaken by the MPC is transmitting through the economy and its fuller impact should keep inflationary pressures contained in the coming months, the RBI said.Also read: Market in see-saw mode post-RBI policy, here are the key factors at playThe central bank has maintained its current financial year growth projection at 6.5 percent, while expecting the real GDP growth for Q1FY24 at 8 percent and 6.5 percent for Q2FY24.The market seems to have already reacted to the MPC move as the benchmark indices rallied sharply in previous session to hit the highest level of current calendar year. Today, the Nifty and Sensex turned volatile with trading in small range.After the RBI policy decision, we collated 10 rate sensitive stocks that can deliver healthy double-digit return in the short-to-medium term from its closing price on June 7.Also read: MPC retains repo rate at 6.5%, sounds caution on inflationExpert: Milan Vaishnav, CMT, MSTA, Founder and Technical Analyst of Gemstone Equity ResearchState Bank of India: Buy | LTP: Rs 589.20 | Stop-Loss: Rs 480 | Target: Rs 690-720 | Return: 22 percentSBI has maintained a long-term upward trend, but recently it consolidated and formed a bearish Head and Shoulder pattern on the weekly chart. However, this pattern was invalidated after a pullback from Rs 490-500 levels.Currently, the stock presents an entry opportunity for investors as it has undergone consolidation for a few weeks.Investors can enter or hold this stock with a medium-term investment horizon, targeting a price range of Rs 690-720 in the next few months. It is advisable to maintain a stop-loss at Rs 480.Larsen & Toubro: Buy | LTP: Rs 2,315.5 | Stop-Loss: Rs 2,050 | Target: Rs 2,600-2,675 | Return: 15.5 percentDespite facing challenges from interest rate hikes, L&T, a major player in the infrastructure sector, has performed well and remains in a strong uptrend. While the stock has traded within a wide range recently, it shows promising signs for the future.Technically, it is poised for a breakout above Rs 2,320-2,340 levels. Investors holding the stock can continue to do so, and those considering entry may do so at the current levels, with a medium-term perspective.Also read: Nifty Midcap 100 at a new high. Which stocks should you to bet on?The stock has the potential to reach Rs 2,600-2,675 levels in the coming months, but a drop below Rs 2,050 would invalidate this technical setup.Expert: Anand James, Chief Market Strategist at Geojit Financial ServicesPrestige Estates Projects: Buy | LTP: Rs 526.1 | Stop-Loss: Rs 475 | Target: Rs 560-620 | Return: 18 percentUnliked the several recovery attempts that we saw since 2021, the botting pattern of 2023 and the multitude of continuation patterns, signals that a strong uptrend has been in formation.MACD’s (moving average convergence divergence) push above zero line from below, and a triangle breakout, both in monthly charts also point the strength and breadth of the uptrend that is now in play after a multi-year consolidation.Oberoi Realty: Buy | LTP: Rs 980.95 | Stop-Loss: Rs 895 | Target: Rs 1,060-1,250 | Return: 27 percentThe pull back from the record peak of 2022, having not stretched much lower, the consolidation thereof took a rounding pattern, reflecting the underlying strength.Also read: Deutsche Bank forecasts earlier, milder recession for the USThough daily charts are yet to show a clean break, longer periodicities are beginning to portray a better story. A potential signal line break in MACD and a triangle breakout, both in monthly charts, signals bullish continuation.Godrej Properties: Buy | LTP: Rs 1,446.45 | Stop-Loss: Rs 1,355 | Target: Rs 1,520-1,660 | Return: 15 percentHaving lost more than 60 percent in under 2 years after hitting record peak in 2021, a strong recovery is in play. Bounce from 78.6 percent Fibonacci retracement level in monthly time frame has set off a wedge breakout that is now in the third month.Congestion resistance near Rs 1,500 may see some rejection trades, but dips to Rs 1,420 may continue to be bought.Expert: Vidnyan Sawant, AVP - Technical Research at GEPL CapitalCan Fin Homes: Buy | LTP: Rs 749.45 | Stop-Loss: Rs 680 | Target: Rs 900 | Return: 20 percentCan Fin Homes has demonstrated remarkable resilience, maintaining a steady upward trajectory since June 2017, when it began its ascent from Rs 719 level. The stock has consistently acknowledged and honored this price level, reflecting the stock's enduring strength and stability.The breakout of Inverse Head & Shoulder Pattern in late May 2023 Indicates beginning of the Trend to the upside. The RSI (relative strength index) has shown a breakout too reflecting presence of positive momentum.Also read: This investment manager says market underestimating India’s growth, sees FY24 GDP above 6%Going ahead we can expect the up move to continue till Rs 900 level, where the stop-loss must be Rs 680 on closing basis.Bajaj Finance: Buy | LTP: Rs 7,079.95 | Stop-Loss: Rs 6,850 | Target: Rs 7,800 | Return: 10 percentThe stock has shown a bounce to the upside from crucial support of Rs 5,550 where a change in the polarity can be found. The breakout of Double Bottom pattern in early May 2023 indicated beginning of the trend to the upside.The RSI on Weekly is rising and have sustained well above 50 mark reflecting the Rising momentum in the prices. Going ahead we expect the prices to move higher till Rs 7,800, where stop-loss must be Rs 6,850 on the closing basis.Axis Bank: Buy | LTP: Rs 976.75 | Stop-Loss: Rs 930 | Target: Rs 1,100 | Return: 13 percentThe stock has shown a change in the polarity around Rs 830 level which illustrates the rising bullish sentiment behind the prices. The recent breakout of the Rounding Bottom pattern indicates beginning of the trend to the upside.The stock is above key moving averages of 50, 100 & 200-day EMA (exponential moving average) which confirms the presence of uptrend.Going ahead we expect the prices to move higher till Rs 1,100, where the stop-loss must be Rs 930 on the closing basis.Expert: Shrikant Chouhan, Head of Equity Research (Retail) at Kotak SecuritiesDLF: Buy | LTP: Rs 495.70 | Stop-Loss: Rs 445 | Target: Rs 520-650 | Return: 31 percentThe stock is forming a rounding bottom formation on a monthly chart. Recently it has broken the resistance zone which was at Rs 447, which has not allowed the stock to trade above the same for a period of 14 years.In brief, the stock is in the long-term breakout mode and we can expect a minimum of Rs 520 and a maximum of Rs 650 in the long run, which is its 50 percent retracement resistance of the entire fall. Buy in 2 parts, with a stop-loss at Rs 445.Canara Bank: Buy | LTP: Rs 315 | Stop-Loss: Rs 295 | Target: Rs 330-350 | Return: 11 percentThe stock is forming a triangle formation, which is a continuation formation for the prevailing trend, which is bullish and upward.Technically, we can expect Rs 330 and Rs 350 in the near term. Buy 50 percent at the current levels and the balance at Rs 305 which is the lower boundary of the triangle. For the same, one can keep a stop-loss at Rs 295.HDFC Bank: Buy | LTP: Rs 1,607.70 | Stop-Loss: Rs 1,570 | Target: Rs 1,680-1,700 | Return: 6 percentCurrently, the stock is available at a major support zone, which is between Rs 1,600 and Rs 1,575. The 200-day EMA is also at Rs 1,584, which would offer significant support to the stock if it corrects.On the higher side, the resistance is in the range of Rs 1,680-1,700 levels, which is a decent upside with a medium-term view. It’s a buy at current levels and more on dips with a stop-loss at Rs 1,570.Disclaimer: The views and investment tips expressed by investment experts on Moneycontrol.com are their own and not those of the website or its management. Moneycontrol.com advises users to check with certified experts before taking any investment decisions.",HDFC Bank Ltd.
"  June 09, 2023 / 06:51 AM IST  ","Burgers over pizzas, Jodhpuris over casuals: Mixed consumption trends rule Q4","The Q4 earnings reports of Indian FMCG majors reveal divergent trends in consumer spending. In this regard, broking firm Jefferies in its recently released analysis of management comments of 40 major Indian consumer companies and disclosure of their individual demand figures has noticed mixed trends across segments.According to the report authored by Vivek Maheshwari, Jithin John and Kunal Shah, while the premium consumer segment comprising premium apparels, jewellery and paints reported double-digit growth, most of the other mass oriented companies reported weak to moderate demand trends.“Recovery seems to be underway across mass customer segments and low-tier geographies, but a rebound may take time, and would likely be visible during 2HFY24,” the authors further observed. While the individual management commentaries differed in their reasoning for tepid growth, they were unanimous in observing that although decline in inflation levels had considerably brought down input costs, it hadn’t necessarily helped pick up consumer demand to the expected levels.This has been particularly noted in the management commentaries of Quick Service Restaurant (QSR) majors like Jubilant Foodworks, the operator of popular pizza chain Domino’s and Devyani International Foods which operates popular fast food brands like Pizza Hut and KFC. The former two along with popular dining chain Barbeque Nation have reported Q4 demand in red but expect to tide over the situation by the end of the second half of the first quarter in FY24.Interestingly, while Pizza selling majors have seen a slump on various fronts such as declining Same Store Sales Growth (SSSG) due to aggressive store addition policy and reduced margins, other QSR majors popular for burgers such as the Burger King operator Restaurant Brands Asia (RBA) and Westlife Foodworld, operator of McDonald’s for western and southern India have disclosed having received strong demand in Q4FY23 and are confident of being in green in the coming quarters of FY24.Also read: FMCG stocks under pressure on El Nino uncertainties flagged by RBI governorThe Jefferies report also notes that while aggressive store additions may not have worked in favour of QSRs, pursual of the same has turned out to be a major growth driver for multi-category retail majors like DMart and Reliance Retail. The latter in particular has reported a strong 66 percent growth year-on-year (YoY), driven by grocery sales through its outlets like Reliance Smart Point while the outcome for DMart has been a mix owing to weak demand for mass apparels and other Fast Moving Consumer Goods (FMCG) which constitute a major chunk of its inventory.In the context of multi-category retail, it is also worthwhile to note that barring Dabur and Emami which are in red, for most FMCG majors the demand continued to be moderate. Authors point out that most of the staples producers like Nestle, Varun Beverages and Tata Consumer Products Limited's brands like Tata Tea were acquiescent of the fact that the net demand was being driven by increasing consumption in rural areas. However, the report also notes that the response from the rural consumer base hasn’t been the same for mass footwear brands like Relaxo and Campus which have reported demand contraction in this geography.Contrary to the conditions faced by mass oriented brands, demand for premium consumer goods manufacturers and brands remained relatively stable. Among the apparels segment, while overall demand for the commodities of Page Industries (Indian manufacturer of American brand Jockey), Aditya Birla Fashion and V-Mart remained in red, wedding apparel brand Manyavar’s owner Vedant Fashion along with fashion retail major Shoppers Stop and GoColours registered strong growth in FY23Q4.In the jewellery segment, Tata’s premium watch maker and owner of jewellery brand Tanishq along with south Indian major Kalyan Jewellers reported high growth, with the latter having reported 18 percent revenue growth YoY driven by strong demand coming from the non-south. Similarly, riding on the strong 48% surge in housing sales and enhanced government spending on infrastructure, all major paint and adhesive companies reported revenue growth in green with Asian Paints reporting 13% growth YoY along with a strong demand driven 16% volume growth.The management commentaries in ressonance with the observation of several analysts also observed that the demand and subsequent revenue growth forecast continues to be vulnerable to external factors. The Jefferies report in this regard observed that sustained easing out of inflation for keeping the input costs in check along with climatic factors like El Nino could play an important role in deciding the growth trajectory of the FMCG segment in coming quarters.Disclaimer: The views and investment tips expressed by experts on Moneycontrol.com are their own and not those of the website or its management. Moneycontrol.com advises users to check with certified experts before taking any investment decisions.​​​Disclaimer: Moneycontrol is a part of the Network18 group. Network18 is controlled by Independent Media Trust, of which Reliance Industries is the sole beneficiary.",Jubilant Foodworks Ltd.
