date,title,content,company
"  July 17, 2023 / 04:15 PM IST  ","ICICI Bank Q1 Net Profit seen up 25.3% YoY to Rs. 8,653.2 cr: Prabhudas Lilladher","Prabhudas Lilladher has come out with its first quarter (April - June’ 24) earnings estimates for the Banking sector. The brokerage house expects ICICI Bank to report net profit at Rs. 8,653.2 crore up 25.3% year-on-year (down 5.1% quarter-on-quarter).Net Interest Income (NII) is expected to increase by 32 percent Y-o-Y (down 1.3 percent Q-o-Q) to Rs. 17,434.1 crore, according to Prabhudas Lilladher.Pre Provision Operating Profit (PPOP) is likely to rise by 30.2% Y-o-Y (down 2.9 percent Q-o-Q) to Rs. 13,420.9 crore.Disclaimer: The views and investment tips expressed by investment experts on moneycontrol.com are their own, and not that of the website or its management. Moneycontrol.com advises users to check with certified experts before taking any investment decisions.Prabhudas_Banking",ICICI Bank Ltd.
"  July 17, 2023 / 06:49 AM IST  ","MC Interview | These two largecaps can see a swift rally in rest of July, says Milan Vaishnav of Gemstone Equity Research","After finally closing above 19,500, ""there are greater chances that the Nifty may certainly test 19,800-19,900 levels if we take some cues from the Options data,"" Milan Vaishnav, CMT, MSTA, founder and technical analyst at Gemstone Equity Research says in an interview to Moneycontrol.As the Nifty IT index had seen a huge buying on last Friday, he believes it is certainly a great time to start accumulating IT stocks.Milan with nearly two decades of experience in the equity markets, expects the banking space to play catchup. ""ICICI Bank is set to witness a breakout; I would focus on ICICI Bank as one of the stocks that can see a swift rally if it is able to keep its head above Rs 960-970 levels,"" he said.Q: Is it the right time to buy RBL Bank that has been on buyers' radar since April?Although RBL Bank has been on the buyer's radar since April, the first entry point came on June 30 when the stock staged a breakout when it crossed Rs 180-182 levels.Currently, the stock remains in a strong uptrend. There is a room on the upside and the stock has the potential to test Rs 265-270 levels over the coming months. Some consolidation cannot be ruled out; one can accumulate the stock between Rs 198-210 levels if it sees some consolidation.Q: Will it be an easy ride for the Nifty50 to climb above 20,000 mark in current quarter?With the kind of trending moves it saw in the previous trading session, Nifty has certainly opened up some more room for itself on the upside. The levels of 20,000 are definitely psychologically important levels from one perspective. There are greater chances that the Nifty may certainly test 19,800-19,900 levels if we take some cues from the Options data.Also read: Netweb Technologies IPO opens | 10 key things to read before applying for offerSo far as testing 20,000 levels in this quarter is concerned, it would be premature to put expectations without any rationale. In fact, two things can happen; the Index can go near 20,000 and also face strong resistance there.Q: Do you expect Nifty Pharma to surpass its record high levels in coming months?This can be answered from a different perspective. The Nifty Pharma Index witnessed a breakout when it crossed above 13,000 levels.Presently it is some 5 percent away from its high point; however, it remains overbought and may see some consolidation. That being said, the Pharma space is set to relatively outperform the broader markets and this may definitely see Nifty Pharma to surpass its record high levels over the coming months.Q: Two stocks which can see swift rally in rest of July?I expect the banking space to play catchup. ICICI Bank is set to witness a breakout; I would focus on ICICI Bank as one of the stocks that can see a swift rally if it is able to keep its head above Rs 960-970 levels.Also read: India set to dominate emerging markets as breakout star of the decade: Capital Group reportAnother stock that I see is from a largecap IT services space. LTIMindtree is set to stage a breakout; any sustenance above Rs 5,100 can see the stock meaningfully higher than its current levels.Q: Are you a big fan of real estate sector?You can call me a big fan of anything that portrays strong Relative Strength. The Realty sector index has been inside the leading quadrant of the RRG (Relative Rotation Graph) for many weeks now; this is the reason that we are witnessing a strong relative performance of the realty space against the broader markets.This is likely to continue; however, we cannot also rule out this space taking a breather and consolidating. The testing of 550-565 levels by the Realty Index would lead to testing of a major double top and some consolidation at those levels cannot be ruled out.Q: Given the strong run up in Nifty IT on Friday, is it really a great time to start picking stocks in the sector?Yes, it is certainly a great time to start accumulating IT stocks. I will have a stock-specific approach while doing this. TCS, Tech Mahindra, Infosys, LTIMindtree, Tata Elxsi etc are some of the stocks that are on our radar.Disclaimer: The views and investment tips expressed by investment experts on Moneycontrol.com are their own and not those of the website or its management. Moneycontrol.com advises users to check with certified experts before taking any investment decisions.",ICICI Bank Ltd.
"  July 17, 2023 / 08:11 AM IST  ",Makes sense to buy IT now; Eicher oversold: Religare’s Siddharth Bhamre on his picks,"The market is no longer cheap at these levels but there are pockets of opportunity nevertheless, says Siddharth Bhamre, Research Head, Religare Broking. “I won’t say we are very expensive right now, but we are headed into that zone,” Bhamre said in a free-wheeling chat with Moneycontrol.He is bullish on the information technology (IT) sector, which is not finding too many takers right now because of the cautious view on the United States economy. And the latest quarterly numbers seem to bear that out. HCL Tech’s and Wipro’s June quarter earnings were short of market expectations and while TCS numbers just about met analyst estimates, there were signs of growth slowing down.“The concerns over earnings growth are valid but that also needs to be seen in the context of valuations,” Bhamre said.Also Read | HCLTech Q1 Results: Net profit rises 8% YoY to Rs 3,534 crore; revenue up 12%“The talk of the US slipping into recession has been on for more than a year now, and a large part of that fear is already reflecting in the prices. At one point, investors were willing to pay 35 times (one-year forward earning), now they balk at paying anything over 20,” he said, pointing out that IT stocks have been underperforming since tumbling from their record highs in January 2022.“And if you listen to the management commentary, you will note that the deferments are mostly for smaller, short-term projects, not the long-term ones which help (US) companies cut on costs. So yes, the situation is not as dire as most people would like to believe. You are never going to get attractive valuations and good earnings visibility at the same time. But if you are a value investor, it makes sense to start accumulating IT shares at these levels. It won’t be a smooth ride, there will be a lot of noise along way as the market reacts to the news flow from the US economy,” Bhamre said.Religare’s top picks in the IT sector are HCL Tech, Infosys and TCS. It is cautious on Wipro.AutoIn the auto sector, Maruti, Eicher Motors and Bajaj Auto are Bhamre’s preferred picks.“I feel pessimism over Eicher Motors may have been overdone,” he says. The Eicher Motors stock has taken a beating over the last couple of weeks following the launch of superbikes by Hero Motor Corp and Bajaj Auto in partnership with Harley Davidson and Triumph, respectively.Also Read | TCS Q1 Results: Net profit up 16.8% at Rs 11,074 crore, revenue at Rs 59,381 crore“There will be a dent in Eicher’s market share no doubt, but I don’t think it will be as significant as the market is expecting. The new players have yet to show that they can scale up quickly. Also, competition is nothing new to Eicher; when Java was launched three years ago many had said that (Royal) Enfield’s domination will be under threat. Things did not quite play out that way. Also, Harley’s and Triumph’s launches are not a bolt out of the blue; the market had priced it to some extent. That could explain why the stock has been struggling since peaking around Rs 3,850 in October last year. I am not saying that Harley and Triumph are not formidable competitors, but often the market gets ahead of itself.""Lastly, Eicher is not a pure-play premium bike story; the commercial vehicle story also looks quite strong. Maybe the dynamics of the premium bike segment will change radically over the next five years, but that is still some way off,” he said.As for Maruti, Bhamre is betting on the company gaining a respectable share in the SUV segment where it has launched new models recently. “For a long time, Maruti was about volume growth. That story is changing. Maruti’s earnings growth will now be driven by better margins as it sells more of its high models. The stock has underperformed for a long time, and despite the recent run up, valuations are not pricey,” he said.CementReligare’s top bets in the cement sector are Ultratech, Dalmia Bharat, Ramco and Nuvoco Vistas.“The valuations right now are not exactly cheap, but cement is a good long- term story,” Bhamre says. The two key triggers according to him — government spending on infrastructure and the boom in the real estate market.“Till some months back, cement was a story about price hikes. That (price hikes) has stopped happening. But the pressure on margins is expected to ease going forward as raw material prices have cooled. There is a lot of capacity coming on stream right now, so cement prices may not go up much. But even so, cement is more a story about volume growth than price hike,” he says.FMCGBhamre feels the recovery in the rural economy will be a major driver of FMCG stocks in the coming days. “The latest employment data shows that things are turning around in the rural markets,” he said.According to Bhamre, FMCG stocks are not cheap at current levels in terms of absolute PE (price-to-earnings) multiples. “They (FMCG) have always been expensive, sometimes less so, sometimes more, there is no denying that. Having seen some of the stocks trade at multiples of 60 and 70 at one point, 50 may not look too bad.""My point is that key FMCG stocks still look okay when compared to the historical 10-year average PE one-year forward. That’s not such a bad deal. Besides, when there is talk of a recession in the US which could hurt the Indian market as well, it makes sense to have defensive stocks in the portfolio,” Bhamre says. His picks in the FMCG space are HUL, Colgate and Marico.“We are not so bullish on ITC, which at 35 plus times one year forward is above its historical average. It is a good story no doubt, but the risk-reward ratio does not look very appealing at this point,” he says.Banks“Banks are one of the safest stories right now. You just need to have them in your portfolio. You can’t go much wrong there. The retail loan book is not growing much, but given the strength of the corporate balance sheets, the risk of NPAs are the lowest in a very long time,” Bhamre says.“Retail loan book still has plenty of scope for growth. Household debt is at manageable levels. And while incomes have not been rising fast, aspirations surely are. Also, the commodity cycle is down right now, but the companies will start borrowing to expand capacity for the next upcycle,” he says.",ITC Ltd.
"  July 17, 2023 / 04:15 PM IST  ","IndusInd Bank Q1 Net Profit seen up 27.8% YoY to Rs. 2,048.6 cr: Prabhudas Lilladher","Prabhudas Lilladher has come out with its first quarter (April - June’ 24) earnings estimates for the Banking sector. The brokerage house expects IndusInd Bank to report net profit at Rs. 2,048.6 crore up 27.8% year-on-year (up 0.4% quarter-on-quarter).Net Interest Income (NII) is expected to increase by 14.9 percent Y-o-Y (up 1.5 percent Q-o-Q) to Rs. 4,739.5 crore, according to Prabhudas Lilladher.Pre Provision Operating Profit (PPOP) is likely to rise by 9.6% Y-o-Y (down 0.9 percent Q-o-Q) to Rs. 3,719.8 crore.Disclaimer: The views and investment tips expressed by investment experts on moneycontrol.com are their own, and not that of the website or its management. Moneycontrol.com advises users to check with certified experts before taking any investment decisions.Prabhudas_Banking",IndusInd Bank Ltd.
"  July 17, 2023 / 02:22 PM IST  ","LTIMindtree Q1 Preview: Revenue growth likely to be muted amid macro headwinds, deal wins eyed","LTIMindtree is expected to post a muted revenue growth in Q1 FY24 amid macroeconomic headwinds in the US, while margins and large deal wins will be key triggers for the near-term outlook, analysts said.The mid-sized IT company, which has replaced HDFC in the NSE Nifty, is likely to report revenues of Rs 8,751 crore, representing a 14.5-percent jump YoY but just 0.69-percent higher than the preceding quarter, as per the average of a poll of estimates of three brokerages.Net profit is projected to grow 9.35 percent yoy and 8.5 percent qoq to Rs 1,209 crore.LTIMindtree had posted revenue from operations at Rs 7,644.2 crore in the first quarter of the previous fiscal and Rs 8,691 crore in Q4 FY23.In dollar terms, the company's revenue increased 12 percent on-year to $1.05 billion. Consolidated profit came in flat at Rs 1,114 crore, compared to Rs 1,108 crore reported in Q4FY22.Also Read: An earning-based non-directional options strategy in LTIMindtree“We expect LTIMindtree to deliver a soft revenue growth of 0.3% QoQ (in constant currency) in1QFY24 due to weak macro and no license component in revenues, which was present in 4Q. We expect EBIT margin to expand by 25 bps QoQ (ex-integration costs) driven by higher utilisation/ merger synergies, offsetting the impact of weak growth,” analysts at Jefferies said.The foreign brokerage expects IT players to be impacted by the continued softness in the discretionary IT spends driving project ramp-downs/deferments, longer sales cycles, and slower revenue conversion due to fewer short-term deals.Macro HeadwindsEchoing the views, Kotak Institutional Equities expects LTIMindtree to post muted revenue growth of 0.5 percent on qoq basis due to lower pass-through revenue, deal transitions and delayed start to certain engagements in BFSI.Also Read: LTIMindtree stock enters big league, its operating metrics less soHowever, it sees healthy growth in deal wins and 50 bps qoq increase in EBIT margins due to lower pass-through revenues and operational improvements.“We expect investors to focus on -- factors that underpin confidence to achieve double digit growth…, health of deal pipeline and conversion rates, state of demand in impacted verticals of BFS and hi-tech, positioning in cost take-out deals and vendor consolidation events and levers to offset high wage inflation especially onsite,” it said in a note.Meanwhile, Nuvama Institutional Equities expects LTIMindtree to log revenue growth of 0.7 percent QoQ in constant currency as growth is expected to be weak in BFSI and retail, while hi-tech is expected to rebound.“We expect margins to expand by +42bps QoQ - driven by growth and absence of any major headwind/merge related expense. Deal wins are expected to be healthy, with cautiously optimistic commentary on outlook,” it added.Shares of LTIMindtree were trading 1 percent up at Rs 5,144.35 on July 17. The stock has gained 19 percent this year till date, while the 1-year return stands at 3 percent.Disclaimer: The views and investment tips expressed by experts on Moneycontrol.com are their own and not those of the website or its management. Moneycontrol.com advises users to check with certified experts before taking any investment decisions.",LTIMindtree Ltd.
