date,title,content,company
"  August 01, 2023 / 04:23 PM IST  ",Buy SBI Cards and Payment Services; target of Rs 986 : ICICI Securities,"ICICI Securities research report on SBI Cards and Payment ServicesSBI Cards (SBIC) reported QoQ PPOP growth of 6% but 14% higher credit cost led to flattish PAT of INR 5.9bn in Q1FY24. While earnings growth has faced challenges of adverse change in mix (delay in revolver build up post covid), higher cost of funds (rate hikes), higher opex (BNPL competition), regulatory challenges (RBI master circular) and higher credit costs including a long-tailed impact of covid (as seen from ~14bps impact from a FY19 cohort in Q1FY24), it has still reported 27% earnings CAGR over the last 5 years ending FY23. Additionally, these challenges are largely behind the company as reflected in valuations, which have halved in past two years (current valuations indicate 26x FY25E earnings). Expectations of NIMs having bottomed out are realistic due to cost of funds peaking out, gradual increase in higher-yielding EMI cohorts as well as growth in revolvers (revolver outstanding has grown at an average rate of 25% YoY in the past 5 quarters).OutlookMaintain BUY with a revised target price of INR 986 (earlier INR 953) based on 30x (unchanged) FY25E earnings (rolled over from Sep'24) Considering SBIC’s RoA/RoE of ~5%/23%, valuation remains attractive.For all recommendations report, click hereDisclaimer: The views and investment tips expressed by investment experts/broking houses/rating agencies on moneycontrol.com are their own, and not that of the website or its management. Moneycontrol.com advises users to check with certified experts before taking any investment decisions.SBI Cards and Payment Services - 31 -07 - 2023 - isc",SBI Cards and Payment Services Ltd.
"  August 01, 2023 / 11:13 AM IST  ","UPL Standalone June 2023 Net Sales at Rs 3,594.00 crore, down 28.22% Y-o-Y","Net Sales at Rs 3,594.00 crore in June 2023 down 28.22% from Rs. 5,007.00 crore in June 2022.Quarterly Net Profit at Rs. 267.00 crore in June 2023 down 44.26% from Rs. 479.00 crore in June 2022.EBITDA stands at Rs. 570.00 crore in June 2023 down 38.18% from Rs. 922.00 crore in June 2022.UPL EPS has decreased to Rs. 3.55 in June 2023 from Rs. 6.33 in June 2022.UPL shares closed at 624.70 on July 31, 2023 (NSE) and has given -17.50% returns over the last 6 months and -18.59% over the last 12 months.",UPL Ltd.
"  August 01, 2023 / 09:44 AM IST  ",UPL sinks to 52-week low as brokerages paint bleak growth picture,"Shares of UPL Corporation Ltd fell 2 percent in the early trade to hit a 52-week low of Rs 614 on August 1 after brokerages came out with a bleak growth outlook for the agrochemical company following a cut in its guidance targets by the management, reflecting the continued global weakness in the space.At 9.21 am, shares of UPL were trading at Rs 615.45 on the National Stock Exchange, down 1.5 percent from the previous close.On July 31, the agrochemical player reported a dismal set of earnings for the June quarter of FY24, with the bottomline tanking 81.1 percent on year along with a 17.2 percent decline in the topline. Both topline and bottomline fell short of the Street's estimates, which had factored in a weak quarter.Weak demand, price pressureCommenting on the weak demand scenario, UPL Corporation Ltd's CEO Mike Frank said, “The global agrochemical industry has been going through a challenging phase over the last two quarters as distributors prioritised destocking and focused on tactical purchases amid high channel inventories. ""The market was also witnessing pricing pressure fuelled by an unfavourable base and aggressive price competition from the Chinese post patent exporters.Taking this weak demand environment into account, UPL has lowered its revenue growth guidance for the current fiscal to 1-5 percent from 4-8 percent, indicating a prolonged pressure on its revenue.The company has also revised its FY24 margin growth guidance to 3-7 percent from the earlier projection of 6-10 percent.Follow our live blog for all the market actionBrokerages’ takeAligned with the cautious growth outlook, brokerages, too, are not too optimistic.Brokerage firm Motilal Oswal Financial Services sees near-term challenges in the global agrochemical industry due to the accumulation of high inventory, as distributors opt for need-based tactical purchases and declining agrochemical prices, led by aggressive price competition from Chinese post-patent exporters.Also Read: UPL Q1 Results: Net profit plunges 81% to Rs 166 crore, misses expectationsConsidering these short-term challenges, the firm said cash-flow generation and debt repayments will remain key monitorables for UPL.The agrochemical company reduced its net debt by around $160 million to $3,193 million as of June 30, 2023.MOFSL also cut its FY24E/FY25E earnings estimates by 7 percent/8 percent but retained its “neutral” stance and a target price of Rs 670.Though Nuvama Institutional Equities had also factored in the ongoing weakness in the global agrochemicals space, UPL's dismal Q1 results prompted the firm to further trim its estimates.The brokerage cut its FY24E/25E EPS by 7 percent/8 percent amid expectations of a muted topline growth.Nuvama also slashed its price target for the stock by over 8 percent to Rs 886 even as it retained the “buy” call.Centrum Broking, too, revised down FY24E/ FY25E EBITDA estimates to 7 percent/9 percent. The firm has also slashed its price target for the stock by nearly 11 percent to Rs 949 while maintaining a “buy” call.Antique Stock Broking, too, cut its FY24/25 EPS estimates by 10 percent each. The firm also lowered its price target for UPL by over 8 percent to Rs 650, saying recovery may take some time.Jefferies also have a dim outlook for UPL's Q2 earnings on the back of expectations of a near 5 percent on-year decline in agrochemical industry in FY24.The foreign brokerage cut its FY25-26E EPS by 9-10 percent while FY24E cuts are even sharper.""We now estimate FY23-26E EBITDA CAGR (compounded annual growth rate) at 5-6 percent, but forecast PAT CAGR at around 23 percent, driven by deleveraging,” it said.Despite the bleak outlook, the brokerage still has a “buy” call on the stock, with a price target of Rs 800, due to its inexpensive valuations.Disclaimer: The views and investment tips expressed by investment experts on Moneycontrol.com are their own and not those of the website or its management. Moneycontrol.com advises users to check with certified experts before taking any investment decisions. ",UPL Ltd.
"  August 01, 2023 / 08:45 AM IST  ",UPL: Near-term outlook clouded,"                        Highlights

	Weak Q1FY24 quarter
	Higher channel inventory and pricing pressure impact margins
	Management expects recovery in H2FY24
	Sharp cut in FY24 guidance
	Working capital management and debt reduction need to be monitored

UPL Ltd (UPLL; CMP: Rs 625; M Cap: Rs 46,890 crore) has posted dismal Q1FY24 results. High channel inventory, subdued volumes, and normalising raw material prices have put pressure on the crop protection business more than on any other agri-inputs.

Q1FY24 performance

Group revenues in Q1FY24 fell 17 percent year on year (YoY) at Rs...
                    ",UPL Ltd.
