date,title,content,company
"  January 23, 2023 / 06:31 AM IST  ","Hot Stocks | Here's why you should bet on GAIL, Dabur India for short term","Although we didn't mirror the weakness, the markets remained tentative to conclude the week ended January 20 a tad above the 18,000 mark. In the early part of week, the benchmark index managed to cross the intermediate hurdle of 18,100; but didn't have enough legs to go beyond the sturdy wall of 18,200 - 18,300. It seems market requires some solid trigger to break the shackles.On the global front, hopefully, we see relief in the US markets after three days of continuous weakness. However, at our end, few heavyweights are going to report their earnings over this weekend, which will have a considerable impact on our market as we step into the monthly expiry week. As of now, we continue to remain hopeful and expect the action to trigger in the upward direction.As far as levels are concerned, the rock-solid support is visible at 17,900 – 17,750 and till now, bulls have managed to defend it in a challenging environment. On the flipside, it has become a daunting task to surpass the hurdle of 18,150 – 18,300.The way our markets have undergone a long time-wise correction; we expect the breakout to happen soon from this contracted range. Hopefully, quarterly earnings from Reliance Industries and banking giant ICICI Bank, set the tone and help us come out of this slumber phase.The coming week is likely to see some action although it’s truncated as the expiry is preponed by a day on account of Republic Day holiday on Thursday. Also, it’s important to understand, we are inching closer to the ‘Union Budget’ and hence, market would try to position itself ahead of this mega event.Here are two buy calls for short term:GAIL India: Buy | LTP: Rs 99 | Stop-Loss: Rs 94.5 | Target: Rs 107 | Return: 8 percentIn the last couple of months, the stock prices have shown a steady up move by continuously moving in a ‘Higher Top Higher Bottom’ price formation. Recently the stock prices were facing stiff resistance around Rs 97 – 98 levels zone, however this hurdle has been crossed indicating renewed buying interest in this counter.The price structure of the recent price formation resembles a ‘Cup and Handle’ pattern that is technically considered a strong bullish pattern. In addition, we are witnessing a bullish crossover of 50 SMA (simple moving average) crossing 200 SMA from below along with the robust volumes on the daily chart.One can look to buy for a trading target of Rs 107. The stop-loss can be placed at Rs 94.50.Dabur India: Buy | LTP: Rs 566 | Stop-Loss: Rs 549 | Target: Rs 598 | Return: 6 percentThis FMCG company has done nothing during the entire calendar year 2022. It kept oscillating within a broad range with prices rebounding from support zone and vice versa. Recently, we witnessed a price correction from the higher end of Rs 610, which got arrested around its multiple support zone of Rs 540.This week, the stock managed to give steady recovery from the lower band and on Friday, we witnessed a sudden spurt to confirm its daily close above all key moving averages.Taking a glance at the rising volumes, we expect the momentum to extend in the forthcoming week. We recommend buying for a short term target of Rs 598. The stop-loss can be placed at Rs 549.Disclaimer: The views and investment tips expressed by investment experts on Moneycontrol.com are their own and not those of the website or its management. Moneycontrol.com advises users to check with certified experts before taking any investment decisions.Disclaimer: MoneyControl is a part of the Network18 group. Network18 is controlled by Independent Media Trust, of which Reliance Industries is the sole beneficiary.",GAIL (India) Ltd.
"  January 23, 2023 / 10:51 PM IST  ","Gland Consolidated December 2022 Net Sales at Rs 938.29 crore, down 11.76% Y-o-Y",,Gland Pharma Ltd.
"  January 23, 2023 / 09:11 AM IST  ","Top 10 trading ideas for next 3-4 weeks, backed by upbeat earnings, Budget optimism","The market ended a volatile week on a positive note on January 20, and sustained an upward swing for the the second straight week, with the Nifty taking support at the psychological 18,000 mark.The index remained rangebound and formed a Doji candle for yet another week on the weekly scale with a higher-high-higher-low formation, as the closing was near its opening level, indicating indecisiveness among buyers and sellers about future market trend.The index closed with 71 points gains at 18,028 for last week and has overall been consolidating within a tight range of 17,800-18,200 especially amid quarterly earnings and ahead of the Union Budget scheduled to be tabled in Parliament by the finance minister on February 1.Experts feel the above range is expected to break on either side after the announcement of the Budget, hence, if the index breaks 18,200, then 18,500 is the level to watch out for as crossing it could bring a sharp upside, whereas the downside could be up to 17,500 if there is a decisive break of 17,800-17,900 levels.""As far as levels are concerned, the rock-solid support is visible at 17,900 – 17,750 and bulls have till now managed to defend it in a challenging environment. On the flipside, it has become a daunting task to surpass the hurdle of 18,150–18,300,"" Sameet Chavan, Chief Analyst-Technical and Derivatives at Angel One, said.The way our markets have undergone a long time-wise correction, he expects the breakout to happen soon from this contracted range.He feels the week beginning today may see some action, although it will be a truncated one as the expiry is advanced by a day on account of the Republic Day on Thursday. ""Also, it’s important to understand that we are inching closer to the Union Budget and hence, the market would try to position itself ahead of this mega event,"" he said.The stock-specific action is expected to continue in the current week too, given the ongoing corporate earnings season and Budget expectations, experts feel.Let's take a look at the top 10 trading ideas by experts for the next three-four weeks. Returns are based on the January 20 closing prices:Expert: Subash Gangadharan, Senior Technical & Derivative Analyst at HDFC SecuritiesDabur India: Buy | LTP: Rs 566 | Stop-Loss: Rs 550 | Target: Rs 590 | Return: 4 percentDabur has corrected from a high of Rs 611 touched in December 2022. The stock recently found support around Rs 538 level in January 2023. This is close to the previous intermediate lows, indicating a double bottom formation. The stock has subsequently bounced back and made a higher bottom in the last few sessions.In the process, the stock broke out of a trading range on the back of healthy volumes, which is encouraging. Momentum readings like the 14-day RSI (relative strength index) too have bounced back and are in rising mode now.With the intermediate technical setup too looking positive, we believe the stock has the potential to move higher in the coming weeks. We recommend a buy between Rs 564-568 levels, with a stop-loss at Rs 550 and target of Rs 590.GAIL India: buy | LTP: Rs 99 | Stop-Loss: Rs 96 | Target: Rs 105 | Return: 6 percentAfter correcting from a high of Rs 109 tested in April 2022, GAIL found support around Rs 83 level in September 2022. These are strong supports as they also roughly coincide with previous intermediate lows.The stock has since then been climbing higher and making higher bottoms in the process. This week, the stock also broke out of its recent trading range on the back of above average volumes, indicating it is set to move higher in the coming weeks.Technical indicators are giving positive signals as the stock is trading above the 20 and 50-day SMA (simple moving average). Momentum readings like the 14-week RSI too are in rising mode and not overbought, which implies potential for further upsides.With the intermediate technical setup too looking attractive, we expect the stock to move up towards its previous intermediate highs in the coming weeks. Buy between Rs 97-101 levels, with a stop-loss at Rs 96 and target of Rs 105.Bajaj Finance: Sell | LTP: Rs 5,860 | Stop-Loss: Rs 6,075 | Target: Rs 5,460 | Return: 7 percentBajaj Finance is in a short term downtrend as it has been making lower tops and lower bottoms for the last several weeks. Recently, the stock broke down below its recent supports after reacting from close to its 50-day SMA. This indicates that the downtrend looks set to continue.Technical indicators are giving negative signals as the stock is now trading below the 20 day and 50 day SMA. Momentum readings like the 14-week RSI are in decline mode and not oversold, which implies potential for more downsides.We therefore expect the stock to correct further in the coming sessions. Sell between Rs 5,855-5,865 levels, with a stop-loss at Rs 6,075 and downside target of Rs 5,460.Expert: Shrikant Chouhan, Head of Equity Research (Retail) at Kotak SecuritiesDivis Laboratories: Sell | LTP: Rs 3,343 | Stop-Loss: Rs 3,430 | Target: Rs 3,100 | Return: 7 percentThe stock was forming a rising leg bearish consolidation and the support was at Rs 3,350. On Friday, the stock closed below the level of Rs 3,350.Based on the charts, the stock is heading towards the next supports, which are at Rs 3,250 and Rs 3,100. The stock is trending down and a breakdown of the formation should generate further bearish momentum in the near term. Sell at Rs 3,350-3,400, with a stop-loss of Rs 3,430.HDFC Bank: Buy | LTP: Rs 1,661 | Stop-Loss: Rs 1,600 | Target: Rs 1,770 | Return: 7 percentThe stock has completed a corrective pattern at Rs 1,560 and has reversed sharply on the back of broad based buying in the private sector bank stocks, which will help the stock to exhibit a trending move in the near term.However, we can be buyers only if it crosses Rs 1,670 or dips towards Rs 1,630. In either case, the stop-loss would be Rs 1,600. Above Rs 1,670 it will find resistance at Rs 1,720 and Rs 1,770.SRF: Buy | LTP: Rs 2,105 | Stop-Loss: Rs 2,000 | Target: Rs 2,500 | Return: 19 percentThe stock is on the verge of completing a corrective pattern. It has displayed a trending movement between the levels of Rs 2,000 to Rs 2,865 during the period July 2022 to September 2022.The corrective pattern is nearing completion between Rs 2,125 to Rs 2,100 levels. It will be an opportunity for traders and investors to invest in the stock from a medium term perspective. On the upside, on the reversal it would rally towards Rs 2,400 to Rs 2,500 levels. Keep a stop-loss at Rs 2,000 for holding positional long positions.Expert: Jigar S Patel, Senior Manager - Equity Research at Anand RathiMinda Corporation: Buy | LTP: Rs 228 | Stop-Loss: Rs 215 | Target: Rs 260 | Return: 14 percentThe weekly chart of Minda Corporation depicts a perfect symmetrical triangle breakout above Rs 230 mark. The said pattern has a theoretical target of over Rs 300 level. The price action is supported by the positive placement of the weekly RSI which indicates strength in the momentum.Thus, we advise traders to accumulate the stock in the range of Rs 226-230 with a stop-loss of Rs 215 (daily closing basis) for an upside target of Rs 260 on a daily close basis.APL Apollo Tubes: Buy | LTP: Rs 1,197 | Stop-Loss: Rs 1,140 | Target: Rs 1,300 | Return: 9 percentThe rally which was started in May 2022 till date resulted in 47 percent appreciation. Currently, it is trading above the 12-21-50 daily exponential moving averages (EMA), which is a sign of strength in the counter.The previous trading session gave a clean breakout from the triangle pattern. On indicator front, daily 14 period RSI has taken support and then it has rebounded thus indicating further up move in APL Apollo Tubes.One can buy around Rs 1,180-1,200 with an expected target of Rs 1,300 and the stop-loss would be Rs 1,140 on a daily close basis.Expert: Mitesh Karwa, Research Analyst at Bonanza PortfolioGNFC: Buy | LTP: Rs 563.5 | Stop-Loss: Rs 590 | Target: Rs 660 | Return: 17 percentThe stock was seen to be retesting a breakout of a rounding bottom formation after five years on the weekly timeframe whereas on the daily timeframe the stock was seen to be taking support from a support zone and bouncing with high volumes which can be used as a confluence towards the bullish view.The 200-day EMA is at around Rs 430 on the weekly timeframe and the stock is expected to be comfortably trading above it. The momentum oscillator RSI (14) is at around 46 showing strength by taking support at lower levels and the supertrend indicator is indicating continuation of the bullish trend.Observation of the above factors indicates that a bullish move is possible in GNFC for target upto Rs 660. One can initiate buy on dip in the range of Rs 620-623 with a stop-loss below Rs 590 on daily closing basis.Indoco Remedies: Buy | LTP: Rs 391.5 | Stop-Loss: Rs 372 | Target: Rs 400 | Return: 2 percentIndoco Remedies was seen to be breaking out of a downwards sloping triangle pattern on the weekly timeframe after one and a half years and on the daily timeframe the stock was seen to be making a double bottom formation which can be used as a confluence towards the bullish view.The 200 DEMA is at Rs 321 on the weekly timeframe and the stock is comfortably sustaining above it which is a positive sign.Momentum oscillator RSI (14) is at around 59 on the daily time frame indicating strength by sustaining above 50 and the supertrend indicator is also indicating bullishness. Observation of the above factors indicates that a bullish move in Indoco is possible for target upto Rs 400. One can initiate a buy trade in between the range of Rs 385-387 with stop-loss of Rs 372 on daily closing basis.Disclaimer: The views and investment tips expressed by investment experts on Moneycontrol.com are their own and not those of the website or its management. Moneycontrol.com advises users to check with certified experts before taking any investment decisions.",HDFC Bank Ltd.
"  January 23, 2023 / 03:34 PM IST  ",Neutral HDFC Life Insurance; target of Rs 670: Motilal Oswal,"Motilal Oswal's research report on HDFC Life InsuranceHDFC Life Insurance (HDFCLIFE) reported a stable 3QFY23 performance with in-line APE/VNB and healthy premium growth led by renewal premium (up 30% YoY), while new business premium grew moderately at 10% YoY. APE rose 26% YoY to INR32.6b (in line) in 3QFY23, fueled by annuity, nonlinked savings and credit life. Demand for ULIP was soft due to volatile capital markets while trend in retail protection improved QoQ.  VNB too increased 26% YoY (in line) with margin expanding 100bp QoQ to 26.8%. EV grew 5% QoQ to INR377b.OutlookWe estimate HDFCLIFE to deliver ~27% VNB CAGR over FY22-25 and margin to improve to ~31% by FY25. Retain Neutral with a TP of INR670 (premised on 2.8x Sep’24E EV).For all recommendations report, click hereDisclaimer: The views and investment tips expressed by investment experts/broking houses/rating agencies on moneycontrol.com are their own, and not that of the website or its management. Moneycontrol.com advises users to check with certified experts before taking any investment decisions.HDFC Life Insurance - 22 -01-2023 - moti",HDFC Life Insurance Company Ltd.
"  January 23, 2023 / 09:29 AM IST  ","HDFC Life Standalone December 2022 Net Sales at Rs 19,551.01 crore, up 36.86% Y-o-Y","Net Sales at Rs 19,551.01 crore in December 2022 up 36.86% from Rs. 14,285.25 crore in December 2021.Quarterly Net Profit at Rs. 315.22 crore in December 2022 up 15.19% from Rs. 273.65 crore in December 2021.EBITDA stands at Rs. 201.79 crore in December 2022 down 31.63% from Rs. 295.14 crore in December 2021.HDFC Life EPS has increased to Rs. 1.48 in December 2022 from Rs. 1.35 in December 2021.HDFC Life shares closed at 590.55 on January 20, 2023 (NSE) and has given 12.44% returns over the last 6 months and -9.07% over the last 12 months.",HDFC Life Insurance Company Ltd.
"  January 23, 2023 / 09:46 AM IST  ","HDFC Life Consolidated December 2022 Net Sales at Rs 19,576.76 crore, up 37% Y-o-Y","Net Sales at Rs 19,576.76 crore in December 2022 up 37% from Rs. 14,289.26 crore in December 2021.Quarterly Net Profit at Rs. 315.91 crore in December 2022 up 14.76% from Rs. 275.28 crore in December 2021.EBITDA stands at Rs. 193.33 crore in December 2022 down 34.89% from Rs. 296.94 crore in December 2021.HDFC Life EPS has increased to Rs. 1.48 in December 2022 from Rs. 1.36 in December 2021.HDFC Life shares closed at 590.55 on January 20, 2023 (NSE) and has given 12.44% returns over the last 6 months and -9.07% over the last 12 months.",HDFC Life Insurance Company Ltd.
"  January 23, 2023 / 10:03 PM IST  ",Buy ICICI Bank; target of Rs 1105: HDFC Securities,"HDFC Securities' research report on ICICI BankICICI Bank (ICICIBC) reported yet another quarter of all-round impressive balance sheet performance with loan growth (+20% YoY), NIMs (4.7%) and asset quality (GNPA at 3.1%), reflecting in strong profitability vectors (standalone RoE of ~18%). Net slippages continued to remain benign (+0.5% annualised); however, the bank further shored up its contingent provisions, taking the stock of contingent provisions prudently to 130bps. Given the benign credit cycle, we believe that the bank is currently witnessing a profitability overshoot, which is difficult to sustain. With deposit mobilisation lagging loan growth and timing differences in repricing, we believe that peak NIMs are now behind (expecting moderation in FY24E).OutlookWe tweak our FY23E/FY24E earnings estimates by 2-5% and maintain BUY with an SOTP-based TP of INR1,105 (standalone at 3.0x Sep24 ABVPS).For all recommendations report, click hereDisclaimer: The views and investment tips expressed by investment experts/broking houses/rating agencies on moneycontrol.com are their own, and not that of the website or its management. Moneycontrol.com advises users to check with certified experts before taking any investment decisions.ICICI Bank - 23 -01-2023 - hdfc",ICICI Bank Ltd.
"  January 23, 2023 / 08:52 PM IST  ",Buy ICICI Bank target of Rs 1120: Sharekhan,"Sharekhan's research report on ICICI BankICICI Bank reported strong earnings growth of 34% y-o-y/10% q-o-q, with RoA at 2.2%. Core PPOP grew 35% y-o-y. NIM expanded by 34 bps q-o-q to 4.65%. We believe NIMs are expected to peak out for the bank by Q1FY2024, taking a base case as the last hike by the RBI in February 2023. Slippages were higher at 2.8% annualised vs. 2.3% in the last quarter. However, higher recoveries restricted the increase in net slippages to Rs. 1,119 crore. Asset quality showed improvement q-o-q and coverage ratio stands comfortable at 83%. While reported credit costs were at 90 bps (annualised), the bank made a contingent provision of 15 bps of loans this quarter, taking the total contingent provision to 1.2% of loans. Loan growth remained healthy and was broad-based, up 20% y-o-y and 4% q-o-q, led by the retail and corporate segments. Total deposits grew by 10% y-o-y and 3% q-o-q, while CASA deposits grew by 6% y-o-y/flat q-o-q. CASA ratio moderated to 45.3% vs. 46.6% q-o-q.OutlookThe stock is currently trading at 2.5x/2.1x/1.8x its FY2023E/FY2024E/FY2025E core BV estimates. We maintain our Buy rating on the stock with an unchanged PT of Rs. 1,120. The strong outperformance in recent years implies that further re-rating is likely to be a very gradual one.For all recommendations report, click hereDisclaimer: The views and investment tips expressed by investment experts/broking houses/rating agencies on moneycontrol.com are their own, and not that of the website or its management. Moneycontrol.com advises users to check with certified experts before taking any investment decisions.ICICI Bank - 23 -01-2023 - khan",ICICI Bank Ltd.
"  January 23, 2023 / 05:42 PM IST  ",Buy ICICI Bank; target of Rs 1028: LKP Research,"LKP Research's research report on ICICI BankEarnings in 3QFY23 re-acknowledge our conviction that ICICI Bank is maintaining a sustainable and prudent growth led by tech-driven initiatives. The bank has reported its 3QFY23 results and the key pointers are: 1) Strong NII growth of 34.6% YoY, with headline NIMs (Domestic: 4.79% & Overall: 4.65%) up sequentially led by higher proportion of EBLR loans. 2) PPoP growth higher sequentially driven by healthy NII and lower C/I (38.2%), 3) Reported slippages (₹57bn v/s ₹44bn in 2QFY23) increased sequentially, 4) NNPA ratio improved further at 0.55%, 5) PCR (excluding technical write-offs) stood at 82.6%. The Bank made ₹15bn of additional contingent provision. However the bank didn’t include contingent & floating provision (~₹213bn) in PCR calculation; 7) Contingent provision (excluding PCR) stood at 2.2% of the loan book, 8) BB & below exposure down sequentially to 1.2% of net advances, 9) the bank’s net advances grew by 19.7% YoY and 3.8% sequentially; and 8) deposits stood at ₹11.2tn mark and grew sequentially by 2.9% with average CASA at 44.6%. Moreover, provision expenses inched up sequentially to ₹22.6bn v/s 16.4bn in 2QFY23. Factoring stable balance sheet growth and credit cost of below 1% in FY24E, we estimate the bank’s FY23E ROA and ROE of 2.1% and 16.6% respectively. We have positive outlook on the bank with BUY rating.OutlookWe expect its loan book to grow at CAGR of 20% over FY22-24E, led by technology initiatives. The credit cost normalization is underway. We estimate return ratio ROA/ROE of 2.1% and 16.6% in FY24E. We value the standalone entity at 2.7xFY24E BVPS (₹336) and investment in subsidiaries and JVs (₹122 per share); we arrive at a target price of ₹1,028. We recommend BUY with a potential upside of 18%.For all recommendations report, click hereDisclaimer: The views and investment tips expressed by investment experts/broking houses/rating agencies on moneycontrol.com are their own, and not that of the website or its management. Moneycontrol.com advises users to check with certified experts before taking any investment decisions.ICICI Bank - 23 -01-2023 - lkp",ICICI Bank Ltd.
"  January 23, 2023 / 02:41 PM IST  ",Buy ICICI Bank; target of Rs 1090: Prabhudas Lilladher,"Prabhudas Lilladher's research report on ICICI BankICICIBC saw another steady quarter with core PAT at Rs83bn beating PLe by 4%. While NIM was higher at 5.08% (PLe 4.91%) driven by lower interest cost, higher provisions were offset by lower opex. As per bank, rise in deposit cost was much lower as RTDs are being repriced with a lag. NIM still has headroom to expand in Q4 post which it would start to contract. As revenue growth would lag that of loans in FY24, opex intensity remains a key. Loans grew at 3.8% QoQ which was led by corporate (+4.7%), retail (+4.5%), and SME/BuB (+6.5%); we are factoring a loan CAGR of 17% over FY23-25E.OutlookWe are also watchful of RTD growth which should pick-up in FY24. Provisions were higher as Rs12bn was created to make corporate provision policy more conservative (than RBI) and in-line with retail/SME. Maintaining multiple at 3.0x on core Sep’24 ABV, we retain SOTP based TP at Rs1090. BUY.For all recommendations report, click hereDisclaimer: The views and investment tips expressed by investment experts/broking houses/rating agencies on moneycontrol.com are their own, and not that of the website or its management. Moneycontrol.com advises users to check with certified experts before taking any investment decisions.ICICI Bank - 22 -01-2023 - prabhu",ICICI Bank Ltd.
