date,title,content,company
"  May 22, 2023 / 10:54 AM IST  ","Siemens falls 10% on nod to sale of low voltage motors, gears wing for Rs 2,200 cr","Shares of Siemens Ltd fell over 10 percent on May 22 after the firm said its board approved the sale of low voltage motors and geared motors businesses to a Siemens AG subsidiary -- Siemens Large Drives India -- for Rs 2,200 crore.The stock hit a low of Rs 3,338 and fell as much as 11 percent from its previous close. At 10.06am, the stock was trading at Rs 3,363 on BSE, down 9.45 percent while India's benchmark Sensex rose 0.08 percent to 61,780 points.""In doing so, Siemens is letting go a business with outsourced manufacturing that has grown at mid-to-single-digit CAGR over the past decade. Proposed valuations appear to consider a similar growth trajectory in the future. The business at an aggregate market level has good market prospects in our view,"" said Kotak Institutional Equities in its latest note.""We retain Rs 3,200 FV while noting the case for Rs 3,000 FV if this transaction goes through. We build in a 15% lower multiple for SIEM versus what the Street builds. These factors, among other things, lower growth/value of businesses contributing to 50% of RM cost that is purchase of stock-in-trade,"" Kotak report added.The Board of Directors of Siemens Limited has approved the sale and the transfer of low voltage motors and geared motors businesses, including related customer service business to Siemens Large Drives India Pvt Ltd, an entity wholly owned by Siemens AG, for a consideration of Rs 2,200 crore with effect from October 1, 2023, a company statement said.The segment was 7% of FY22 sales and 9% of profits valued at 15X FY2022 EBITDA and 17X FY2022 profit from operations. Although this segment is not considered significant for Siemens' growth prospects in Transmission and Railways, its sale at a lower enterprise value-to-sales (EV/sales) ratio resulted in an implied loss of Rs189 for investors, Jefferries noted.""As strong double-digit order flow and profit growth continues, and given this is a smaller division, this is likely to have only a temporary stock impact. However, we will be watchful on multiple should a more meaningful event occur,"" Jefferies said in a note to investors.Meanwhile brokerage firm Nomura has downgraded the stock to reduce from Neutral and kept target price to Rs 3,521 from Rs 3,008 a share. The brokerage firm said concerns arise on fairness of valuation for business being sold to the parent.The Board has also decided to consider the distribution of 100 per cent of the sale consideration as reduced by applicable Capital Gains Tax and any other applicable taxes, if any, on the transaction, as a special dividend, at the first board meeting after the completion of the proposed transaction.Brokerage firm Kotak expects a 7% cut in its face value on loss of 9% of bottom-line against the post-capital gains tax payout of Rs 1,800 crore to shareholders from the proposed transaction. ""We continue to value SIEM at 47X two-year forward earnings, 15% discount to Street’s multiple and that of ABB. Such is the extent of rerating over and above that of ABB that SIEM saw over the past 21 months, over which it underperformed ABB on EBITDA growth,"" Kotak report added.",Siemens Ltd.
"  May 22, 2023 / 10:44 AM IST  ",What the IPO of Tata Technologies brings to Tata Motors,"                        Highlights

	Tata Motors holds a 74.4 percent stake in Tata Technologies
	Tata Technologies is focused on aerospace and automotive space
	Tata Technologies generates 34 percent revenue from Tata Motors
	IPO offers additional upside to Tata Motors’ share

The IPO (initial public offering) of Tata Technologies is one of the most anticipated public issues this year because of the group's reputation as well as the fact that it is a subsidiary of Tata Motors, which saw a change in fortunes in the last few years....
                    ",Tata Motors Ltd.
"  May 22, 2023 / 06:56 AM IST  ","Trade Spotlight | Your strategy for KEC International, Ramco Cements, Mastek today","The market gathered strength for first time in last four sessions and reclaimed the 18,200 levels on the Nifty50 on May 19, backed by information technology, banks, auto, and select metal stocks.The BSE Sensex climbed nearly 300 points to 61,730, while the Nifty50 gained 73 points to 18,203 and formed bullish hammer sort of a candlestick pattern on the daily charts, which is a bullish reversal pattern formed after a decline.The Bank Nifty gained more than 200 points to end at 43,969 and formed a bullish pin bar kind of candlestick pattern with long lower shadow on daily scale which suggests buying is visible at lower zones.India VIX, which measures the expected volatility for next 30-days in the Nifty50, fell by 3.84 percent to 12.30 levels, from 12.80 levels, giving some comfort for bulls, but overall has been within the range of 11.6-13.6 levels for several weeks now.Stocks that performed better than broader markets included KEC International which surged over 12 percent to Rs 540 and recouped all the losses of previous five straight sessions. The stock has formed robust bullish candlestick pattern on the daily charts, with strong volumes.Ramco Cements shares rallied 8 percent to Rs 844, the highest closing level since February 17, 2022, and formed strong bullish candlestick pattern on the daily scale, with healthy volumes. Even on the weekly basis, it has seen healthy bullish candle formation with robust volumes, closing with 10 percent gains.Mastek rose 6 percent to Rs 1,888, the highest closing level since September 13 last year, and formed long bullish candlestick pattern on the daily charts, with above average volumes. The stock has seen a decisive Mother candle breakout on the higher side on Friday, indicating potential continuation in the uptrend.Here's what Rajesh Palviya of Axis Securities recommends investors should do with these stocks when the market resumes trading today:KEC internationalSince past three years, the stock has been strongly consolidated within Rs 560-350 levels. This consolidation phase is backed with huge volume spikes which indicate increased participation.With current levels, the stock is inching up towards a major ""multiple resistance zone"" breakout of Rs 550 levels hence any decisive close above the same may lead upside momentum towards Rs 650-700 levels.Past couple of week's buying momentum was observed from the 200-day SMA (simple moving average - Rs 453) which remains a crucial support zone. The daily weekly and monthly RSI (relative strength index) is in bullish mode which signals rising strength. The weekly and monthly ""band Bollinger"" buy signals indicate increased momentum.Investors should buy, hold and accumulate this stock with an expected upside of Rs 650-700 and the downside support zone is at Rs 480-440 levels.Ramco CementsWith last week's price action the stock has registered 10 percent gains and also confirmed ""symmetrical triangle"" breakout around Rs 800 levels. This breakout is accompanied with huge volumes which indicates increased participation.On the daily and weekly time frame, the stock is in uptrend forming a series of higher tops and bottoms. In addition, the stock is also well placed above its 20, 50, 100 and 200-day SMA which reconfirms bullish sentiments. The daily weekly and monthly RSI is in bullish mode which signals rising strength.Investors should buy, hold and accumulate this stock with an expected upside of Rs 900-950 and with a downside support zone of Rs 820-800 levels.MastekSince September 2022, the stock was consolidating within Rs 1,850-1,480 levels, however with current week's price action the stock has decisively broken out this consolidation on a weekly closing basis indicating positive bias.On the daily and weekly time frame, the stock has witnessed trend reversal. Rising volumes confirms increased participation. The stock is sustaining above its 20, 50, 100 and 200-day SMA which supports bullish sentiments. The daily and weekly ""band Bollinger"" buy signals indicate increased momentum.Investors should buy, hold and accumulate this stock with an expected upside of Rs 2,000-2,200, with downside support zone of Rs 1,760-1,700 levels.Disclaimer: The views and investment tips expressed by investment experts on Moneycontrol.com are their own and not those of the website or its management. Moneycontrol.com advises users to check with certified experts before taking any investment decisions.",The Ramco Cements Ltd.
"  May 22, 2023 / 08:52 AM IST  ",Vedanta's board to deliberate first dividend for FY24,"The board of Vedanta, the mining major led by billionaire Anil Agarwal, is scheduled to meet on May 22 to deliberate on and approve the company's first interim dividend for FY 24.As stated in a regulatory filing made on May 18, Vedanta has set May 30 as the record date for the dividend, should it be declared.On April 6, the Mumbai-based company made an announcement regarding an interim dividend of Rs 20.50 per share, resulting in a total dividend payout of Rs 101.50 per share for FY23.Meanwhile, Vedanta Resources' Ltd (VRL) is reportedly in talks with Deutsche Bank and other global lenders, including JPMorgan and Barclays, to raise a $500-600 million loan after delays in securing funds from Farallon Capital Management to meet its obligations later this month. The company aims to borrow the money via its Zinc International unit.A $ 500 million repayment is due on a 7. 125 percent bond that matures on May 31.Last week, Vedanta Limited reported a 56.3 percent year-on-year decline in profit at Rs 2,634 crore in the March quarter against Rs 6,027 crore in the same quarter of the previous fiscal.Net profit attributable to owners of the company fell over 67 percent YoY to Rs 1,881 crore.Revenue, too, dropped 5.4 percent to Rs 37,225 crore from Rs 39,342 crore in Q4 FY22. On the operating front, the company's EBITDA decreased 33.4 percent to Rs 8,754 crore.",Vedanta Ltd.
