date,title,content,company
"  September 07, 2023 / 03:34 PM IST  ",Norges Bank may vote against ICICI Securities delisting proposal as shareholders seek higher valuation,"Norway’s government pension fund manager and an Indian PMS are likely to vote against the proposal to delist ICICI Securities, as clamour over low valuation grows among investors, who believe the stock is ripe for a re-rating, said sources aware of the matter.The news sent ICICI Securities shares soaring over 5 percent. The stock rose to an intraday high of Rs 652, before paring gains and closing at Rs 635, up 2.4 percent from the previous close.Norway’s Norges Bank Investment Management's Government Pension Fund Global holds 3.13 percent stake in ICICI Securities. A south India-based portfolio management service, which also holds ~3 percent of the company, is also against the delisting. While PMS directly credit the shares to their clients' accounts, they still hold the power of attorney to operate those and vote.On June 29, ICICI Securities announced that it will delist and become a wholly-owned subsidiary of its parent company ICICI Bank. Public shareholders of the broking firm would be allotted 67 equity shares of ICICI Bank for every 100 equity shares of the company.Boards of both ICICI Bank and ICICI Securities have approved the proposal as they believe it will lead to more synergies. However, approvals from the shareholders and creditors of both the entities, Reserve Bank of India, the National Company Law Tribunal, and the stock exchanges are still pending.Also Read: ICICI Securities delisting: Why do shareholders feel short-changed after swap ratio and what next?Why shareholders feel short-changedAs of September 6 closing price, ICICI Securities shareholders would get only a 3.2-percent premium. ICICI Bank holds 74.83 percent in ICICI Securities and public shareholders the remaining 25.17 percent.Furthermore, a minority shareholder and SEBI registered PMS provider named Manu Rishi Guptha has sent out emails to all his fellow shareholders to 'fiercely oppose and vote against the delisting resolution'. Over 500 shareholders have joined Guptha's Telegram channel to decide on the next course of action.""During the ICICI Securities IPO in 2018, the shares were offered at a valuation of 30x trailing earnings. At the time of delisting today, ICICI Bank is offering just 18x of FY23 earnings,"" he said.""At 30x earnings, which we believe is a fair valuation, the stock should be valued at Rs 1,030 per share or at least the fair offer should be ICICI Bank share price on the delisting date i.e., a 1:1 ratio,"" he added.Shareholders eye re-rating of ICICI Securities stockMinority shareholders believe that the stock, which has not shown any fireworks since listing, is finally ripe for a re-rating. The company has been diversifying its revenue streams and has a good dividend yield of 3.06 percent. As of June end, the company was sitting on cash and cash equivalents of Rs 8,093 crore.Revenue contribution from cash broking, which is a cyclical component, has come down to 35 percent from 37 percent a year-ago. Meanwhile, wealth management, derivative broking, and loan distribution segments are growing faster.Also Read: SEBI moving towards granular risk-based regulation using AI, says Madhabi Puri BuchIn the retail cash segment, the company has a market share of 12.2 percent. In the retail derivative segment, its market share stood at 3.6 percent as of June end. ""We continue to maintain a leadership position in margin trading facility with a market share of ~22 percent,"" the company said in its Q1 FY24 earnings presentation.ICICI Securities also has a high return on equity at 42.3 percent, second to Angel One at 47 percent, while IIFL Securities and Motilal Oswal Financial Services have sub-20 percent ROEs.""Other bank-owned securities companies like HDFC Securities, Kotak Securities and Axis Securities are closely held. If ICICI Bank wanted to do the same, then it should not have listed ICICI Sec in the first place,"" said another minority shareholder, who did not wish to be named.Votes neededLife Insurance Corporation of India has a 2.58-percent stake in the company. As per the June shareholding pattern, mutual funds have a ~1 percent stake. Fidelity fund has 1.2 percent while retail investors have 7.12 percent.The delisting will go through only if approved by a 2:1 majority of public shareholders in the voting process by postal ballot. The dates have not been announced as of now.Meanwhile, ICICI Securities management also has little idea on the delisting progress. During a Q1 FY24 earnings call, managing director and CEO Vijay Chandok said, ""This is an action from the shareholder side. So, they would be the right people to comment on this. I mean, I really don't know what really, you're expecting me to speak on this.""",ICICI Securities Ltd.
"  September 07, 2023 / 08:57 AM IST  ","Analyst Call Tracker: Banking, finance firms remain Street favourites as IT pain persists","Banking, finance, and select infrastructure stocks were the runaway favourites of analysts in August as robust credit growth, stable asset quality, and a virtuous capex cycle burnished their appeal.Banking and finance counters were the stars of the Q1 results season, and the optimism is reflected in Moneycontrol’s Analyst Call Tracker for August.More than half of the companies with the most optimism score or with the maximum upgrades belong to the BFSI (banking, financial services and insurance) space.In contrast, the gloom-and-doom narrative continued around the information technology sector, which had to endure a sombre Q1 earnings season marred by an uncertain demand environment due to recessionary headwinds in the West.India’s largest lender SBI leads the chart in terms the most ‘buy’ calls in the month at 47.Not without reason.SBI posted its highest-ever quarterly earnings at Rs 16,884 crore for Q1 FY24, soaring 178 percent on-year, though net interest income came in below estimates at Rs 38,905 crore.Analyst Call Tracker: Sluggish demand, unclear debt reduction target push UPL into a pool of downgradesThe management continues to remain optimistic on credit delivery through revamped buildout in SME, steady growth in retail, and existing pipeline in corporate loans.“However, with pressure on NIMs (net interest margins) in a rising competitive environment and limited headroom on MCLR repricing, SBI needs to ramp up other avenues of productivity (fee income and lower opex)…,” domestic brokerage HDFC Securities said.In fact, the pressure on net interest margin was the fly in the ointment for the sector as a whole.While the RBI has been on a rate hike pause, banks are facing increasing pressure of hiking interest rates further to chase depositors. Moreover, since most of their loan book has been already repriced (more than half of it is linked to external benchmark lending rate (EBLR)), analysts expect the resultant squeeze in margins to weigh on banks’ balance sheets at least for this fiscal.“The delayed pass-through of monetary-policy rate[1]hikes in deposit rates versus lending rates, coupled with faster growth in credit versus deposits, has resulted in a near 50bp contraction in spreads between lending and deposit rates for the banking system. This is likely to lead to compression of net interest margins for the banking system in FY24 versus FY23,” AnandRathi said in a note.But the good news is that robust credit demand, which underpins the domestic consumption engine, limits the downside for banks.“We remain optimistic on medium-term credit growth and expect sector credit to grow 13% y-y in FY24F and FY25F, respectively. We continue to view the banking sector favourably on its strong RoE, reasonable valuations and low imminent risks to earnings,” analysts at foreign brokerage firm Nomura said.Private sector lenders HDFC Bank, ICICI Bank, Axis Bank and IndusInd Bank all scored over 40 ‘buy’ calls each, reflecting the consensus view on the sector.Macro StrengthInfrastructure companies were the other top picks of analysts in August, with NTPC, Adani Ports and SEZ and L&T leading the pack.The government’s focus on infrastructure development, coupled with rising state governments’ and private sector capex, has added sheen to the sector’s near-term outlook.“Order inflow momentum remains strong and broad-based while some pockets are witnessing moderation on a high base of last year. While government capex continues to remain the major driver, some greenshoots of private capex are visible in traditional as well as new age industries (such as data centres, green energy),” Yes Securities said.Analyst call tracker: Despite rise in downgrades, market leader UltraTech continues to charmMost infra firms reported healthy order wins and a strong deal pipeline. Managements also gave out favourable guidance.For example, engineering and construction major L&T expects revenue to increase 12-15 percent and order inflow to grow 10-12 percent in FY24.In 1QFY24, consolidated revenue increased 33.6 percent YoY to Rs 47,882 crore, driven by strong growth in infrastructure projects, up 55.5 percent YoY to Rs. 22,396 crore.“The company’s growing order inflows and order prospects pipeline will support performance in the future. Strong revenue, focus on cash generation, and sound capital allocation are expected to aid the company’s profitability,” analysts at Geojit said.Pain PointsThe Indian IT majors dominate the pessimism list for the month.The sector as a whole is grappling with the fallout of global macroeconomic challenges, as record high interest rates take a toll on economies in the West and fan recession fears.The top five Indian IT companies (by market capitalisation) have seen their sequential revenue growth on a constant currency basis at anywhere between -2.8 percent and 1 percent, a far cry from the high single-digit and double-digit growth seen last year. The biggest shocker, however, was Infosys’ sharp guidance cut for the year from 4-7 percent to 1-3.5 percent.However, Wipro emerged as the company with the most ‘sell’ calls at 18.The IT services company reported a net profit of Rs 2,870 crore in the first quarter. Though the bottomline was up around 12 percent on year, it fell 6.6 percent on a sequential basis, largely due to a decline across all major financial metrics. The net profit also lagged the Street's estimate of Rs 2,976 crore.Revenue grew 6 percent on year to Rs 22,831 crore but that too missed estimate of Rs 23,014 crore. Sequentially, the topline was up 1.6 percent from Rs 23,176 crore seen in the previous quarter.On top of that, the company rolled out a revenue growth guidance of  -2 percent to 1 percent in constant currency terms for the July-September quarter on the back of a challenging macro environment.Morgan Stanley highlighted that the deceleration in Wipro's revenue growth was much steeper than its peers. The firm believes that until Wipro manages to narrow that gap, its P/E discount will likely remain higher as compared to its peers.Wipro’s Q1FY24 performance missed estimates on all fronts, ICICI Securities noted. EBIT missed Bloomberg estimates by 4 percent, orderbook was weak (down 10 percent QoQ), and revenue growth guidance for Q2 FY24 too fell short of expectations.“Management commentary did not provide any visibility of pickup in demand ahead,” ICICI Securities added.While the domestic IT firms tried to put on a brave face during their earning concalls by talking about their increasing focus on generative AI, analysts attributed this more to bluster than substance at the moment.Another notable name in this list is Asian Paints -- another casualty of the rising competitive intensity in the aftermath of Grasim’s entry into the segment.“The worst of margin pangs seem behind (for Asian Paints). It, however, will jostle with hard revenue growth comps in FY24. This, coupled with rising competitive intensity, could mean that the pricing lever may remain out of play,” analysts at HDFC Securities added.Disclaimer: The views and investment tips expressed by experts on Moneycontrol.com are their own and not those of the website or its management. Moneycontrol.com advises users to check with certified experts before taking any investment decisions.",Larsen & Toubro Ltd.
"  September 07, 2023 / 07:13 AM IST  ","Trade Spotlight | What should be your strategy for EID Parry, LIC of India, KEC International today","Nice recovery from the day's low in late trade helped the market sustain an uptrend for yet another session on September 6. The Nifty50 also maintained higher highs formation for four days in a row. Hence, the sustainability above 19,600 can drive the index towards 19,800, while the 19,500-19,400 can remain in a role of support for coming sessions, experts said.The Nifty50 rose 36 points to 19,611, and the BSE Sensex advanced 100 points to 65,881, while the Nifty Midcap 100 and Smallcap 100 indices ended at fresh record closing highs, but with moderate gains as the market breadth was equal among bulls & bears.The profit booking was also seen in major driving sectors. The Bank Nifty fell 123 points to 44,409, while the Nifty IT declined 53 points to 32,312 amid volatility.Stocks that outperformed broader markets on September 6, included EID Parry, LIC of India, and KEC International. EID Parry has seen a good breakout of a long downward sloping resistance trendline adjoining highs of October 20 last year, and August 4 this year, with robust volumes, which is a positive sign. The stock moved above all key moving averages and closed with 8 percent gains at Rs 522, forming a strong bullish candlestick pattern on the daily charts.Life Insurance Corporation of India also saw a decisive breakout of a long falling resistance trendline adjoining highs of December 20 last year, and August 11 this year. The stock has formed a bullish candlestick pattern with a long upper shadow on the daily charts with strong volumes and rose 2.7 percent to Rs 678.KEC International has formed a bullish candlestick pattern that resembles a Bullish Harami on the daily charts, but the position is not right. Generally, the Bullish Harami, a bullish reversal pattern, forms at the end of a downtrend. However, the KEC stock is now near record-high levels after gaining 2.6 percent on September 6. It was trading at Rs 676.70 on the NSE and traded above all key moving averages.Here's what Jigar S Patel of Anand Rathi Shares & Stock Brokers recommends investors should do with these stocks when the market resumes trading today:EID Parry (India)Recently the said counter has taken support on flat Ichimoku Cloud by making Doji candles on a daily scale. In the previous trading session, we saw a nice reversal candle which confirmed a bullish reversal. Additionally, since the last 8 sessions, it is making base near the middle band of Bollinger band followed by band expansion which is looking lucrative.From the indicator point of view, the RSI (relative strength index) daily is above 70 levels, the daily MACD (moving average convergence divergence) is showing strength along with daily directional movement index has given a positive crossover thus confirming bullish bias in the counter.One can buy in the range of Rs 515-520, with an upside target of Rs 585 and stop-loss would be Rs 475 on a daily close basis.Life Insurance Corporation of IndiaLIC has very similar kind of setup that we saw above in EID Parry. LIC has been trading above the Ichimoku Cloud for a long time along with price action maintaining the middle band of the Bollinger band which is a positive sign for the counter.From the Indicator point of view, the RSI daily has reversed from 50 levels, the daily MACD has formed a positive cross above the zero line along with daily directional movement index has been constantly positive for a long time thus confirming bullish bias in the counter.One can buy in the range of Rs 675-680, with an upside target of Rs 725 and the stop-loss would be Rs 650 on a daily close basis.KEC InternationalThough the counter looks lucrative one needs to be cautious with KEC as it has already made one Bearish Engulfing candlesticks pattern weekly (refer to the chart). Also slowly and gradually it is making negative divergence on weekly RSI (price action making higher highs but RSI making lower highs).At the current juncture, one can book profit in the zone of Rs 675-700. Fresh longs will only trigger once it gets a decisive closing above Rs 700 for a target of Rs 800 and the stop-loss would be Rs 655.Disclaimer: The views and investment tips expressed by investment experts on Moneycontrol.com are their own and not those of the website or its management. Moneycontrol.com advises users to check with certified experts before taking any investment decisions.",Life Insurance Corporation of India
"  September 07, 2023 / 09:36 AM IST  ",Tata Consumer falls 2% after denying reports of buying Haldiram stake,"Tata Consumer Products fell 1.87 percent to Rs 862.5 at 9.20 am on September 7  after the company denied news reports that it was in talks to buy a stake in Indian food snack chain Haldiram's. The stock surged over 4 percent in the previous session following the report about interest in Halidram's.On September 6, news agency Reuters said Tata Consumer Products was in talks to buy at least 51 percent in Haldiram's but added was not comfortable with the $10 billion valuation sought.In an exchange filing, the Tata group company denied the report. ""The company is not in negotiations as reported in the above-referred news article,” said Tata Consumer Products in the filing, referring to the report.Haldiram's, too, denied the same on CNBC-TV18.Also read Tata seeks control of Haldiram's, snack maker wants $10 billion valuationIn the April-to-June quarter, Tata Consumer revenue increased 12.44 percent year-on-year (YoY) to Rs 3,741 crore. Net profit for the quarter was up 22.02 percent YoY at Rs 338 crore. The operating profit margins expanded by 100 basis points on-year to 15 percent.Disclaimer: The views and investment tips expressed by experts on Moneycontrol.com are their own and not those of the website or its management. Moneycontrol.com advises users to check with certified experts before taking any investment decisions.",Tata Consumer Products Ltd.
"  September 07, 2023 / 02:26 PM IST  ","United Breweries zooms 5%, investors cheer Vivek Gupta as new boss","United Breweries was trading 5 percent higher on September 7 after the alcoholic beverages maker announced the appointment of Vivek Gupta as the new managing director and chief executive officer.Gupta, who was chief business officer at B2B platform Udaan, will begin his five-year tenure from September 25, 2023, the company told exchanges.“Gupta will be responsible for driving sustainable growth for the company. He will lead the premiumisation of United Breweries portfolio, including strengthening the iconicity of Kingfisher,” the company said.An alumnus of IIM-Ahmedabad, Gupta previously worked with Procter and Gamble group in various capacities for nearly two decades. He was the managing director of its businesses in Australia and New Zealand before joining Udaan.“I feel privileged to be entrusted with one of India’s most iconic brands, the Kingfisher beer and the world’s most international brand, Heineken. I look forward to the journey ahead with the UBL leadership and our colleagues as we brew greatness together,” Gupta said.Follow our live blog for all the market actionIn its results for Q1FY24, United Breweries reported a 6.72 percent year-on-year (YoY) decline in revenue from operations at Rs 2,275 crore. Net profits in the quarter dropped 16.04 percent on a yearly basis to Rs 136 crore. Operating profit margins contracted by 100 basis points YoY to 10 percent.At 2 pm, the United Breweries stock was quoting at Rs 1,659.40 on the NSE, up Rs 77.85, or 4.92 percent.The stock has a trailing P/E of 140.04x, making it the most expensive stock among its peers in absolute terms.United Breweries, a Heineken-group company, brews and distributes alcoholic and non-alcoholic beverages. Its product portfolio includes a wide range of beers and non-alcoholic beverages.Disclaimer: The views and investment tips expressed by experts on Moneycontrol.com are their own and not those of the website or its management. Moneycontrol.com advises users to check with certified experts before taking any investment decisions.",United Breweries Ltd.
