date,title,content,company
"  July 17, 2023 / 09:59 AM IST  ",Top 10 trading ideas for next 3-4 weeks as bulls continue to rule D-Street,"Bulls kept their reign over Dalal Street for the third straight week, lifting the market to fresh historic highs on July 14. The Nifty50 closed above the 19,500 mark for the first time, especially after breaking the eight-day consolidation range of 19,300-19,500 points.The index jumped 1.2 percent to 19,565 and formed a long bullish candlestick pattern on the weekly charts, with making higher highs formation for 16th consecutive week.Further, the index has seen a breakout of upward sloping resistance trendline adjoining highs of December last year and previous week, with the momentum indicator RSI (relative strength index) showing bullish crossover on all timeframes.Technically, the Nifty seems to be looking strong now. Hence, 19,600-19,700 is expected to be key resistance area initially for the Nifty50, followed by 19,800-19,900 levels, with immediate support at 19,500, and then at 19,400-19,300 levels, experts said.""The bulls are being resilient to let loose their grip even in the overbought parameters which showcase their dominance. But at the same time, one should not become complacent and overrule the possibility of a breather post the steep rally,"" Osho Krishan, Senior Analyst for Technical and Derivative Research at Angel One, said.As far as levels are concerned, he feels 19,400-19,300 is likely to cushion any short-term blip, while the sacrosanct support lies around the bullish gap of 19,200 in the comparable period.On the flip side, as the index entered uncharted territory there is no relevant hurdle; however, the next pitstop could be seen around 19,650-19,700 on an immediate basis, he said.He expects strong moves in the broader markets amid the quarterly earnings, so one needs to have a stock-centric approach for better trading opportunities and also stay abreast with global and domestic developments.Option data clearly indicated that 20,000 can be a possibility for the Nifty in coming weeks, but in near term, 19,600-19,700 can act as a resistance area, while the 19,500-19,300 is expected to be support area.Prashanth Tapse, Senior VP (Research) at Mehta Equities feels the bulls are likely to remain in control. ""There is room for further upside, and we anticipate the Nifty to reach fresh all-time highs around the 20,000 mark in the near term,"" he said.Let's take a look at the top 10 trading ideas by experts for the next three-four weeks. Returns are based on the July 14 closing prices:Expert: Nandish Shah, senior derivative and technical analyst at HDFC SecuritiesOrient Cement: Buy | LTP: Rs 143.6 | Stop-Loss: Rs 130 | Target: Rs 156 | Return: 9 percentThe stock price has broken out on the weekly chart from the downward sloping trendline, adjoining the weekly highs of February 11, 2022 and June 9, 2023. Primary trend of the stock is positive as stock price is trading above its 200-day EMA.Momentum oscillators like - RSI (relative strength index 11) and MFI (money flow index 10) are sloping upwards and placed above 60 on the daily chart, indicating strength in the current uptrend of the stock.Indian Bank: Buy | LTP: Rs 324.35 | Stop-Loss: Rs 305 | Targets: Rs 345-360 | Return: 11 percentThe stock price has been forming bullish higher top higher bottom formation on the weekly chart. Primary trend of the stock is positive as stock price is trading above its important long term moving averages.PSU banks as a sector is showing strength on the short-term chart. RSI oscillator (11) is sloping upwards and placed above 60 on the daily chart, indicating strength in the stock.Biocon: Buy | LTP: Rs 262.20 | Stop-Loss: Rs 250 | Target: Rs 278-290 | Return: 11 percentThe stock price has broken out on the daily chart to close at highest level since July 4, 2023. Primary trend of the stock turned positive as stock price closed above its 200-day EMA.Pharma stocks are placed well on the short and medium term chart. Momentum Oscillators - RSI (11) is sloping upwards and placed above 60 on the daily chart, indicating strength in the current uptrend of the stock.Expert: Shrikant Chouhan, head of equity research (retail) at Kotak SecuritiesLTIMindtree: Buy | LTP: Rs 5,093 | Stop-Loss: Rs 4,800 | Targets: Rs 5,350-5,600 | Return: 10 percentThe stock has been forming an ascending triangle consolidation for the past year. In the past two weeks, the stock has completed a break out as well as a throwback pattern, which may help traders spot the trending activity in the near term.On a weekly basis, it has formed a Hammer pattern, which is again a bullish reversal signal. The strategy should be to buy at Rs 5,100 and Rs 4,900. For this, keep a stop-loss at Rs 4,800.On the upside, it would face resistance at Rs 5,350 and Rs 5,600, which traders can consider targets for riding long positions.JSW Steel: Buy | LTP: Rs 804.85 | Stop-Loss: Rs 780 | Targets: Rs 860-900 | Return: 12 percentSince the last two months, the stock has been consolidating and developing a diamond consolidation formation on the weekly/monthly charts. It would constitute a bullish continuation as it crossed Rs 790 last week.Based on the technical formation, the stock may start moving towards Rs 1,000 level in the coming few months. From a short to medium-term perspective, the strategy should be to buy at Rs 810 and Rs 790, for targets of Rs 860 and Rs 900, with stop-loss at Rs 780.NTPC: Buy | LTP: Rs 187.45 | Stop-Loss: Rs 183 | Targets: Rs 195-210 | Return: 12 percentThe stock's primary and intermediate trend is bullish, however, it is correcting from higher highs in the near term due to more retracements. However, in the past week, it corrected back to the 50 percent retracement of the previous bull move, which was between Rs 171 and Rs 198.Since the major trend is positive, contra traders may consider entering long positions. It would be a fair reward-to-risk ratio. Buy NTPC between Rs 188 and Rs 185. Put stop-loss at Rs 183. On the higher side, it could move towards Rs 195, Rs 198 and Rs 210.Expert: Ruchit Jain, lead research at 5paisa.comEscorts Kubota: Buy | LTP: Rs 2,376.75 | Stop-Loss: Rs 2,317 | Targets: Rs 2,450-2,480 | Return: 4 percentThe stock has been forming a ‘Higher Top Higher Bottom’ structure and is thus in an uptrend. The prices have now given a breakout above the previous high and the RSI oscillator has been indicating a positive momentum.Traders can look to buy the stock in the range of Rs 2,380-2,370 for potential targets around Rs 2,450 and Rs 2,480. The stop-loss for long positions should be placed below Rs 2,317.National Aluminium Company: Buy | LTP: Rs 89.3 | Stop-Loss: Rs 85 | Targets: Rs 93-97 | Return: 9 percentThe Dollar Index has witnessed a sharp down move in last few days and metals usually have an inverse co-relation with the DXY. This stock has given a breakout from the resistance with high volumes and the RSI oscillator is hinting a positive momentum.Traders can look to buy the stock around current price of Rs 89 and look to add on dips towards Rs 87. The stop-loss should be placed below Rs 85 for potential targets of Rs 93 and Rs 97.Expert: Mitesh Karwa, research analyst at Bonanza PortfolioTech Mahindra: Buy | LTP: Rs 1,228.65 | Stop-Loss: Rs 1,150 | Target: Rs 1,350 | Return: 10 percentTech Mahindra has seen breaking out of a consolidation pattern on the weekly timeframe with a bullish candlestick and closing above the highs of last thirteen months with above average volumes which indicates strength.On the indicator front, the momentum oscillator RSI (14) is at around 73 on the daily time frame indicating strength by sustaining above 50. And the Ichimoku cloud is also suggesting a bullish move as the price is trading above the conversion line, base line and cloud on the daily timeframe.Observation of the above factors indicates that a bullish move in Tech Mahindra is possible for target upto Rs 1,350 in 3-4 weeks. One can initiate a buy trade in the range of Rs 1,120-1,126, with a stop-loss of Rs 1,150 on daily closing basis.Container Corporation of India: Buy | LTP: Rs 688.80 | Stop-Loss: Rs 655 | Target: Rs 740 | Return: 7.4 percentContainer Corporation has seen breaking out of the line of polarity on the weekly timeframe with a bullish candlestick and closing above all its important EMAs which indicates bullish strength.On the indicator front, the momentum oscillator RSI (14) is at around 61 showing strength by sustaining above 50. The supertrend indicator is also indicating a bullish reversal which supports the bullish view and the Ichimoku Cloud is also suggesting a bullish move as the price is trading above the conversion line and base line.Observation of the above factors indicates that a bullish move in Container Corporation is possible for a target upto Rs 740. One can initiate a buy trade in between the range of Rs 685-688, with a stop-loss of Rs 655 on daily closing basis.National Aluminium Company: Buy | LTP: Rs 89.3 | Stop-Loss: Rs 85 | Targets: Rs 99 | Return: 11 percentThe stock has seen breaking out of an upwards sloping wedge on the weekly timeframe and closing above the highs of last one year with a big bullish candlestick and above average volumes and sustaining above all its important EMA’s which indicates bullish strength.On the indicator front, the supertrend indicator is indicating a bullish reversal trend; the Ichimoku Cloud is also suggesting a bullish move as the price is trading above the conversion line, base line and cloud.Momentum oscillator RSI (14) is at around 71 on the daily time frame indicating strength by sustaining above 50.Observation of the above factors indicates that a bullish move in NALCO is possible for a target upto Rs 99 in 3-4 weeks. One can initiate a buy trade in between the range of Rs 89-89.4, with a stop-loss of Rs 85 on daily closing basis.Disclaimer: The views and investment tips expressed by investment experts on Moneycontrol.com are their own and not those of the website or its management. Moneycontrol.com advises users to check with certified experts before taking any investment decisions.",LTIMindtree Ltd.
"  July 17, 2023 / 06:49 AM IST  ","MC Interview | These two largecaps can see a swift rally in rest of July, says Milan Vaishnav of Gemstone Equity Research","After finally closing above 19,500, ""there are greater chances that the Nifty may certainly test 19,800-19,900 levels if we take some cues from the Options data,"" Milan Vaishnav, CMT, MSTA, founder and technical analyst at Gemstone Equity Research says in an interview to Moneycontrol.As the Nifty IT index had seen a huge buying on last Friday, he believes it is certainly a great time to start accumulating IT stocks.Milan with nearly two decades of experience in the equity markets, expects the banking space to play catchup. ""ICICI Bank is set to witness a breakout; I would focus on ICICI Bank as one of the stocks that can see a swift rally if it is able to keep its head above Rs 960-970 levels,"" he said.Q: Is it the right time to buy RBL Bank that has been on buyers' radar since April?Although RBL Bank has been on the buyer's radar since April, the first entry point came on June 30 when the stock staged a breakout when it crossed Rs 180-182 levels.Currently, the stock remains in a strong uptrend. There is a room on the upside and the stock has the potential to test Rs 265-270 levels over the coming months. Some consolidation cannot be ruled out; one can accumulate the stock between Rs 198-210 levels if it sees some consolidation.Q: Will it be an easy ride for the Nifty50 to climb above 20,000 mark in current quarter?With the kind of trending moves it saw in the previous trading session, Nifty has certainly opened up some more room for itself on the upside. The levels of 20,000 are definitely psychologically important levels from one perspective. There are greater chances that the Nifty may certainly test 19,800-19,900 levels if we take some cues from the Options data.Also read: Netweb Technologies IPO opens | 10 key things to read before applying for offerSo far as testing 20,000 levels in this quarter is concerned, it would be premature to put expectations without any rationale. In fact, two things can happen; the Index can go near 20,000 and also face strong resistance there.Q: Do you expect Nifty Pharma to surpass its record high levels in coming months?This can be answered from a different perspective. The Nifty Pharma Index witnessed a breakout when it crossed above 13,000 levels.Presently it is some 5 percent away from its high point; however, it remains overbought and may see some consolidation. That being said, the Pharma space is set to relatively outperform the broader markets and this may definitely see Nifty Pharma to surpass its record high levels over the coming months.Q: Two stocks which can see swift rally in rest of July?I expect the banking space to play catchup. ICICI Bank is set to witness a breakout; I would focus on ICICI Bank as one of the stocks that can see a swift rally if it is able to keep its head above Rs 960-970 levels.Also read: India set to dominate emerging markets as breakout star of the decade: Capital Group reportAnother stock that I see is from a largecap IT services space. LTIMindtree is set to stage a breakout; any sustenance above Rs 5,100 can see the stock meaningfully higher than its current levels.Q: Are you a big fan of real estate sector?You can call me a big fan of anything that portrays strong Relative Strength. The Realty sector index has been inside the leading quadrant of the RRG (Relative Rotation Graph) for many weeks now; this is the reason that we are witnessing a strong relative performance of the realty space against the broader markets.This is likely to continue; however, we cannot also rule out this space taking a breather and consolidating. The testing of 550-565 levels by the Realty Index would lead to testing of a major double top and some consolidation at those levels cannot be ruled out.Q: Given the strong run up in Nifty IT on Friday, is it really a great time to start picking stocks in the sector?Yes, it is certainly a great time to start accumulating IT stocks. I will have a stock-specific approach while doing this. TCS, Tech Mahindra, Infosys, LTIMindtree, Tata Elxsi etc are some of the stocks that are on our radar.Disclaimer: The views and investment tips expressed by investment experts on Moneycontrol.com are their own and not those of the website or its management. Moneycontrol.com advises users to check with certified experts before taking any investment decisions.",LTIMindtree Ltd.
"  July 17, 2023 / 08:11 AM IST  ",Makes sense to buy IT now; Eicher oversold: Religare’s Siddharth Bhamre on his picks,"The market is no longer cheap at these levels but there are pockets of opportunity nevertheless, says Siddharth Bhamre, Research Head, Religare Broking. “I won’t say we are very expensive right now, but we are headed into that zone,” Bhamre said in a free-wheeling chat with Moneycontrol.He is bullish on the information technology (IT) sector, which is not finding too many takers right now because of the cautious view on the United States economy. And the latest quarterly numbers seem to bear that out. HCL Tech’s and Wipro’s June quarter earnings were short of market expectations and while TCS numbers just about met analyst estimates, there were signs of growth slowing down.“The concerns over earnings growth are valid but that also needs to be seen in the context of valuations,” Bhamre said.Also Read | HCLTech Q1 Results: Net profit rises 8% YoY to Rs 3,534 crore; revenue up 12%“The talk of the US slipping into recession has been on for more than a year now, and a large part of that fear is already reflecting in the prices. At one point, investors were willing to pay 35 times (one-year forward earning), now they balk at paying anything over 20,” he said, pointing out that IT stocks have been underperforming since tumbling from their record highs in January 2022.“And if you listen to the management commentary, you will note that the deferments are mostly for smaller, short-term projects, not the long-term ones which help (US) companies cut on costs. So yes, the situation is not as dire as most people would like to believe. You are never going to get attractive valuations and good earnings visibility at the same time. But if you are a value investor, it makes sense to start accumulating IT shares at these levels. It won’t be a smooth ride, there will be a lot of noise along way as the market reacts to the news flow from the US economy,” Bhamre said.Religare’s top picks in the IT sector are HCL Tech, Infosys and TCS. It is cautious on Wipro.AutoIn the auto sector, Maruti, Eicher Motors and Bajaj Auto are Bhamre’s preferred picks.“I feel pessimism over Eicher Motors may have been overdone,” he says. The Eicher Motors stock has taken a beating over the last couple of weeks following the launch of superbikes by Hero Motor Corp and Bajaj Auto in partnership with Harley Davidson and Triumph, respectively.Also Read | TCS Q1 Results: Net profit up 16.8% at Rs 11,074 crore, revenue at Rs 59,381 crore“There will be a dent in Eicher’s market share no doubt, but I don’t think it will be as significant as the market is expecting. The new players have yet to show that they can scale up quickly. Also, competition is nothing new to Eicher; when Java was launched three years ago many had said that (Royal) Enfield’s domination will be under threat. Things did not quite play out that way. Also, Harley’s and Triumph’s launches are not a bolt out of the blue; the market had priced it to some extent. That could explain why the stock has been struggling since peaking around Rs 3,850 in October last year. I am not saying that Harley and Triumph are not formidable competitors, but often the market gets ahead of itself.""Lastly, Eicher is not a pure-play premium bike story; the commercial vehicle story also looks quite strong. Maybe the dynamics of the premium bike segment will change radically over the next five years, but that is still some way off,” he said.As for Maruti, Bhamre is betting on the company gaining a respectable share in the SUV segment where it has launched new models recently. “For a long time, Maruti was about volume growth. That story is changing. Maruti’s earnings growth will now be driven by better margins as it sells more of its high models. The stock has underperformed for a long time, and despite the recent run up, valuations are not pricey,” he said.CementReligare’s top bets in the cement sector are Ultratech, Dalmia Bharat, Ramco and Nuvoco Vistas.“The valuations right now are not exactly cheap, but cement is a good long- term story,” Bhamre says. The two key triggers according to him — government spending on infrastructure and the boom in the real estate market.“Till some months back, cement was a story about price hikes. That (price hikes) has stopped happening. But the pressure on margins is expected to ease going forward as raw material prices have cooled. There is a lot of capacity coming on stream right now, so cement prices may not go up much. But even so, cement is more a story about volume growth than price hike,” he says.FMCGBhamre feels the recovery in the rural economy will be a major driver of FMCG stocks in the coming days. “The latest employment data shows that things are turning around in the rural markets,” he said.According to Bhamre, FMCG stocks are not cheap at current levels in terms of absolute PE (price-to-earnings) multiples. “They (FMCG) have always been expensive, sometimes less so, sometimes more, there is no denying that. Having seen some of the stocks trade at multiples of 60 and 70 at one point, 50 may not look too bad.""My point is that key FMCG stocks still look okay when compared to the historical 10-year average PE one-year forward. That’s not such a bad deal. Besides, when there is talk of a recession in the US which could hurt the Indian market as well, it makes sense to have defensive stocks in the portfolio,” Bhamre says. His picks in the FMCG space are HUL, Colgate and Marico.“We are not so bullish on ITC, which at 35 plus times one year forward is above its historical average. It is a good story no doubt, but the risk-reward ratio does not look very appealing at this point,” he says.Banks“Banks are one of the safest stories right now. You just need to have them in your portfolio. You can’t go much wrong there. The retail loan book is not growing much, but given the strength of the corporate balance sheets, the risk of NPAs are the lowest in a very long time,” Bhamre says.“Retail loan book still has plenty of scope for growth. Household debt is at manageable levels. And while incomes have not been rising fast, aspirations surely are. Also, the commodity cycle is down right now, but the companies will start borrowing to expand capacity for the next upcycle,” he says.",Wipro Ltd.
"  July 17, 2023 / 03:46 PM IST  ",Zee forms interim committee to oversee operations as SEBI order bans Punit Goenka,"Media company Zee Entertainment has formed a committee to oversee the company's operations as the Securities and Exchange Board of India (SEBI) has barred MD and CEO Punit Goenka.“The Board of ZEE Entertainment Enterprises Ltd. (ZEEL) in a meeting conducted on July 14, 2023, evaluated and discussed all the necessary steps, in light of the interim order passed by the Securities and Exchange Board of India (SEBI) and the subsequent judgement by Securities Appellate Tribunal (SAT). Since the order restricts Punit Goenka from holding the position as director or key managerial position in a listed company, the Board of the Company has constituted an Interim Committee of senior executives to ensure smooth operations of the Company,"" the company said in a statement released on July 17.The statement further said that the Interim Committee will be under the supervision of the Board and will seek its guidance on all matters pertaining to the company. ""The Board continues to have immense faith in the value-building leadership skills showcased by Punit Goenka and will monitor the progress of the matter. The Board also remains confident that the Company will deliver robust growth consistently and generate higher value for all shareholders,” a company spokesperson said.SAT had on July 10 refused to stay SEBI's order that barred them from holding key management positions in any listed company.SEBI had, in an interim order, on June 12, stated that Subhash Chandra and Goenka had allegedly ""abused their positions"" for personal financial gains. It noted that the Mumbai-based media house had faked the recovery of loans to cover private financing deals by its founder Subhash Chandra.The regulator further alleged that the duo engaged in the alienation of assets belonging to Zee Entertainment and other listed companies of the Essel Group, with the aim of benefiting their associate entities.",Zee Entertainment Enterprises Ltd.
