date,title,content,company
"  June 22, 2023 / 06:30 AM IST  ",Carlyle plans to sell 2.53% stake in Delhivery via block deal: Sources,"Global private equity firm Carlyle is planning to sell a stake of 2.53 percent it holds in the Gurugram-based logistics startup Delhivery via block deal, CNBC Awaaz reported on June 21, citing sources.The deal size will be of around 1.84 crore shares, amounting to $86 billion, the sources said, adding that the base price is likely to be Rs 385.5 per share, which would mark a miniscule discount as against the current market price.Citigroup will be appointed as the sole broker for the deal, the persons privy to the development further noted.In the trading session on June 21, Delhivery's scrip declined by 0.10 percent to settle at Rs 388.95 apiece on the BSE.Also read: Kotak retains ‘buy’ on Delhivery, says firm’s network strengths to boost performanceThe report of the likely block deal comes a month after the logistics firm said its net loss widened to Rs 159 crore in the fourth quarter of fiscal year 2022-23, and the operating income during the same period declined by 10 percent on-year to Rs 1,859.6 crore.For the entire FY23, Delhivery had reported a 5 percent growth in operating revenue at Rs 7,225 crore, but the company's net loss during the fiscal was little changed at Rs 1,007 crore from Rs 1,011 crore in FY22.",Delhivery Ltd.
"  June 22, 2023 / 12:01 PM IST  ","FTSE ups weights of HDFC AMC, Shriram Finance, Timken. Check inflows expected","FTSE has increased the weights of HDFC AMC, Shriram Finance and Timken India in its indices, following large block deals in the stocks. This will lead to a cumulative inflow of $44 million into these scrips, according to Nuvama Alternative & Quantitative Research.After the stake sales by promoters and strategic investors, the chunks have been added to free float market capitalization, which has resulted in weight increase.Shriram Finance is expected to see inflows to the tune of $19 million, HDFC AMC of $16 million and Timken India of $9 million. This will happen as passive funds tracking FTSE indices will rebalance portfolio on June 23, added Nuvama Alternative & Quantitative Research.Follow our live blog for all the market actionThe development comes after Piramal Enterprises and TPG together offloaded 11 percent stake in Shriram Finance. On the other hand, abrdn sold over 10 percent stake in HDFC AMC and Timken Singapore sold 11 percent stake of Timken India.""Sale of stakes held by Piramal and TPG removes key overhang on valuation. Thus, we upgrade stock to buy and raise target to Rs 2,130 from Rs 1,445 per share,"" said foreign broking firm Jefferies in a recent note.The NBFC should deliver 16 percent EPS (earnings per share) CAGR and 15 percent return on equity in FY24-26, it added.Despite the 23 percent rally in one week, Kotak Institutional Equities believes valuations still remain inexpensive for Shriram Finance at 10X and 8X estimated earnings, for FY24 and FY25.For HDFC AMC, all eyes are on whether the stock can move above Rs 2,220 levels before the cut-off date in July to make a re-entry in MSCI Standard Index. The stock had been removed from MSCI index in May 2022.At 11:40 am, HDFC AMC was trading 1 percent lower at Rs 2,015.30 while Shriram Finance was 1.9 percent lower at Rs 1,701.Disclaimer: The views and investment tips expressed by investment experts on Moneycontrol.com are their own and not those of the website or its management. Moneycontrol.com advises users to check with certified experts before taking any investment decisions.​​​​​​​",HDFC Asset Management Company Ltd.
"  June 22, 2023 / 06:21 AM IST  ","Trade Spotlight | Your strategy for JSW Energy, Linde India, Tube Investments today","Given the up-move for yet another session, the market registered a fresh record closing high on June 21 despite weakness in global counterparts, while the broader markets sustained an upward journey for eight days in a row.The BSE Sensex rallied nearly 200 points to 63,523, and the Nifty50 surged 40 points to 18,857, while the Nifty Midcap 100 index gained 0.8 percent and Smallcap 100 index was up 0.1 percent.The Bank Nifty also traded in line with the benchmark Nifty50, rising 93 points to 43,859, while Nifty IT index closed with 95 points gains at 29,026.Stocks that outperformed the broader markets included JSW Energy, Linde India, and Tube Investments of India. JSW Energy climbed 6.7 percent to Rs 274 and formed a long, bullish candlestick pattern on the daily scale with significantly high volumes. The stock has seen a breakout of downward sloping resistance trendline adjoining highs of March 8, June 7 and June 8, and got back above its 200-day EMA (exponential moving average).Linde India has also formed a strong, bullish candlestick pattern on the daily charts with healthy volumes, after four-day consolidation and correction. The stock gained 5.3 percent to end at record closing high of Rs 4,583, with making higher high, higher low formation.Tube Investments of India also hit a fresh all-time high on Wednesday. The stock jumped 5 percent to settle at record closing high of Rs 3,172 and formed long bullish candlestick pattern on the daily timeframe, with above average volumes, after three-day consolidation.Here's what Jigar S Patel of Anand Rathi Shares & Stock Brokers recommends investors should do with these stocks when the market resumes trading today:JSW EnergyRecently the said counter has taken out its Triangular pattern after reversing from a Bullish BAT pattern (refer to the chart). Having said that, for the last three months, it has been respecting its trendline which is a sign of an established uptrend of the counter.From the indicator perspective, the daily relative strength index (RSI) is placed at 60 after sustaining above 50 levels for almost entire current month.One can buy in a small tranche in the range of Rs 270-275 and another around Rs 260-264 (if tested) with an upside target of Rs 310. The stop-loss would be Rs 249 on a daily close basis.Linde IndiaSince the last couple of years, the said counter has been in a solidly established uptrend constantly trading above all critical exponential moving averages (refer to the chart).At the current juncture, it has taken out its previous swing high of Rs 4,270 on the weekly scale (refer to the chart).From an Indicator perspective, RSI weekly has just entered the 70 zone which is hinting towards further bullish momentum in the counter. One can buy in the range of Rs 4,580-4,620 for an upside target of Rs 5,000 and the stop-loss would be Rs 4,400 on a daily close basis.Tube Investments of IndiaFor the last couple of years, the said counter has been in a strong uptrend constantly trading above all critical exponential moving averages (refer to the chart). At the current juncture, it has taken out its previous swing high of Rs 3,046 on the weekly scale (refer to the chart).From an indicator perspective, RSI weekly has just entered the 70 zone which is hinting towards further bullish momentum in the counter. One can buy in the range of Rs 3,150-3,180 for an upside target of Rs 3,500 and the stop-loss would be Rs 2,297 on a daily close basis.Disclaimer: The views and investment tips expressed by investment experts on Moneycontrol.com are their own and not those of the website or its management. Moneycontrol.com advises users to check with certified experts before taking any investment decisions.",JSW Energy Ltd.
"  June 22, 2023 / 09:55 AM IST  ",Should Piramal exit move worry Shriram Finance investors?,"                        Highlights

	Piramal Enterprises likely to offload entire stake in Shriram Finance
	Two foreign investors have already exited the NBFC
	The stake sale could lead to short-term volatility in the stock
	Growth levers should help the NBFC stock do well in the medium term

Piramal Enterprises is likely to sell its entire 8.34 percent stake, or 3.12 crore shares, in Shriram Finance (SFL; CMP: Rs 1,732, Market Cap: Rs 65,020 crore) through a block deal. The floor price will likely be Rs 1,483 per share...
                    ",Shriram Finance Ltd.
"  June 22, 2023 / 04:14 PM IST  ","Motilal Oswal bullish on Tube Investments as verticals bounce back, sees 11% upside","Brokerage firm Motilal Oswal Financial Securities (MOFSL) is bullish on Tube Investments of India Ltd on the back of robust recovery across segments and expectations of double-digit growth.MOFSL has retained a 'buy' call on the stock and assigned a target price of Rs 3,560 per share, an upside of 11 percent from the closing price of June 22.Here are some key indicators for the positive sentiment among the brokerage firm.Double-digit growth in engineering businessTube Investments' engineering business is projected to reach double-digit growth over the next 2-3 years, MOFSL said. Analysts at the broking firm said that this growth will be primarily driven by the recovery in the 2W (two-wheeler) segment, increased exports, and the ramp-up in large-diameter tubes.In FY23, the company observed favourable growth in the first half but encountered challenges in the second half due to the pass-through of declining commodity costs and the impact of de-stocking on exports. To deal with increasing demand, the company is taking proactive measures by expanding its capacity by 50 percent. The facility is expected to be operational by the end of FY24.Strengthening metal businessThe metal vertical is forecasted to grow 10 percent in the next couple of years, analysts said. This growth comes despite the sluggishness in the Railway segment, which is yet to see any material increase in tender activity, as per Motilal Oswal's report published on June 22.Also aiding growth is the door frame segment predicted poised to grow well in line with key customers. Further, the company is seeing good traction in other products for the 2W segment, the report stated.Cycle business recoveryThe domestic cycle business faced obstacles in FY23 as volumes declined by about 7-8 percent. Analysts have also pointed out that the company sharply underperformed its peers in the segment.Analysts expect a certain degree of recovery in FY24 as the company's focus lies on exports. The brokerage firm foresees progress in cycle exports by the end of FY24.Shares of Tube Investments of India Ltd ended at Rs 3,206.95 apiece on the NSE on June 22, up 1.12 percent from the previous day's close. Disclaimer: The views and investment tips expressed by experts on Moneycontrol are their own and not those of the website or its management. Moneycontrol advises users to check with certified experts before taking any investment decisions.​​​",Tube Investments of India Ltd.
"  June 22, 2023 / 11:32 AM IST  ",Buy Tube Investments of India; target of Rs 3560: Motilal Oswal,"Motilal Oswal's research report on Tube Investments of IndiaWe met with the senior management team of Tube Investments (TIINDIA) to get an update on the company’s core businesses and TI-2 strategy. It expects a good recovery in the Engineering business in terms of revenue and margins. The Metal Formed business is expected to grow 10%, assuming no material recovery in the Railway business. EV businesses are moving from the investment phase to the commercialization phase in FY24. Here are the key highlights from the meet: Engineering business to grow in double digits, with scope of margin expansion: The Engineering business is expected to grow in double digits over the next 2-3 years, driven by a recovery in the 2W segment and exports and a ramp-up in large diameter tubes. In FY23, the company saw good growth in 1HFY23, whereas 2HFY23 was affected by the pass-through of commodity cost decline and the impact of destocking on exports. In large diameter tubes, TIINDIA is expanding its capacity by 50%, which would be operational by FY24 end. It targets to improve PBIT margin through lean manufacturing initiatives and operating leverage.OutlookThe stock trades at 40x/32.7x FY24E/FY25E consol. EPS. We maintain our BUY rating and a TP of ~INR3,560 (premised on Jun'25E SOTP, based on 35x for the standalone business, valuing listed subsidiaries at 20% HoldCo discount and ~INR280 for two EV businesses).For all recommendations report, click hereDisclaimer: The views and investment tips expressed by investment experts/broking houses/rating agencies on moneycontrol.com are their own, and not that of the website or its management. Moneycontrol.com advises users to check with certified experts before taking any investment decisions.Tube Investments of India - 22 -06 - 2023 - moti",Tube Investments of India Ltd.
"  June 22, 2023 / 06:21 AM IST  ","Trade Spotlight | Your strategy for JSW Energy, Linde India, Tube Investments today","Given the up-move for yet another session, the market registered a fresh record closing high on June 21 despite weakness in global counterparts, while the broader markets sustained an upward journey for eight days in a row.The BSE Sensex rallied nearly 200 points to 63,523, and the Nifty50 surged 40 points to 18,857, while the Nifty Midcap 100 index gained 0.8 percent and Smallcap 100 index was up 0.1 percent.The Bank Nifty also traded in line with the benchmark Nifty50, rising 93 points to 43,859, while Nifty IT index closed with 95 points gains at 29,026.Stocks that outperformed the broader markets included JSW Energy, Linde India, and Tube Investments of India. JSW Energy climbed 6.7 percent to Rs 274 and formed a long, bullish candlestick pattern on the daily scale with significantly high volumes. The stock has seen a breakout of downward sloping resistance trendline adjoining highs of March 8, June 7 and June 8, and got back above its 200-day EMA (exponential moving average).Linde India has also formed a strong, bullish candlestick pattern on the daily charts with healthy volumes, after four-day consolidation and correction. The stock gained 5.3 percent to end at record closing high of Rs 4,583, with making higher high, higher low formation.Tube Investments of India also hit a fresh all-time high on Wednesday. The stock jumped 5 percent to settle at record closing high of Rs 3,172 and formed long bullish candlestick pattern on the daily timeframe, with above average volumes, after three-day consolidation.Here's what Jigar S Patel of Anand Rathi Shares & Stock Brokers recommends investors should do with these stocks when the market resumes trading today:JSW EnergyRecently the said counter has taken out its Triangular pattern after reversing from a Bullish BAT pattern (refer to the chart). Having said that, for the last three months, it has been respecting its trendline which is a sign of an established uptrend of the counter.From the indicator perspective, the daily relative strength index (RSI) is placed at 60 after sustaining above 50 levels for almost entire current month.One can buy in a small tranche in the range of Rs 270-275 and another around Rs 260-264 (if tested) with an upside target of Rs 310. The stop-loss would be Rs 249 on a daily close basis.Linde IndiaSince the last couple of years, the said counter has been in a solidly established uptrend constantly trading above all critical exponential moving averages (refer to the chart).At the current juncture, it has taken out its previous swing high of Rs 4,270 on the weekly scale (refer to the chart).From an Indicator perspective, RSI weekly has just entered the 70 zone which is hinting towards further bullish momentum in the counter. One can buy in the range of Rs 4,580-4,620 for an upside target of Rs 5,000 and the stop-loss would be Rs 4,400 on a daily close basis.Tube Investments of IndiaFor the last couple of years, the said counter has been in a strong uptrend constantly trading above all critical exponential moving averages (refer to the chart). At the current juncture, it has taken out its previous swing high of Rs 3,046 on the weekly scale (refer to the chart).From an indicator perspective, RSI weekly has just entered the 70 zone which is hinting towards further bullish momentum in the counter. One can buy in the range of Rs 3,150-3,180 for an upside target of Rs 3,500 and the stop-loss would be Rs 2,297 on a daily close basis.Disclaimer: The views and investment tips expressed by investment experts on Moneycontrol.com are their own and not those of the website or its management. Moneycontrol.com advises users to check with certified experts before taking any investment decisions.",Tube Investments of India Ltd.
"  June 22, 2023 / 10:06 AM IST  ",Vedanta inches higher on renewed push to sell Tamil Nadu copper plant,"Shares of Vedanta gained around a percent on June 22 morning following reports that the metals major is looking to sell its copper plant in Tamil Nadu for around Rs 4,500 crore.Vedanta, which is planning to restart its copper plant in Tamil Nadu's Thoothukudi, is looking to sell the unit at a valuation of up to Rs 4,500 crore, Business Standard reported, citing banking sources.At 9.40 am, shares of the mining major were up 0.3 percent at Rs 282.2 on BSE.The company had invited expressions of interest (EoIs) for the unit in June 2022 but did not get a positive response as the plant was closed for the last five years. “The process has now started again with bankers reaching out to potential bidders,” the report quoted an unnamed banking source as saying.The company invited EoI on June 12 to ""restart activities"" following the Supreme Court's direction. The final judgment is expected by August 2023. The plant was shut down on the orders of the Tamil Nadu Pollution Control Board (TNPCB).Catch up on all LIVE stock market updates hereAnother report said, before its closure in 2018, this unit used to contribute to around 40 percent of the country’s total copper smelting capacity and 95 percent market share of sulphuric acid in Tamil Nadu.The natural resources conglomerate has already invested $1.2 billion in FY23 to augment its assets and production, Vedanta’s Chairman Anil Agarwal said in the company's annual report for 2022-23. He intends to commit another $1.7 billion in FY24 towards growth projects.Disclaimer: The views and investment tips expressed by experts on Moneycontrol.com are their own and not those of the website or its management. Moneycontrol.com advises users to check with certified experts before taking any investment decisions.",Vedanta Ltd.
