date,title,content,company
"  February 04, 2023 / 12:22 AM IST  ","ITC Standalone December 2022 Net Sales at Rs 16,225.73 crore, down 3.46% Y-o-Y","Net Sales at Rs 16,225.73 crore in December 2022 down 3.46% from Rs. 16,806.89 crore in December 2021.Quarterly Net Profit at Rs. 5,031.01 crore in December 2022 up 21.05% from Rs. 4,156.20 crore in December 2021.EBITDA stands at Rs. 7,094.94 crore in December 2022 up 20.01% from Rs. 5,912.01 crore in December 2021.ITC EPS has increased to Rs. 4.06 in December 2022 from Rs. 3.37 in December 2021.ITC shares closed at 378.60 on February 02, 2023 (NSE) and has given 22.86% returns over the last 6 months and 61.48% over the last 12 months.",ITC Ltd.
"  February 03, 2023 / 09:58 AM IST  ","ITC Q3 Preview: Net profit to grow 11%, cigarette volume growth pegged at 10%","Cigarette-to-soap maker ITC is likely to post a decent set of numbers for the December 2022 ended quarter, with standalone revenue growing 11 percent year-to-year to Rs 4614 crore. The company will report its Q3 earnings on February 3, after market hours.According to an average of estimates of brokerages polled by Moneycontrol, the company's revenue will rise 4.3 percent on-year to Rs 16,547 crore. Sequentially, topline and bottomline are expected to grow 2.5 percent and 3.3 percent.ITC’s mainstay business of cigarettes, which has been in the limelight for hike in NCCD (National Calamity Contingent Duty) announced in Union Budget 2023, will likely report 10-11 percent YoY growth in volumes and 12 percent growth in sales, as per Kotak Institutional Equities.Sales from FMCG business is expected to grow 20 percent YoY. While rural demand has been weak for most FMCG companies, ITC’s business does not have much of impact from it. This is due to higher salience of foods, noted analysts at Nuvama Institutional Equities.“Similar to Britannia, ITC’s biscuits portfolio continues to perform well in rural as well as in urban,” they added.Also Read: ITC nears Rs 400 mark; why costlier cigarettes are great news for shareholdersOf all the segments, hotels business is expected to be the outperformer. Analysts at KIE have forecast 40 percent growth in the segment with EBIT (earnings before interest and taxes) margin of 17.8 percent. “Hotels revenue growth and profitability will be key to watch out for as leisure and business travel return to normalcy,” according to analysts at Motilal Oswal Financial Services.Meanwhile, sales from agriculture business might see a dip on a year-on-year basis due to a high base effect, which included wheat and rice exports.ITC shares are now close to the Rs 400 mark and clocked an all-time high of Rs 384.70 apiece on the NSE on February 2. The stock corrected 6 percent on Budget day as the finance minister said the NCCD on cigarettes was hiked by 16 percent. The reaction was overdone as the Street soon realised the total tax component on a cigarette stick goes up by only 1-2 percent, said analysts.Disclaimer: The views and investment tips expressed by experts on Moneycontrol are their own and not those of the website or its management. Moneycontrol advises users to check with certified experts before taking any investment decisions.​​​",ITC Ltd.
"  February 04, 2023 / 12:24 AM IST  ","Interglobe Avi Standalone December 2022 Net Sales at Rs 14,932.97 crore, up 60.66% Y-o-Y",,InterGlobe Aviation Ltd.
"  February 03, 2023 / 06:20 PM IST  ",Buy Jubilant Foodworks; target of Rs 600: Sharekhan,"Sharekhan's research report on Jubilant FoodworksJubilant Foodworks Limited (JFL) posted disappointing numbers in Q3FY23 with a flat like-for-like (LFL) sales, while gross margins and EBIDTA margins declining by 213 bps and 457 bps, y-o-y respectively resulting in a 35% y-o-y decline in PAT to Rs. 89 crore. Company is focusing on improving LFL growth through higher dine-in sales. It has launched Everyday value range at Rs. 49 and is improving store ambience to attract more customers. Targets LFL sales growth of 6-8% in the coming years. New store addition and change in focus to dine-in business is unlikely to have any material impact on margins. Expects EBIDTA margins to recover to 25% as raw material inflation recedes.OutlookStock has corrected by 45% from its high and is currently trading at 67.7x/46.1x/34.7x its FY2023E/FY2024E/FY2025E earnings. In view of long-term growth prospects, we maintain a Buy recommendation on the stock with revised PT of Rs. 600.For all recommendations report, click hereDisclaimer: The views and investment tips expressed by investment experts/broking houses/rating agencies on moneycontrol.com are their own, and not that of the website or its management. Moneycontrol.com advises users to check with certified experts before taking any investment decisions.Jubilant Foodworks - 01 -01-2023 - khan",Jubilant Foodworks Ltd.
"  February 03, 2023 / 06:18 PM IST  ",Reduce Jubilant FoodWorks; target of Rs 475: HDFC Securities,"HDFC Securities' research report on Jubilant FoodWorksJubilant’s Q3 performance was a miss on all fronts. Revenue and LFL YoY growth was at 10% and 0.3% vs. the expectation of 12% and 4.5%. We were building up a weak consumption trend, but it came sharper than expected. GM was down 200/78bps YoY/QoQ to 75.5% (coming off from 78% in FY21). Inflationary headwinds with weaker offtake have been pressurising the margin. Furthermore, EBITDA margin was impacted by operating deleverage, resulting in a decline of 450/230bps YoY/QoQ to 22% (lowest of the last 10 quarters). Jubilant is trying to address the challenges by introduced entry level menu at INR 49 to drive footfalls in dine-in. It is also to counter the competition that has been aggressive at the entry level. We believe the EBITDA margin will remain under pressure, owing to (1) RM headwinds, (2) slower consumption trend not offering price actions, (3) faster store opening that would impact unit economics.OutlookWe cut our EPS estimate by 12% for FY23-25. Our target price is INR 475 (INR 450 for Domino’s at 45x P/E on Dec-24E EPS + INR 25 for other initiatives). We maintain REDUCE.For all recommendations report, click hereDisclaimer: The views and investment tips expressed by investment experts/broking houses/rating agencies on moneycontrol.com are their own, and not that of the website or its management. Moneycontrol.com advises users to check with certified experts before taking any investment decisions.Jubilant Foodworks - 01 -01-2023 - hdfc",Jubilant Foodworks Ltd.
"  February 04, 2023 / 12:22 AM IST  ","Marico Standalone December 2022 Net Sales at Rs 1,891.00 crore, up 1.94% Y-o-Y","Net Sales at Rs 1,891.00 crore in December 2022 up 1.94% from Rs. 1,855.00 crore in December 2021.Quarterly Net Profit at Rs. 254.00 crore in December 2022 down 8.63% from Rs. 278.00 crore in December 2021.EBITDA stands at Rs. 375.00 crore in December 2022 up 0.54% from Rs. 373.00 crore in December 2021.Marico EPS has decreased to Rs. 1.98 in December 2022 from Rs. 2.16 in December 2021.Marico shares closed at 499.70 on February 02, 2023 (NSE) and has given -3.99% returns over the last 6 months and -0.32% over the last 12 months.",Marico Ltd.
"  February 03, 2023 / 06:19 PM IST  ",Buy Shriram Finance; target of Rs 1685: YES Securities,"YES Securities' research report on Shriram FinanceShriram Finance delivered a reasonably strong performance in Q3 FY23 that was characterized by a) brisk well-rounded disbursements growth (up 13% qoq/28% yoy), b) acceleration in AUM growth (up 4.8% qoq/13% yoy), c) 25-30 bps improvement in NIM underpinned by rationalization of borrowings/liquidity, and largely stable borrowing cost and loan mix, d) absolute opex being flat qoq on account of lower merger related expenses (Q2 also had Rs650mn of one-time sales tax litigation settlement expenses), e) stable credit cost owing to lower write-offs and marginal improvement in the share of Current/Stage-1 assets and f) impressive RoA/RoE levels of 3.4%/17%.OutlookWe expect the co. to deliver 12-15% growth in AUM and earnings in FY24/25 with RoE of 15-16%. Basis this expectation and an undemanding valuation (1.2x P/ABV and 6.6x P/E on FY24 estimates), we rate the stock as BUY with 12m PT of Rs1685.For all recommendations report, click hereDisclaimer: The views and investment tips expressed by investment experts/broking houses/rating agencies on moneycontrol.com are their own, and not that of the website or its management. Moneycontrol.com advises users to check with certified experts before taking any investment decisions.Shriram Finance - 01 -01-2023 - yes",Shriram Finance Ltd.
"  February 03, 2023 / 06:17 PM IST  ",Buy Shriram Finance; target of Rs 1486: Prabhudas Lilladher,"Prabhudas Lilladher's research report on Shriram FinanceShriram Finance (SHFL) reported stronger than expected AUM growth in Q3 (4.8%QoQ/13.2% YoY), led by robust growth in passenger vehicles (+20.9% YoY) and Personal/MSME loans (+62.9%/3.9%YoY). The company surprised positively on margins, which came in at 8.52% vs 8.3% (Q2FY23) as cost of borrowing saw only 6bps increase in Q3FY23.OutlookWe continue with our 16% AUM CAGR for FY23-25E and maintain ‘BUY’ rating with TP of Rs1,486 (unchanged) at 1.3x on Sep’24E PABV. Re-rating can happen if SHFL maintains its growth momentum, while retaining asset quality in personal and MSME loan book.For all recommendations report, click hereDisclaimer: The views and investment tips expressed by investment experts/broking houses/rating agencies on moneycontrol.com are their own, and not that of the website or its management. Moneycontrol.com advises users to check with certified experts before taking any investment decisions.Shriram Finance - 01 -01-2023 - prabhu",Shriram Finance Ltd.
"  February 04, 2023 / 12:22 AM IST  ","Sun TV Network Standalone December 2022 Net Sales at Rs 857.51 crore, down 17% Y-o-Y",,Sun TV Network Ltd.
"  February 04, 2023 / 12:22 AM IST  ","Tata Power Standalone December 2022 Net Sales at Rs 5,296.17 crore, up 146.65% Y-o-Y","Net Sales at Rs 5,296.17 crore in December 2022 up 146.65% from Rs. 2,147.20 crore in December 2021.Quarterly Net Profit at Rs. 1,504.34 crore in December 2022 up 2990.9% from Rs. 48.67 crore in December 2021.EBITDA stands at Rs. 2,641.02 crore in December 2022 up 340.68% from Rs. 599.30 crore in December 2021.Tata Power EPS has increased to Rs. 4.70 in December 2022 from Rs. 0.15 in December 2021.Tata Power shares closed at 206.30 on February 02, 2023 (NSE) and has given -11.27% returns over the last 6 months and -18.41% over the last 12 months.",Tata Power Co. Ltd.
"  February 04, 2023 / 12:21 AM IST  ","Tube Investment Standalone December 2022 Net Sales at Rs 1,709.69 crore, up 0.49% Y-o-Y",,Tube Investments of India Ltd.
"  February 03, 2023 / 04:32 PM IST  ","Zydus Life Standalone December 2022 Net Sales at Rs 2,086.90 crore, up 14.02% Y-o-Y",,Zydus Lifesciences Ltd.
