date,title,content,company
"  February 03, 2023 / 08:01 AM IST  ",NSE adds Adani Ports to ban list for February 3,"The National Stock Exchange on Thursday added Adani Ports and Special Economic Zone to its F&O ban list for February 3, the first day of weekly series, after the scrip crossed 95 percent of the market-wide position limit.This is the second stock in the F&O ban list for Friday. Adani Ports has been under pressure for last several sessions along with other Adani Group stocks, after American short seller, Hindenburg Research accused Adani Group of using tax havens and flagged debt concerns in a report.Adani Ports lost more than 50 percent from its high of Rs 988 on September 20, 2022 along with severe correction in other Adani Group stocks.Also the National Stock Exchange (NSE) has put Adani Ports as well as Adani Enterprises, and Ambuja Cements under additional surveillance measure (ASM) framework effective February 3, 2023 to curb short-selling, especially after carnage in Adani Group stocks.""Applicable rate of margin shall be 50 percent or existing margin, whichever is higher, subject to maximum rate of margin capped at 100 percent w.e.f. February 6, 2023 on all open positions as on February 3 and new positions created from February 6,"" the exchange said in its circular. The stocks under surveillance shall be retained in Stage-I as applicable for a minimum period of 5 trading days and shall be eligible for review from 6th trading day onwards.Further there was huge short built-up in Adani Ports and was at the second spot after Birlasoft in the short build-up list on February 2. The stock was down 6 percent on Thursday.Ambuja Cements is already in the F&O ban list, which has seen short-covering led buying and was up 5.5 percent on Thursday. Adani Group is the second largest cement company in India, after buying ACC and Ambuja Cements last year.If derivative contracts in securities cross 95 percent of the market-wide position limit, they end up in the ban list, the NSE said.“All clients/members shall trade in the derivative contracts of the said security only to decrease their positions through offsetting positions. Any increase in open positions shall attract appropriate penal and disciplinary action,” it said.During the ban, traders are not allowed to take fresh positions in stocks but can start reducing their positions. The F&O ban rule helps reduce speculation in stocks.The market-wide position limit, which is set by stock exchanges, is the maximum number of outstanding open positions (buy and sell) in the F&O contracts of a security. If the open interest in a stock crosses 95 percent of the market-wide position limit, its F&O contracts enter the ban period.Normal trading in a security resumes only after the aggregate open interest across exchanges comes down to 80 percent or below the market-wide position limit, the NSE said.",Ambuja Cements Ltd.
"  February 05, 2023 / 07:06 PM IST  ",Buy Ashok Leyland; target of Rs 200: Prabhudas Lilladher,"Prabhudas Lilladher's research report on Ashok LeylandWe marginally increase our EPS estimates and reduce our target multiple to 13x (14x earlier), in line with long-term average (excl. COVID-19 period), as we enter the mid CV upcycle. Ashok Leyland’s (AL) 3QFY23 EBITDA margin at 8.8% (+230bps QoQ) beat street estimates on the back of (1) higher realization led by price hikes (4-4.5% FYTD23), (2) commodity prices softening (gross margin +170bps QoQ) (some of it might get reversed due to de-inventorization), (3) better product mix (sold higher ASP products) and (4) operating leverage. Going ahead, demand outlook remains robust as MHCV segment should continue to outperform led by strong fundamentals and AL, in our view, is well placed to sustain its market share gains (c32% vs 27% in FY22) led by CV upcycle, bus segment revival, network expansion, new products. LCVs will benefit from strong end market demand and filling of white spaces.OutlookAdditionally, price retention due to strong demand, lower input prices and operating leverage will lead to margin expansion (EBITDA margin expansion of 275bps over FY23-25E). Maintain ‘BUY’ at target price of Rs 200 on Dec-24E EV/EBITDA (includes ~Rs 10 for HLF).For all recommendations report, click hereDisclaimer: The views and investment tips expressed by investment experts/broking houses/rating agencies on moneycontrol.com are their own, and not that of the website or its management. Moneycontrol.com advises users to check with certified experts before taking any investment decisions.Ashok Leyland - 01 -01-2023 - prabhu",Ashok Leyland Ltd.
"  February 05, 2023 / 03:25 PM IST  ",Buy Ashok Leyland; target of Rs 181: Sharekhan,"Sharekhan's research report on Ashok LeylandQ3FY2023 results was above expectations as ALL reported 230 bps q-o-q expansion in EBITDA margin led by healthy product mix and commodity cost benefit. ALL is expected to benefit from its aggressive strategy of growing its market share through increased penetration across all regions, new product launches and well placed to benefit from e-mobility movement. The stock is trading at at P/E of 18x and EV/EBITDA of 10.5x its FY2025E estimates.OutlookWe retain our Buy rating on Ashok Leyland Limited (ALL) with an unchanged PT of Rs 181, owing to its market share gains in MHCV segment and strong operating performance.For all recommendations report, click hereDisclaimer: The views and investment tips expressed by investment experts/broking houses/rating agencies on moneycontrol.com are their own, and not that of the website or its management. Moneycontrol.com advises users to check with certified experts before taking any investment decisions.Ashok Leyland - 01 -01-2023 - khan",Ashok Leyland Ltd.
"  February 05, 2023 / 02:54 PM IST  ",Buy Ashok Leyland; target of Rs 185: Motilal Oswal,"Motilal Oswal's research report on Ashok LeylandAL’s strong 3QFY23 performance was driven by a better mix, price hikes and commodity costs (healthy margins). The stable demand environment and improving pricing power should boost earnings. AL is the best play on the CV cycle recovery, along with market share recovery and the expansion of revenue/profit pools. We raise our FY23/FY24 EPS estimates by 17%/4% to account for better realizations and improving pricing power.OutlookMaintain BUY with a TP of INR185 (11x Dec-24 EV/EBITDA + ~INR14/share of NBFC).For all recommendations report, click hereDisclaimer: The views and investment tips expressed by investment experts/broking houses/rating agencies on moneycontrol.com are their own, and not that of the website or its management. Moneycontrol.com advises users to check with certified experts before taking any investment decisions.Ashok Leyland - 01 -01-2023 - moti",Ashok Leyland Ltd.
"  February 04, 2023 / 01:18 PM IST  ","Ashok Leyland Standalone December 2022 Net Sales at Rs 9,029.67 crore, up 63.13% Y-o-Y","Net Sales at Rs 9,029.67 crore in December 2022 up 63.13% from Rs. 5,535.16 crore in December 2021.Quarterly Net Profit at Rs. 361.34 crore in December 2022 up 6173.26% from Rs. 5.76 crore in December 2021.EBITDA stands at Rs. 828.93 crore in December 2022 up 243.2% from Rs. 241.53 crore in December 2021.Ashok Leyland EPS has increased to Rs. 1.23 in December 2022 from Rs. 0.02 in December 2021.Ashok Leyland shares closed at 152.05 on February 02, 2023 (NSE) and has given 2.39% returns over the last 6 months and 11.68% over the last 12 months.",Ashok Leyland Ltd.
"  February 03, 2023 / 06:35 PM IST  ",Buy Cholamandalam Inv. and Finance; target of Rs 880: Motilal Oswal,"Motilal Oswal's research report on Cholamandalam Inv. and FinanceCIFC’s PAT grew 31% YoY to INR6.8b, while NII grew 17% YoY to INR16b in 3QFY23. PPoP rose 13% YoY to INR10.8b. NIM/Core spreads were sequentially stable at 7.0%/6.7%, with an increase in borrowing costs offset by an expansion in yields. 9MFY23 PAT grew 24% YoY to ~INR18b.  GS3/NS3 improved ~33bp/20bp QoQ to 3.5%/2.1%, while PCR on S3 decreased ~50bp QoQ to ~41%. Credit costs stood at 0.7% (annualized) v/s 1.4% YoY. Calculated write-offs stood at ~INR2b (~INR2.7b in 2QFY23).  Disbursements remained strong and grew 100% YoY to INR455b in 9MFY23. New businesses contributed ~22% to the disbursement mix in 3QFY23. New businesses spawned by CIFC are expected to see an improvement in the disbursement run rate and contribute ~11% to the AUM mix by FY24E. Growth in new businesses could offset the margin compression and help CIFC deliver the guided pre-tax RoTA of 3.5%.OutlookWe model a disbursement/AUM/PAT CAGR of 16%/21%/23% over FY23/ FY24/FY25. We increase our FY23E EPS by ~5% to factor in lower credit costs and higher loan growth. While we estimate a margin compression of ~40bp in FY24, we reiterate that CIFC has levers on cost ratios and business AUM growth to deliver a healthy RoA/RoE profile of 2.6%/21% in FY25. Maintain BUY with a TP of INR880 (based on 3.9x Sep’24 BVPS).For all recommendations report, click hereDisclaimer: The views and investment tips expressed by investment experts/broking houses/rating agencies on moneycontrol.com are their own, and not that of the website or its management. Moneycontrol.com advises users to check with certified experts before taking any investment decisions.Cholamandalam Inv. & Finance - 01 -01-2023 - moti",Cholamandalam Investment and Finance Company Ltd.
"  February 03, 2023 / 06:20 PM IST  ",Buy Cholamandalam Investment and Finance Company; target of Rs 900: Sharekhan,"Sharekhan's research report on Cholamandalam Investment and Finance CompanyCholamandalam Investment and Finance Company reported strong earnings growth of 31% y-o-y, led by a 36% y-o-y decline in provisions, significantly above consensus and our estimates. AUM growth also exceeded expectations with 31% y-o-y growth, about 3% higher than expectation, driven by strong disbursements growth of 68% y-o-y. New businesses segment – consumer and small business loans contributed 22% to the disbursement mix in Q3. NIM (calculated as a % of average AUM) was lower by 13 bps q-o-q at 6.5% on expected lines. On the positive side, Chola has significantly increased incremental lending rates in the vehicle finance book and the rest of the book is anyway floating rate book. However, we believe there would be further NIM pressure in the near term due to a higher share of floating rate liabilities and lower share of floating rate assets. Gross Stage-2 assets declined by ~115 bps q-o-q to 4.91%, while GS3/NS3 assets fell by 33bps/18bps q-o-q to 3.51%/2.07%, respectively. PCR on Stage-3 assets declined by ~52bps q-o-q to ~41%.OutlookAt the CMP, the stock trades at 4.3x/3.6x/3.3x its FY2023E/FY2024E/FY2025E ABV estimates, respectively. We maintain Buy with an unchanged PT of Rs. 900.For all recommendations report, click hereDisclaimer: The views and investment tips expressed by investment experts/broking houses/rating agencies on moneycontrol.com are their own, and not that of the website or its management. Moneycontrol.com advises users to check with certified experts before taking any investment decisions.Cholamandalam Investment and Finance Company - 01 -01-2023 - khan",Cholamandalam Investment and Finance Company Ltd.
"  February 03, 2023 / 06:18 PM IST  ",Buy Cholamandalam Investment and Finance Company; target of Rs 885: HDFC Securities,"HDFC Securities' research report on Cholamandalam Investment and Finance CompanyChola’s Q3FY23 earnings were ahead of estimates on the back of better-thanexpected AUM growth (+31% YoY), steady NIMs (7.6%), and improving asset quality. Chola further pushed the accelerator on business growth with strong disbursal growth (+68% YoY). The management remains upbeat about growth prospects across segments—buoyant vehicle financing cycle, strong home loans demand and growing traction in new businesses (~21% of disbursals, and 7% of AUM) driven by expanding distribution network. While management has indicated maintaining stringent credit filters on the new businesses (target pretax RoA of ~3.5%), we continue to monitor potential segment-wise profitability from these businesses. Asset quality stabilised with the stressed pool (GS-II + GS-III) now at 8.4% (pre-Covid levels of ~7%) as against IRAC-basis NNPA at 3.8%.OutlookWe tweak our FY23/FY24 earnings by 1%/2% to factor in higher AUM growth, offset by rising opex intensity from new businesses; maintain BUY with a revised TP of INR885 (4.5x Sep-24 ABVPS).For all recommendations report, click hereDisclaimer: The views and investment tips expressed by investment experts/broking houses/rating agencies on moneycontrol.com are their own, and not that of the website or its management. Moneycontrol.com advises users to check with certified experts before taking any investment decisions.Cholamandalam Investment and Finance Company - 01 -01-2023 - hdfc",Cholamandalam Investment and Finance Company Ltd.
"  February 03, 2023 / 06:28 PM IST  ",Buy Coal India; target of Rs 280: Sharekhan,"Sharekhan's research report on Coal IndiaConsolidated Q3FY23 operating profit of Rs. 10,389 crore (up 52% y-o-y) lagged our estimate as margins were hit by higher contractual expenses (up 21%/42% y-o-y/q-o-q) and lower blended realisations. PAT of Rs. 7,756 crore (up 70% y-o-y) was 3.6% below estimates led by miss in margin, higher depreciation and tax rate partially offset by higher other income. FSA/E-auction realisation of Rs. 1,482/Rs. 5,047 per tonne, missed our estimate by 4%/5%. E-Auction premium came at 241% versus 329% in Q2FY23. Coal offtake volume at 176 million tonnes (up 1.2% y-o-y; up 13.8% q-o-q) was in-line provisional numbers declared by company. FSA volumes rose by 9% y-o-y to 158 mt but the same was offset by a steep 44% y-o-y decline in e-Auction volumes to 15 mt. We thus expect a strong 20% PAT CAGR over FY22-25E. A likely FSA realisation hike could improve earnings growth outlook. Potential stake sale in Bharat Coking Coal Limited (BCCL) and a subsequent listing would unlock value.OutlookThe stock trades at an attractive valuation of 5x/4.5x its FY24E/FY25E EPS (close to trough valuation) and offers a high dividend yield of 12%. Hence, we maintain a Buy with an unchanged PT of Rs. 280.For all recommendations report, click hereDisclaimer: The views and investment tips expressed by investment experts/broking houses/rating agencies on moneycontrol.com are their own, and not that of the website or its management. Moneycontrol.com advises users to check with certified experts before taking any investment decisions.Coal India - 01 -01-2023 - khan",Coal India Ltd.
"  February 05, 2023 / 03:25 PM IST  ",Buy Dabur India; target of Rs 640: Sharekhan,"Sharekhan's research report on Dabur IndiaDabur’s Q3FY2023 numbers were weak with muted revenue growth of 3.4% y-o-y to Rs. 3,043 crore. Volume decline stood at 3% (price led growth of 6.5%). A rural slowdown and delayed winter hit performance. High input cost inflation and an unfavourable sales mix led to a 283 bps/129 bps y-o-y decline in gross margin/OPM to 45.5%/20%, respectively; while PAT fell by 5.5% y-o-y to Rs. 477 crore. Revenue and PAT are expected to clock a 13% and 16% CAGR during FY2022-25 backed by sustained market share gains, expansion of distribution network, investments on power brands, new launches and cost-saving initiatives.OutlookThe stock trades at 40.8x/34.0x its FY2024E/25E EPS. We maintain a Buy on the stock with a revised price target of Rs. 640.For all recommendations report, click hereDisclaimer: The views and investment tips expressed by investment experts/broking houses/rating agencies on moneycontrol.com are their own, and not that of the website or its management. Moneycontrol.com advises users to check with certified experts before taking any investment decisions.Dabur India - 01 -01-2023 - khan",Dabur India Ltd.
"  February 05, 2023 / 02:55 PM IST  ",Buy Dabur; target of Rs 650: Motilal Oswal,"Motilal Oswal's research report on DaburWeak rural demand and delayed winter led to 3% volume decline for Dabur in 3QFY23. Management indicated that rural demand started exhibiting green shoots towards the end of 3QFY23 and the outlook is getting gradually better. We have also baked in financials of the recently acquired ‘Badshah’ brand from 4QFY23 onwards. Despite near-term challenges, Dabur (with nearly half of its domestic sales coming from rural) remains a good play on the incipient but gradual rural demand recovery theme.OutlookMaintain BUY; we retain our target P/E multiple of 45x, as we roll forward to FY25E EPS to arrive at our TP of INR650.For all recommendations report, click hereDisclaimer: The views and investment tips expressed by investment experts/broking houses/rating agencies on moneycontrol.com are their own, and not that of the website or its management. Moneycontrol.com advises users to check with certified experts before taking any investment decisions.Dabur - 01 -01-2023 - moti",Dabur India Ltd.
"  February 05, 2023 / 01:54 PM IST  ",Buy Dabur India; target of Rs 700: ICICI Direct,"ICICI Direct's research report on Dabur IndiaDabur India (DIL) is one of the biggest FMCG companies with a presence in Ayurveda based products across categories. The company has a substantial market share in health supplement, OTC & Ethical products, oral care, hair care, home care & juices. The company has a total distribution reach of 6.9 million retail outlets with direct reach of 1.3 million outlets. It plans to increase direct distribution to 1.5 million outlets in the next two years. Dabur also derives ~50% of its sales through rural regions with a presence in 100,000 villages.OutlookWe maintain our BUY rating on the stock. We value the stock at Rs 700 on ascribing 52x FY25 earnings multiple.For all recommendations report, click hereDisclaimer: The views and investment tips expressed by investment experts/broking houses/rating agencies on moneycontrol.com are their own, and not that of the website or its management. Moneycontrol.com advises users to check with certified experts before taking any investment decisions.Dabur India - 01 -01-2023 - ic",Dabur India Ltd.
"  February 03, 2023 / 10:18 AM IST  ","Dabur India: Volume, margin recovery a work in progress","                        Highlights

	Results broadly in line with expectations
	Recovery of rural markets under way
	Steady market share gains across portfolio
	Investors with a long-term view can accumulate and add stock on declines

Dabur India’s (DIL; CMP: Rs 554; Market capitalisation: Rs 98,138 crore) India business grew by 9 percent and international business by 14 percent on a three-year CAGR (compounded annual growth rate) basis.

For two quarters in a row, the inflationary impact was more severe in rural markets as marked by down trading and the...
                    ",Dabur India Ltd.
"  February 04, 2023 / 12:24 AM IST  ","Divis Labs Standalone December 2022 Net Sales at Rs 1,689.83 crore, down 31.5% Y-o-Y","Net Sales at Rs 1,689.83 crore in December 2022 down 31.5% from Rs. 2,466.77 crore in December 2021.Quarterly Net Profit at Rs. 310.90 crore in December 2022 down 65.73% from Rs. 907.22 crore in December 2021.EBITDA stands at Rs. 525.76 crore in December 2022 down 52.91% from Rs. 1,116.52 crore in December 2021.Divis Labs EPS has decreased to Rs. 11.71 in December 2022 from Rs. 34.17 in December 2021.Divis Labs shares closed at 3,267.00 on February 02, 2023 (NSE) and has given -14.50% returns over the last 6 months and -23.35% over the last 12 months.",Divi's Laboratories Ltd.
"  February 03, 2023 / 02:58 PM IST  ","Divis Labs falls 14%, sinks to 30-month low after a disappointing Q3","Divis Laboratories' share price plunged below Rs 3,000 on February 3, falling more than 13 percent after a significant deterioration in quarterly earnings.At 2.35 pm, the stock was trading at Rs 2,803 on the NSE, the lowest level since August 7, 2020.The active pharmaceutical ingredients manufacturer recorded a consolidated profit of Rs 306.8 crore in the December quarter of FY23, falling 66 percent on-year and 38 percent sequentially, impacted by lower topline as well as disappointing operating performance.Consolidated revenue from operations at Rs 1,708 crore was down 31.5 percent compared to the year-ago period, Divis Labs said in an exchange filing. The sequential decline in topline was 8 percent.On the operating front, EBITDA (earnings before interest, tax, depreciation and amortisation) tanked 63 percent year-on-year to Rs 408.3 crore for the December FY23 quarter and the sequential decline was 34 percent.The operating profit margin came in at 23.90 percent, down more than 2,000 basis points from the year-ago period and falling nearly 1,000 basis points on a sequential basis.Click Here To Read All Budget Related NewsTechnical ViewTechnically, the stock has formed a large bearish candlestick pattern on the daily charts with robust volumes, making lower highs lower lows formation for second straight session. It has seen a sharp breakout of the long horizontal support trendline adjoining lows of March 19, 2021 and November 14, 2022, indicating nervousness among participants.After a sharp dip, the stock has been trying hard to hold the big gap-up area created between August 7 and August 10, 2020 (after solid earnings performance for the June FY21 quarter).Generally, technical analysts say any breakdown of a big gap-up area can attract more selling pressure, which needs to be closely watched going ahead.",Divi's Laboratories Ltd.
"  February 04, 2023 / 12:38 AM IST  ","Emami Standalone December 2022 Net Sales at Rs 835.55 crore, down 4.54% Y-o-Y","Net Sales at Rs 835.55 crore in December 2022 down 4.54% from Rs. 875.30 crore in December 2021.Quarterly Net Profit at Rs. 224.62 crore in December 2022 up 6.39% from Rs. 211.12 crore in December 2021.EBITDA stands at Rs. 280.80 crore in December 2022 down 17.17% from Rs. 339.00 crore in December 2021.Emami EPS has increased to Rs. 5.09 in December 2022 from Rs. 4.75 in December 2021.Emami shares closed at 422.15 on February 02, 2023 (NSE) and has given -7.26% returns over the last 6 months and -15.20% over the last 12 months.",Emami Ltd.
"  February 03, 2023 / 10:18 AM IST  ","HDFC stock price rises on good Q3, Motilal Oswal expects 15% upside","Housing Development Finance Corporation (HDFC) share price edged higher in the morning session on February 3, a day after the company declared its December quarter earnings.The country's largest housing finance on February 2 reported a healthy 13 percent increase in its net profit increase in net profit for the December quarter on the back of strong loan disbursals and stable yield spreads.Housing Development Finance Corporation reported a net profit of Rs 3,690.80 crore for the December quarter, up from Rs 3,260.69 crore in the same quarter of the previous year.The lender's net interest income rose by 13 percent to Rs 4,840 crore for the December quarter from Rs 4,284 crore in the corresponding quarter of FY22. Its total interest income rose to Rs 14,457 crore from Rs 11,055 crore in the year-ago period. Total revenue from operations was Rs 15,230.12 crore, up from Rs 11,783.60 crore in the year-ago period.Individual loan disbursements grew by 23 percent year on year. Disbursements slowed in October and November but picked up in December, HDFC vice chairman Keki Mistry said.Catch all the market action on our live blogThe stock was quoting at Rs 2,645.75, up Rs 32.95, or 1.26 percent, on BSE.According to domestic research and broking firm Motilal Oswal, HDFC's core Pre-Provision Operating Profit (PPOP) grew 11 percent YoY to Rs 45.4 billion.""Margin expanded sequentially with Q9 FY23 net interest margin (NIM) at 3.5 percent (v/s 3.4 percent in H1 FY23). Credit costs declined ~7bp QoQ to ~25bp, aided by minor improvement in asset quality. Disbursements in the Individual segment were slightly above Rs 400 billion in Q3 FY23. Individual/total asset under management (AUM) rose 19 percent/13 percent YoY, respectively, with Individual loans comprising ~83 percent of AUM,"" it said.HDFC continues to have a strong ‘right to win’ in its standalone mortgage business. ""We maintain our buy rating on the stock, with a target of Rs 3,050 (premised on Sep’24E SoTP), an upside of 15 percent from the current market price,"" the brokerage firm said.The research said HDFC's quarter is in line and NIM was flat. The brokerage added that individual loan growth was robust, shedding non-compliant loans. Core PPoP was largely in-line and asset quality improved. RBI dispensation and deposit mobilisation would be the key monitorable, it added.With agency inputsDisclaimer: The views and investment tips expressed by experts on Moneycontrol are their own and not those of the website or its management. Moneycontrol advises users to check with certified experts before taking any investment decisions.​",Housing Development Finance Corporation Ltd.
"  February 04, 2023 / 12:53 AM IST  ","ITC Consolidated December 2022 Net Sales at Rs 17,704.52 crore, down 3.6% Y-o-Y","Net Sales at Rs 17,704.52 crore in December 2022 down 3.6% from Rs. 18,365.80 crore in December 2021.Quarterly Net Profit at Rs. 5,006.65 crore in December 2022 up 23.42% from Rs. 4,056.73 crore in December 2021.EBITDA stands at Rs. 7,300.13 crore in December 2022 up 21.27% from Rs. 6,019.59 crore in December 2021.ITC EPS has increased to Rs. 4.04 in December 2022 from Rs. 3.29 in December 2021.ITC shares closed at 378.60 on February 02, 2023 (NSE) and has given 22.86% returns over the last 6 months and 61.48% over the last 12 months.",ITC Ltd.
