date,title,content,company
"  September 29, 2023 / 01:51 AM IST  ",Daily Voice | Have green products and services theme on the radar; this analyst explains why,"Unmesh Sharma, Head of Institutional Equities at HDFC Securities, believes that renewable energy (RE) and electric vehicles will play a significant role in India's energy ecosystem. He sees this as an opportunity of a decade and recommends long-term investors keep it on their radar. According to HDFC Securities, NTPC is their top pick from the power sector to capitalise on this trend.Unmesh with more than 18 years of experience in the capital markets says they are cautious about the equity markets at the current levels as the headline index valuations are above the historic average. Sustained rise in crude price and weakness in key export markets add downside risk to corporate earnings moving forward, he feels.Do you think green products and services will be a big theme to play?We have an unequivocal view that renewable energy (RE) and electric vehicles representing green products and services are poised to play a huge role in the Indian energy ecosystem. RE generation capacity is expected to rise four-fold (96GW to 436 GW) by 2030 aided by stringent renewable power obligation (RPO) standards and decarbonisation efforts across markets. This will lead to augmented investments towards green hydrogen and the introduction of innovative alternative solutions such as energy storage systems, solar modules & electrolysers.We believe this RE growth story will require a mammoth Rs 20 trillion of funding to fuel the capex needed over the next decade for powering an ecosystem of 436 GW RE capacity. Moreover, electric vehicle foray of Indian players can scale up to significance if credible availability of Lithium as a fuel could be ensured.Also read | The F&O edge: Why Zerodha will sit pretty at topOverall, this is a decadal opportunity which should be on every long-term investor’s radar. Our pick from the power sector to play this theme is ""NTPC"".Are railway and defence sectors looking overbought now?As highlighted in our recent capex report, railways and defence sectors have been prime beneficiaries of the ongoing government’s strategy of investment-led growth in the country. We believe the order book growth and execution figures of these companies will continue to remain robust. Hence, from an earnings growth perspective, these sectors remain attractive, however, valuations are stretched for most of the stocks in these segments.So, we would advise a cautious approach towards investing in these stocks and wait for a moderation in valuations for a fresh entry. Among our coverage universe stocks, we see ""Bharat Forge"" getting benefitted from defence sector tailwinds.Do you see bottom-up opportunities in the pharma space from here on? Do you expect more deals like Glenmark in the space in the coming quarters?We have a positive view of the pharma sector as the segment offers various promising bottom-up ideas with strong earnings growth at moderate valuations. Healthy sales of limited competition products coupled with ease of pricing pressure are expected to support growth in US generics.Also read: Why Indian market is holding up better than global peers? S Naren explainsFurther, growth momentum will be led by niche launches. Moreover, domestic formulations are reflecting growth across therapies adding to optimism. We prefer ""Cipla"" from this space.Do you really feel the best way to play the current bull market is through financial space? Do you see multiple opportunities in the same space?While the financial sector remains a long-term proxy to play Indian markets, in the medium term, our preferred space to play the current bull market happens to be the industrial and capital goods sector. The stocks in this space are beneficiaries of India's infrastructure improvement and expansion push, a long-term structural theme.These stocks have run up a great deal over the past 6-12 months as earnings and expectations have been propelled by the ongoing CAPEX cycle in the economy. Due to the sharp rise, valuations in the space are currently quite stretched, thereby limiting capital appreciation in the short to medium term.Also read: NSE's plan to extend trading hours: Additional session to see lower volumes, higher volatilityWhile there is a structural story being played out in the space, it is not prudent to enter these stocks at their current levels. Investors must either look for value picks or be patient and wait for valuations to correct. Our top pick from this sector is ""L&T"".Q: What are the external headwinds for credit growth in the banking space?We believe that the strongest headwind to credit growth currently is the possible deposit growth moderation going forward. The increased propensity of Indian households to invest in financial assets such as Mutual Funds, Life Insurance funds, etc. means a higher competition for banks to attract deposits. Additionally, the loan servicing obligations of the ~25 percent increase in total system credit over the past 18 months, will decrease the percentage of income that households can potentially save.These factors can be possible deterrents to deposit growth in the future. Another risk factor to credit growth can possibly be asset quality headwinds in the system. While the overall banking system is currently healthy, very early signs of stress can be seen around, specifically in the unsecured retail space.If the NPAs for the system start inching up gradually, banks might tighten their credit filters, thereby slowing down credit growth. We prefer ""ICICI Bank"" among banks, given their deposit mobilization capability.Is it time to be cautious about the equity markets after the recent peak seen by the benchmark indices?We are cautious regarding the equity markets at the current levels. The headline index Nifty is currently trading at ~19x FY25 earnings which is above its historic average, indicating that any incremental gains from here must come from improving earnings.Sustained rise in crude price and weakness in key export markets add downside risk to corporate earnings moving forward. Given the current underlying variables, we remain careful about the equity markets in the short to medium term.Do you see more downside in the midcap and smallcap segments?The underlying macro-variables do not support current elevated valuation levels for the midcap and smallcap segments. There is a resurgence of uncertainty surrounding input prices, as seen by increasing crude oil prices over the past month. Corporate earnings of smaller companies are threatened more by input cost inflation as they typically do not have enough pricing power to pass on the costs to their consumers.The looming threat to corporate earnings, coupled with above-average valuations, make us watchful while investing in mid and small-cap space currently. Relatively, between these two categories, we prefer smallcaps (trading at 24x 1-year forward earnings) to midcaps (trading at 29x 1-year forward earnings).Disclaimer: The views and investment tips expressed by investment experts on Moneycontrol.com are their own and not those of the website or its management. Moneycontrol.com advises users to check with certified experts before taking any investment decisions.",NTPC Ltd.
"  September 29, 2023 / 06:02 AM IST  ","TCS continues to be India's most valuable brand, but combined value of top brands drops 4%","Tata Consultancy Services (TCS) continues to be India's most valuable brand at $43 billion, according to Kantar BrandZ Top 75 most valuable Indian brands report.TCS continues to successfully capitalise on global demand for digital transformation, despite a tough year for the business technology category in general, the data, insights and consulting company said.However, the uncertainty in global markets has resulted in decline in the total value of top 75 brands. ""Brands like TCS and Infosys have seen decline in brand value due to their exposure to overseas sales. Some of the growth these firms had last year was one off and was because of their customers who were spending big on tech. But that has settled down now,"" Deepender Rana, Executive Managing Director- South Asia, Insights Division, Kantar, told Moneycontrol.The decline has been driven by brands in the business technology and services platforms category, which have a major presence in international markets, and therefore have been impacted by global pressures, recession threats and geopolitical instability, the report said.India’s top 75 brands have a combined brand value of $379 billion, a decline of 4 percent from 2022. TCS and Infosys recorded a drop of 6 percent and 17 percent, respectively in 2023.""India remains resilient as there is only a 4 percent drop in brand value of the most valuable brands. However, globally there is a 20 percent drop. India continues to be strong despite the cooling of post-Covid bounce because of the strong domestic consumption. For B2B (business-to-business) tech brands, they have a dependence on overseas sales and this is where the global economy has been impacted more whereas India has continued to grow. Even within technology, global is down by 23 percent and India tech is down by 14 percent. So, it is a positive story for India and Indian brands,"" Rana added.He further said that India's GDP (gross domestic product) growth has been 7 percent CAGR (compound annual growth rate) over the last 10 years while brand value growth is 19 percent. ""Indian brands are significant value creators for our economy. We expect this trend to accelerate in the next decade as Indian brands don’t just thrive in India, but also explore growth overseas.""The automotive category produced the top 75’s two fastest risers -- TVS with a brand value of $1.90 billion and Mahindra at $2.01 billion. The category recorded the second highest category growth at 19 percent.""India’s automotive brands have quickly responded to changing consumer needs, notably the shift in preference from hatchbacks to SUVs, and the demand for electric vehicles,"" the report said.TVS gained 59 percent in value and Mahindra grew its value by 48 percent.The ranking’s 16 financial services brands contribute the biggest chunk of its total value. ""They grew 6 percent due to the boom in digital banking, led by Axis Bank and ICICI Bank.Telecom providers also performed strongly, resulting in a 17 percent rise in total brand value. Airtel saw the advantage of the end of the price wars, said Soumya Mohanty, Managing Director & Chief Client Officer- South Asia, Insights Division, Kantar. ""Airtel was also on the global list and was in top 10 brands and has the highest brand value growth worldwide,"" she added.“There is great diversity within the India Top 75 brands. They are a combination of established names and dynamic young brands, both global and local in footprint. What they have in common is their ability to be essentially Indian. Through a deep and detailed understanding of consumers in the market, and adopting the local culture and ethos, even huge international brands are seen and cherished as homegrown,"" Mohanty said.",Tata Consultancy Services Ltd.
"  September 29, 2023 / 09:49 PM IST  ",Vedanta Demerger: 5 Key takeaways,"Vedanta announced the demerger of its business to create 6 different entities on September 29.  The newly created entities will be Vedanta Aluminium, Vedanta Oil and Gas, Vedanta Power, Vedanta Steel and Ferrous Materials, Vedanta Base Materials and Vedanta Ltd.In a conference call following the announcement of the demerger, the company’s management spoke about the reason for the demerger,  the dividend policy and debt allocation for the demerged entities.It further said that the demerger will give global and Indian investors the potential to invest in their preferred vertical, broadening the investor base for Vedanta assets.Read more: Meet Anil Agarwal, the man behind Vedanta’s mega ambitious demergerAlso read: Vedanta aims to attract sovereign wealth funds through demerger, eyes debt rationalisationAlso read: S&P Global downgrades Vedanta Resources to CCC on potential bonds extension",Vedanta Ltd.
"  September 30, 2023 / 06:17 AM IST  ","Vedanta aims to attract sovereign wealth funds through demerger, eyes debt rationalisation","By demerging to six separate entities, Vedanta Ltd aims to attract global investors, particularly sovereign wealth funds, to invest in pure-play assets, said the management.""We aim to reassign risk of each business within the respective entities and mitigate the potential risk associated with one business affecting others,"" said Arun Misra, executive director, Vedanta Ltd in an analyst concall held post the demerger announcement.Billionaire Anil Agarwal-owned Vedanta Limited on September 29 announced its plan for six separate entities: Vedanta Aluminium, Vedanta Oil & Gas, Vedanta Power, Vedanta Steel and Ferrous Materials, Vedanta Base Metals and the residual Vedanta Limited.The demerger is planned as a vertical split, for every one share of Vedanta Limited, the shareholders will additionally receive one share of each of the five newly listed companies.""Independent entities will have their own growth strategies without being constrained by the overarching structure. They will have more nimble database, can innovate faster, make strategic decisions more decisively, and respond proactively to market disruption,"" Misra added.This will also attract more foreign capital as institutional investors tend to focus on specific businesses, he said.Debt re-allocationAs of June end 2023, Vedanta Limited's consolidated net debt stood at Rs 59,192 crore. Gross debt stood at Rs 73,484 crore, with cash and cash equivalents of Rs 14,292 crore. Debt rationalisation has been a priority for the management, as perceived lending limits and equity capital market access is relatively restricted under the current structure.""Company law is clear on how to allocate debt in case of demergers. We will follow that process,"" said Misra.",Vedanta Ltd.
"  September 29, 2023 / 08:22 PM IST  ","Meet Anil Agarwal, the man behind Vedanta’s mega ambitious demerger","Vedanta announced on September 29 the demerger of its business into six listed entities for significant value unlocking. The six companies include Vedanta Limited, Vedanta Steel and Ferrous Materials, and Vedanta Base Metals. The company’s chairman Anil Agarwal, the man behind the ambitious demerger, said: “By demerging our business units, we believe that will unlock value and potential for faster growth in each vertical.”Agarwal, who is counted among India’s richest, had a humble beginning. His grit and mettle might have taken him places now, but the meek Patna boy who could only speak two words in English – “yes” and “no” -- had started out as a scrap dealer in the 1970s.The founder and chairman of the Vedanta Group was born in 1954 to a Marwari family in Bihar. Instead of going to college, he began his career at a young age by joining his father’s small aluminium conductor business.At the age of 19, he had set out for the city of dreams -- Mumbai – where he began collecting scrap metal from cable companies and selling them. This earned him a good profit over time and he acquired his first company in 1976 by using all his savings and seeking help from friends and family.Copper manufacturer Shamsher Sterling Corporation, the company he acquired, was at the brink of bankruptcy at the time.  For the next 10 years, the mining whiz ran both businesses side by side before setting up a factory – Sterlite Industries -- in 1986. Soon, he realised he would have to contain the input cost and decided to start manufacturing the requisite metals himself instead of purchasing them. In 1993, Sterlite Industries became the first Indian private sector company to smelt copper.Over the next few years, he acquired several other companies such as Madras Aluminium, Bharat Aluminium Company (51 percent stakes), and state-run Hindustan Zinc Limited (HZL). It is these acquisitions that set Agarwal on the path to become a metal and mining magnate.In 2003, Anil Agarwal set up Vedanta Resources in London to tap in global capital. However, Vedanta had to deal with a string of bad luck with environment activists opposing his mining excavations. To add to it, the Centre had revoked Vedanta’s clearance to mine bauxite in 2010. His oil and gas business had suffered too, with the UPA government at the Centre denying him permission to expand Vedanta’s oil field in Rajasthan. During the same time, there was a slump in the international commodities market, prompting Agarwal to pull out of LSE in 2018 and making the company private.Over the next few years, Agarwal’s Vedanta acquired several mines across the globe and also made a foray into the semiconductor business.However, Anil Agarwal’s illustrious life does not stop at his achievements. A philanthrope, the Executive Chairman of Vedanta Resources Plc and the Chairman Emeritus of Vedanta Limited has reportedly vowed to donate most of his wealth to charity. That apart, he has made several donations over the years for the advancement of healthcare and education and also established the Vedanta Foundation.",Vedanta Ltd.
"  September 29, 2023 / 06:08 PM IST  ",Vedanta announces demerger to split business into six listed entities,"Billionaire Anil Agarwal-owned Vedanta Limited on September 29 announced creation of independent verticals through demerger of underlying companies, mainly its metals, power, aluminium, and oil and gas businesses to unlock potential value.“By demerging our business units, we believe that will unlock value and potential for faster growth in each vertical. While they all come under the larger umbrella of natural resources, each has its own market, demand and supply trends, and potential to deploy technology to raise productivity,” Anil Agarwal, Chairman of Vedanta, said in a statement after the board meeting.As stated, the company plans six separate listed entities, namely:• Vedanta Aluminium• Vedanta Oil & Gas• Vedanta Power• Vedanta Steel and Ferrous Materials• Vedanta Base Metals• Vedanta LimitedVedanta added that the de-merger is planned as a vertical split, for every 1 share of Vedanta Limited, the shareholders will additionally receive 1 share of each of the 5 newly listed companies. Source: VedantaThe Anil Agarwal-led conglomerate has a portfolio of assets among Indian and global companies with metals and minerals - zinc, silver, lead, aluminium, chromium, copper, nickel; oil and gas; a traditional ferrous vertical including iron ore and steel; and power, including coal and renewable energy; and is now foraying into manufacturing of semiconductors and display glass.Once demerged, each independent entity will have greater freedom to grow to its potential and true value via an independent management, capital allocation and niche strategies for growth, the company further stated.Commenting on the demerger news, Anil Agarwal, Chairman of Vedanta, said,“In line with Vedanta’s ethos, each company will continue to retain a strong commitment to the well-being of our workforce, our communities and our planet. Even as we move to new ways of running our businesses, we will remain steadfast to transform for good.”Vedanta Aluminium will be run by John Slaven, formerly of Alcoa and BHP. Vedanta Power will be run by Vibhav Agarwal. Vedanta Base Metals will be run by Chris Griffith. Vedanta Limited will be run by Arun Misra.""The new companies will remain committed to achieving net-zero carbon emissions by 2050 and net water positivity by 2030 with the aims to spend $5 billion over the next 10 years to accelerate this transition. In the process of transitioning to net zero we already secured 1.8 GW of Renewable Energy through power delivery agreement across our group companies,"" said Vedanta.Earlier today, Hindustan Zinc, a subsidiary of Vedanta had informed the stock exchanges that its board has decided to evaluate corporate restructuring alternatives to unlock growth. The idea behind the restructuring is to create separate entities for zinc, lead, silver and recycling businesses.With the possible restructuring, the company plans to unlock value for shareholders by creation of businesses which are positioned to better capitalise on their distinct market positions and deliver long-term growth. Along with that, the restructuring will also aim to set up an appropriate capital structure and capital allocation policies, uniquely to each business.Shares of Vedanta on September 29 soared nearly 7 percent to end at Rs 222.50 apiece on BSE. The stellar gains not just helped shares of Vedanta snap a seven-day losing streak but also see its best day in 2023 so far.Its subsidiary, Hindustan Zinc surged nearly 6 percent to its day's high of Rs 317.50. At 1.52 pm, shares of Hindustan Zinc were trading 5.25 percent higher at Rs 313.60 on the National Stock Exchange. The scrip closed at Rs 308.25 on September 29.",Vedanta Ltd.
