date,title,content,company
"  March 28, 2023 / 04:04 PM IST  ",Hold Dalmia Bharat; target of Rs 1750: Emkay Global Financial,"Emkay Global Financial's research report on Dalmia BharatDalmia Bharat’s (Dalmia’s) board has approved the sale of its entire 42.36% stake (owned through its subsidiary) in Dalmia Bharat Refractories (DBRL) to Sarvapriya Healthcare Solutions Private Ltd. (Sarvapriya, a promoter group company) for Rs8bn. The said transaction is largely in line with the company’s strategy of making Dalmia a pure-play cement company and exiting the non-core business/investments. Transaction details: Dalmia Cement (Bharat) Ltd (DCBL), a wholly-owned subsidiary of Dalmia, has entered into a binding agreement to sell its entire investment of 18.7mn shares (42.36% stake) of DBRL (an associate company) for a consideration of Rs8bn to Sarvapriya, a promoter group company. To recap, DBRL had executed a business transfer agreement with RHI Magnesita India (RHI) in Nov-22, for transfer of its 100% shareholding in Dalmia OCL (refractory business arm of DBRL) for a total consideration of Rs21bn (Rs3.9bn cash and 27mn shares in RHI at Rs632.5/sh, totaling Rs17bn). The transaction was concluded on Jan23.OutlookWe have a HOLD rating on the stock, with TP of Rs1,750/sh, based on 9x its FY25E EV/E.For all recommendations report, click hereDisclaimer: The views and investment tips expressed by investment experts/broking houses/rating agencies on moneycontrol.com are their own, and not that of the website or its management. Moneycontrol.com advises users to check with certified experts before taking any investment decisions.Dalmia Bharat - 28 -03 - 2023 - emkay",Dalmia Bharat Ltd.
"  March 28, 2023 / 03:33 PM IST  ",Buy Dalmia Bharat; target of Rs 2250: Sharekhan,"Sharekhan's research report on Dalmia BharatThe company announced divestment of its refractory business to promoter group entity for Rs. 800 crore, valuing at ~24x EV/EBITDA. Post-tax profit of Rs. 348 crore from the transaction to be accounted in FY2023. Proceeds from the sale of the refractory business, redemption of NCDs in Hippo Stores, and expected divestment of the balance 15% stake in IEX to aid in financing its growth plans. The company remains committed to achieving 75 MT and 110-130 MT cement capacities by FY2027 and 2031, while it would reach 54 MT cement capacity by FY2024, exceeding 49 MT target. Net Debt to EBITDA to remain below 2x.OutlookWe maintain our Buy rating on Dalmia Bharat with an unchanged PT of Rs.2,250, considering its strong growth potential led by capacity additions.For all recommendations report, click hereDisclaimer: The views and investment tips expressed by investment experts/broking houses/rating agencies on moneycontrol.com are their own, and not that of the website or its management. Moneycontrol.com advises users to check with certified experts before taking any investment decisions.Dalmia Bharat - 28 -03 - 2023 - khan",Dalmia Bharat Ltd.
"  March 28, 2023 / 01:33 PM IST  ",Neutral InterGlobe Aviation; target of Rs 2110: Motilal Oswal,"Motilal Oswal's research report on InterGlobe AviationWe attended IndiGo’s analyst meet at its iFly training center in Gurugram on 23rd March, 2023. Below are the key highlights from the meeting: Management boasts of one of the highest fleet utilization rates in the world and expects it to further improve over the next couple of years. Over the past six years, the company has doubled the number of domestic destinations to 77, while the number of international destinations has tripled to 26. In 3QFY23, the company operated 1,800 flights daily with On-Time Performance (OTP) of ~90% and its PAX stood at 22.3m. While the company forecasts strong overall demand in 4QFY23, yield is expected to reduce in the quarter due to seasonality. Nevertheless, it is still expected to remain above pre-covid levels.OutlookFurther, competition in the sector is expected to intensify with the resurgence of Air India and the entry of a new player Akasa Air. We value the stock at 7x FY25E EV/EBITDAR to arrive at our TP of INR2,110. We reiterate our Neutral rating on the stock.For all recommendations report, click hereDisclaimer: The views and investment tips expressed by investment experts/broking houses/rating agencies on moneycontrol.com are their own, and not that of the website or its management. Moneycontrol.com advises users to check with certified experts before taking any investment decisions.InterGlobe Aviation - 28 -03 - 2023 -moti",InterGlobe Aviation Ltd.
"  March 28, 2023 / 06:32 PM IST  ",Accumulate Torrent Power; target of Rs 550: Geojit,"Geojit's research report on Torrent PowerTorrent Power Ltd. (TPL) is one of the leading power utility companies in India, with functions across generation, transmission, and distribution. It has operations spread across Gujarat, Maharashtra, UP, and Karnataka. The distribution businesses foresee increased productivity as a result of decreased T&D losses and expansion ambitions to boost the top line. By FY25, we anticipate a 28% rise in renewable capacity, spurred by capacity augmentation. With the expected drop in gas prices, we believe that the gas plants’ efficiency will improve, resulting in increased profitability. The company is expected to maintain a debt/equity ratio of 0.7x in FY25, down from 0.9x in FY23, and an ROE of 16% in FY25.OutlookWe initiate TPL with an Accumulate rating and a target price of Rs. 550 based on a multiple of 1.62x FY25 P/Bk, considering its healthy balance sheet, solid performance in distribution circles, and the expectation that the PLFs of the generating units would pick up.For all recommendations report, click hereDisclaimer: The views and investment tips expressed by investment experts/broking houses/rating agencies on moneycontrol.com are their own, and not that of the website or its management. Moneycontrol.com advises users to check with certified experts before taking any investment decisions.Torrent Power - 28 -03 - 2023 - geo",Torrent Power Ltd.
"  March 28, 2023 / 06:26 AM IST  ",Vedanta board to discuss a fifth interim dividend for this year today,"The board of billionaire Anil Agarwal-led Vedanta Ltd may discuss today a fifth interim dividend for the financial year 2022-23.""The board of directors of the company is proposed to be scheduled on March 28 to consider and approve the fifth interim dividend on equity shares, if any, for the Financial Year 2022-23,"" the company said in a regulatory filing.Meanwhile, shares of Vedanta on Thursday (March 23) closed 4.87 percent lower at Rs 271.35 apiece on BSE amid reports which said that mining mogul Anil Agarwal is contemplating a stake sale in Vedanta as a last-resort option and is examining the possibility of selling less than 5 percent of the company.However, soon after the report, Vedanta termed any such talks of sale in oil-to-metals conglomerate as ''untrue and baseless.'According to the company's spokesperson, ''Any talk of stake sale in Vedanta Ltd is untrue and baseless.'' The media report said that a stake sale in Vedanta is a last resort for Agarwal and will only be considered if other fundraising options fail.Vedanta Resources which is a majority shareholder of Vedanta Ltd has been looking to reduce its debt through the sale of its zinc assets for a cash consideration of $2,981 million to Hindustan Zinc Ltd (HZL). However, the government which holds a 29.54 percent stake in Hindustan Zinc has sternly opposed this move.Vedanta holds 64.92 percent of the equity share capital of HZL.Vedanta Resources had recently said that it has fully repaid $250 million in loans it had taken from Barclays Bank and Standard Chartered Bank.",Vedanta Ltd.
